"No.","Time","Source","Destination","Protocol","Length","Info"
"1","0.000000000","192.168.105.174","224.0.0.251","MDNS","82","Standard query 0x026d PTR _quickshare._tcp.local, ""QM"" question"
"2","0.204996027","fe80::a081:24ff:fe63:2646","ff02::fb","MDNS","102","Standard query 0x026d PTR _quickshare._tcp.local, ""QM"" question"
"3","1.228170186","RaspberryPiF_99:32:b2","Broadcast","ARP","42","Who has 192.168.105.117? Tell 192.168.105.71"
"4","1.228254591","RaspberryPiF_23:9f:e9","RaspberryPiF_99:32:b2","ARP","42","192.168.105.117 is at b8:27:eb:23:9f:e9"
"5","1.238671412","192.168.105.71","192.168.105.117","TCP","74","52705  >  1883 [SYN] Seq=0 Win=32120 Len=0 MSS=1460 SACK_PERM TSval=3404570191 TSecr=0 WS=128"
"6","1.239073755","192.168.105.117","192.168.105.71","TCP","74","1883  >  52705 [SYN, ACK] Seq=0 Ack=1 Win=31856 Len=0 MSS=1460 SACK_PERM TSval=259602635 TSecr=3404570191 WS=128"
"7","1.244424186","192.168.105.71","192.168.105.117","TCP","66","52705  >  1883 [ACK] Seq=1 Ack=1 Win=32128 Len=0 TSval=3404570588 TSecr=259602635"
"8","1.244774771","192.168.105.71","192.168.105.117","MQTT","80","Connect Command"
"9","1.244908018","192.168.105.117","192.168.105.71","TCP","66","1883  >  52705 [ACK] Seq=1 Ack=15 Win=31872 Len=0 TSval=259602641 TSecr=3404570589"
"10","1.248999662","192.168.105.117","192.168.105.71","MQTT","70","Connect Ack"
"11","1.256590759","192.168.105.71","192.168.105.117","TCP","66","[TCP Previous segment not captured] 52705  >  1883 [ACK] Seq=27 Ack=5 Win=32128 Len=0 TSval=3404570600 TSecr=259602645"
"12","2.227517275","RaspberryPiF_7e:89:e6","Broadcast","ARP","42","Who has 192.168.105.117? Tell 192.168.105.183"
"13","2.227599285","RaspberryPiF_23:9f:e9","RaspberryPiF_7e:89:e6","ARP","42","192.168.105.117 is at b8:27:eb:23:9f:e9"
"14","3.244817680","192.168.105.183","192.168.105.117","TCP","74","50369  >  1883 [SYN] Seq=0 Win=32120 Len=0 MSS=1460 SACK_PERM TSval=3256276782 TSecr=0 WS=128"
"15","3.245205912","192.168.105.117","192.168.105.183","TCP","74","1883  >  50369 [SYN, ACK] Seq=0 Ack=1 Win=31856 Len=0 MSS=1460 SACK_PERM TSval=4176506696 TSecr=3256276782 WS=128"
"16","3.250968004","192.168.105.183","192.168.105.117","TCP","66","50369  >  1883 [ACK] Seq=1 Ack=1 Win=32128 Len=0 TSval=3256276795 TSecr=4176506696"
"17","3.369661179","192.168.105.71","192.168.105.117","TCP","78","[TCP Retransmission] 52705  >  1883 [PSH, ACK] Seq=15 Ack=5 Win=32128 Len=12 TSval=3404572707 TSecr=259602645"
"18","3.371806765","192.168.105.117","192.168.105.71","MQTT","71","Subscribe Ack (id=1)"
"19","3.386841388","192.168.105.71","192.168.105.117","TCP","66","52705  >  1883 [ACK] Seq=27 Ack=10 Win=32128 Len=0 TSval=3404572730 TSecr=259604767"
"20","3.475912701","192.168.105.183","192.168.105.117","MQTT","92","[TCP Previous segment not captured] , Subscribe Request (id=1) [res], Publish Message (id=2) [topic]"
"21","4.142282958","192.168.105.183","192.168.105.117","TCP","106","[TCP Retransmission] 50369  >  1883 [PSH, ACK] Seq=1 Ack=1 Win=32128 Len=40 TSval=3256277678 TSecr=4176506696"
"22","4.142598969","192.168.105.117","192.168.105.183","TCP","78","1883  >  50369 [ACK] Seq=1 Ack=41 Win=31872 Len=0 TSval=4176507593 TSecr=3256277678 SLE=15 SRE=41"
"23","4.147003967","192.168.105.117","192.168.105.71","MQTT","80","Publish Message [topic]"
"24","4.147080249","192.168.105.117","192.168.105.183","MQTT","70","Connect Ack"
"25","4.147363925","192.168.105.117","192.168.105.183","MQTT","71","Subscribe Ack (id=1)"
"26","4.154591104","192.168.105.183","192.168.105.117","TCP","66","50369  >  1883 [ACK] Seq=41 Ack=10 Win=32128 Len=0 TSval=3256277699 TSecr=4176507598"
"27","4.156479205","192.168.105.71","192.168.105.117","TCP","66","52705  >  1883 [ACK] Seq=27 Ack=24 Win=32128 Len=0 TSval=3404573501 TSecr=259605543"
"28","4.202852843","192.168.105.71","192.168.105.117","MQTT","80","Publish Message (id=2) [res]"
"29","4.204383485","192.168.105.117","192.168.105.71","MQTT","70","Publish Ack (id=2)"
"30","4.204459871","192.168.105.117","192.168.105.183","MQTT","78","[TCP Previous segment not captured] , Publish Message [res]"
"31","4.209816078","192.168.105.71","192.168.105.117","TCP","66","52705  >  1883 [ACK] Seq=41 Ack=28 Win=32128 Len=0 TSval=3404573554 TSecr=259605600"
"32","4.213654452","192.168.105.183","192.168.105.117","TCP","78","[TCP Dup ACK 26#1] 50369  >  1883 [ACK] Seq=41 Ack=10 Win=32128 Len=0 TSval=3256277758 TSecr=4176507598 SLE=14 SRE=26"
"33","4.213909698","192.168.105.117","192.168.105.183","TCP","70","[TCP Retransmission] 1883  >  50369 [PSH, ACK] Seq=10 Ack=41 Win=31872 Len=4 TSval=4176507665 TSecr=3256277758"
"34","4.219463040","192.168.105.183","192.168.105.117","TCP","66","50369  >  1883 [ACK] Seq=41 Ack=26 Win=32128 Len=0 TSval=3256277764 TSecr=4176507665"
"35","4.267113213","192.168.105.183","192.168.105.117","MQTT","82","Publish Message (id=3) [topic]"
"36","4.268301549","192.168.105.117","192.168.105.183","MQTT","70","Publish Ack (id=3)"
"37","4.268348360","192.168.105.117","192.168.105.71","MQTT","80","Publish Message [topic]"
"38","4.274299932","192.168.105.183","192.168.105.117","TCP","66","50369  >  1883 [ACK] Seq=57 Ack=30 Win=32128 Len=0 TSval=3256277818 TSecr=4176507719"
"39","4.277951323","192.168.105.71","192.168.105.117","TCP","66","52705  >  1883 [ACK] Seq=41 Ack=42 Win=32128 Len=0 TSval=3404573622 TSecr=259605664"
"40","4.324232009","192.168.105.71","192.168.105.117","MQTT","80","Publish Message (id=3) [res]"
"41","4.325508968","192.168.105.117","192.168.105.71","MQTT","70","Publish Ack (id=3)"
"42","4.326247525","192.168.105.117","192.168.105.183","MQTT","78","Publish Message [res]"
"43","4.332611230","192.168.105.71","192.168.105.117","TCP","66","52705  >  1883 [ACK] Seq=55 Ack=46 Win=32128 Len=0 TSval=3404573675 TSecr=259605721"
"44","4.335525938","192.168.105.183","192.168.105.117","TCP","66","50369  >  1883 [ACK] Seq=57 Ack=42 Win=32128 Len=0 TSval=3256277879 TSecr=4176507777"
"45","5.270338444","192.168.105.183","192.168.105.117","MQTT","82","Publish Message (id=4) [topic]"
"46","5.481895810","192.168.105.117","192.168.105.71","MQTT","80","Publish Message [topic]"
"47","5.481968864","192.168.105.117","192.168.105.183","MQTT","70","Publish Ack (id=4)"
"48","5.491108144","192.168.105.71","192.168.105.117","TCP","66","52705  >  1883 [ACK] Seq=55 Ack=60 Win=32128 Len=0 TSval=3404574835 TSecr=259606878"
"49","5.493506008","192.168.105.183","192.168.105.117","TCP","66","50369  >  1883 [ACK] Seq=73 Ack=46 Win=32128 Len=0 TSval=3256279036 TSecr=4176508933"
"50","5.536629904","192.168.105.71","192.168.105.117","MQTT","80","Publish Message (id=4) [res]"
"51","5.538470413","192.168.105.117","192.168.105.183","MQTT","78","Publish Message [res]"
"52","5.546715761","192.168.105.183","192.168.105.117","TCP","66","50369  >  1883 [ACK] Seq=73 Ack=58 Win=32128 Len=0 TSval=3256279092 TSecr=4176508989"
"53","5.561284092","192.168.105.117","157.90.247.99","NTP","90","NTP Version 4, client"
"54","5.743470221","157.90.247.99","192.168.105.117","NTP","90","NTP Version 4, server"
"55","5.757940341","192.168.105.117","192.168.105.71","MQTT","70","Publish Ack (id=4)"
"56","5.766591245","192.168.105.71","192.168.105.117","TCP","66","52705  >  1883 [ACK] Seq=69 Ack=64 Win=32128 Len=0 TSval=3404575111 TSecr=259607154"
"57","6.267143436","192.168.105.183","192.168.105.117","MQTT","82","Publish Message (id=5) [topic]"
"58","6.268488419","192.168.105.117","192.168.105.183","MQTT","70","Publish Ack (id=5)"
"59","6.268990455","192.168.105.117","192.168.105.71","MQTT","80","Publish Message [topic]"
"60","6.277965310","192.168.105.183","192.168.105.117","TCP","66","50369  >  1883 [ACK] Seq=89 Ack=62 Win=32128 Len=0 TSval=3256279821 TSecr=4176509719"
"61","6.280437087","192.168.105.71","192.168.105.117","TCP","66","52705  >  1883 [ACK] Seq=69 Ack=78 Win=32128 Len=0 TSval=3404575625 TSecr=259607665"
"62","6.329064547","192.168.105.71","192.168.105.117","MQTT","80","Publish Message (id=5) [res]"
"63","6.330255386","192.168.105.117","192.168.105.71","MQTT","70","Publish Ack (id=5)"
"64","6.330756484","192.168.105.117","192.168.105.183","MQTT","78","Publish Message [res]"
"65","6.338635551","192.168.105.71","192.168.105.117","TCP","66","52705  >  1883 [ACK] Seq=83 Ack=82 Win=32128 Len=0 TSval=3404575681 TSecr=259607726"
"66","6.338865047","192.168.105.183","192.168.105.117","TCP","66","50369  >  1883 [ACK] Seq=89 Ack=74 Win=32128 Len=0 TSval=3256279883 TSecr=4176509781"
"67","7.274170311","192.168.105.183","192.168.105.117","MQTT","82","Publish Message (id=6) [topic]"
"68","7.275525753","192.168.105.117","192.168.105.183","MQTT","70","Publish Ack (id=6)"
"69","7.276015434","192.168.105.117","192.168.105.71","MQTT","80","Publish Message [topic]"
"70","7.281228396","192.168.105.183","192.168.105.117","TCP","66","50369  >  1883 [ACK] Seq=105 Ack=78 Win=32128 Len=0 TSval=3256280825 TSecr=4176510726"
"71","7.286222599","192.168.105.71","192.168.105.117","TCP","66","52705  >  1883 [ACK] Seq=83 Ack=96 Win=32128 Len=0 TSval=3404576630 TSecr=259608672"
"72","7.342859297","192.168.105.71","192.168.105.117","MQTT","80","Publish Message (id=6) [res]"
"73","7.343982066","192.168.105.117","192.168.105.71","MQTT","70","Publish Ack (id=6)"
"74","7.344574561","192.168.105.117","192.168.105.183","MQTT","78","Publish Message [res]"
"75","7.351058494","192.168.105.71","192.168.105.117","TCP","66","52705  >  1883 [ACK] Seq=97 Ack=100 Win=32128 Len=0 TSval=3404576694 TSecr=259608740"
"76","7.357004076","192.168.105.183","192.168.105.117","TCP","66","50369  >  1883 [ACK] Seq=105 Ack=90 Win=32128 Len=0 TSval=3256280900 TSecr=4176510795"
"77","8.273264357","192.168.105.183","192.168.105.117","MQTT","82","Publish Message (id=7) [topic]"
"78","8.274632395","192.168.105.117","192.168.105.183","MQTT","70","Publish Ack (id=7)"
"79","8.275355730","192.168.105.117","192.168.105.71","MQTT","80","Publish Message [topic]"
"80","8.281458671","192.168.105.183","192.168.105.117","TCP","66","50369  >  1883 [ACK] Seq=121 Ack=94 Win=32128 Len=0 TSval=3256281824 TSecr=4176511725"
"81","8.285314898","192.168.105.71","192.168.105.117","TCP","66","52705  >  1883 [ACK] Seq=97 Ack=114 Win=32128 Len=0 TSval=3404577629 TSecr=259609671"
"82","8.938810226","192.168.105.71","192.168.105.117","MQTT","80","Publish Message (id=7) [res]"
"83","8.940038193","192.168.105.117","192.168.105.71","MQTT","70","Publish Ack (id=7)"
"84","8.940530422","192.168.105.117","192.168.105.183","MQTT","78","Publish Message [res]"
"85","8.945557504","192.168.105.71","192.168.105.117","TCP","66","52705  >  1883 [ACK] Seq=111 Ack=118 Win=32128 Len=0 TSval=3404578289 TSecr=259610336"
"86","8.949997100","192.168.105.183","192.168.105.117","TCP","66","50369  >  1883 [ACK] Seq=121 Ack=106 Win=32128 Len=0 TSval=3256282493 TSecr=4176512391"
"87","9.278278916","192.168.105.183","192.168.105.117","MQTT","82","Publish Message (id=8) [topic]"
"88","9.279575341","192.168.105.117","192.168.105.183","MQTT","70","Publish Ack (id=8)"
"89","9.280051724","192.168.105.117","192.168.105.71","MQTT","80","Publish Message [topic]"
"90","9.286477467","192.168.105.183","192.168.105.117","TCP","66","50369  >  1883 [ACK] Seq=137 Ack=110 Win=32128 Len=0 TSval=3256282829 TSecr=4176512730"
"91","9.291302572","192.168.105.71","192.168.105.117","TCP","66","52705  >  1883 [ACK] Seq=111 Ack=132 Win=32128 Len=0 TSval=3404578634 TSecr=259610676"
"92","9.339921980","192.168.105.71","192.168.105.117","MQTT","80","Publish Message (id=8) [res]"
"93","9.341082609","192.168.105.117","192.168.105.71","MQTT","70","Publish Ack (id=8)"
"94","9.341551331","192.168.105.117","192.168.105.183","MQTT","78","Publish Message [res]"
"95","9.350150081","192.168.105.71","192.168.105.117","TCP","66","52705  >  1883 [ACK] Seq=125 Ack=136 Win=32128 Len=0 TSval=3404578690 TSecr=259610737"
"96","9.352945741","192.168.105.183","192.168.105.117","TCP","66","50369  >  1883 [ACK] Seq=137 Ack=122 Win=32128 Len=0 TSval=3256282895 TSecr=4176512792"
"97","10.281709291","192.168.105.183","192.168.105.117","MQTT","82","Publish Message (id=9) [topic]"
"98","10.283030975","192.168.105.117","192.168.105.183","MQTT","70","Publish Ack (id=9)"
"99","10.283536794","192.168.105.117","192.168.105.71","MQTT","80","Publish Message [topic]"
"100","10.290429467","192.168.105.183","192.168.105.117","TCP","66","50369  >  1883 [ACK] Seq=153 Ack=126 Win=32128 Len=0 TSval=3256283832 TSecr=4176513734"
"101","10.293262772","192.168.105.71","192.168.105.117","TCP","66","52705  >  1883 [ACK] Seq=125 Ack=150 Win=32128 Len=0 TSval=3404579636 TSecr=259611679"
"102","10.341861084","192.168.105.71","192.168.105.117","MQTT","80","Publish Message (id=9) [res]"
"103","10.343039886","192.168.105.117","192.168.105.71","MQTT","70","Publish Ack (id=9)"
"104","10.343571186","192.168.105.117","192.168.105.183","MQTT","78","Publish Message [res]"
"105","10.350684696","192.168.105.183","192.168.105.117","TCP","66","50369  >  1883 [ACK] Seq=153 Ack=138 Win=32128 Len=0 TSval=3256283893 TSecr=4176513794"
"106","10.351598057","192.168.105.71","192.168.105.117","TCP","66","52705  >  1883 [ACK] Seq=139 Ack=154 Win=32128 Len=0 TSval=3404579695 TSecr=259611739"
"107","10.689749001","RaspberryPiF_23:9f:e9","a2:81:24:63:26:46","ARP","42","Who has 192.168.105.174? Tell 192.168.105.117"
"108","10.698876303","a2:81:24:63:26:46","RaspberryPiF_23:9f:e9","ARP","42","192.168.105.174 is at a2:81:24:63:26:46"
"109","10.800668495","a2:81:24:63:26:46","RaspberryPiF_23:9f:e9","ARP","42","Who has 192.168.105.117? Tell 192.168.105.174"
"110","10.800736444","RaspberryPiF_23:9f:e9","a2:81:24:63:26:46","ARP","42","192.168.105.117 is at b8:27:eb:23:9f:e9"
"111","11.286743674","192.168.105.183","192.168.105.117","MQTT","82","Publish Message (id=10) [topic]"
"112","11.288128447","192.168.105.117","192.168.105.183","MQTT","70","Publish Ack (id=10)"
"113","11.288669069","192.168.105.117","192.168.105.71","MQTT","80","Publish Message [topic]"
"114","11.293903538","192.168.105.183","192.168.105.117","TCP","66","50369  >  1883 [ACK] Seq=169 Ack=142 Win=32128 Len=0 TSval=3256284836 TSecr=4176514739"
"115","11.297513537","192.168.105.71","192.168.105.117","TCP","66","52705  >  1883 [ACK] Seq=139 Ack=168 Win=32128 Len=0 TSval=3404580640 TSecr=259612684"
"116","11.349208338","192.168.105.71","192.168.105.117","MQTT","80","Publish Message (id=10) [res]"
"117","11.350429284","192.168.105.117","192.168.105.71","MQTT","70","Publish Ack (id=10)"
"118","11.351110754","192.168.105.117","192.168.105.183","MQTT","78","Publish Message [res]"
"119","11.357595505","192.168.105.71","192.168.105.117","TCP","66","52705  >  1883 [ACK] Seq=153 Ack=172 Win=32128 Len=0 TSval=3404580698 TSecr=259612746"
"120","11.363503524","192.168.105.183","192.168.105.117","TCP","66","50369  >  1883 [ACK] Seq=169 Ack=154 Win=32128 Len=0 TSval=3256284902 TSecr=4176514802"
"121","12.289560560","192.168.105.183","192.168.105.117","MQTT","82","Publish Message (id=11) [topic]"
"122","12.290953448","192.168.105.117","192.168.105.183","MQTT","70","Publish Ack (id=11)"
"123","12.291463737","192.168.105.117","192.168.105.71","MQTT","80","Publish Message [topic]"
"124","12.297394936","192.168.105.183","192.168.105.117","TCP","66","50369  >  1883 [ACK] Seq=185 Ack=158 Win=32128 Len=0 TSval=3256285838 TSecr=4176515742"
"125","12.301108018","192.168.105.71","192.168.105.117","TCP","66","52705  >  1883 [ACK] Seq=153 Ack=186 Win=32128 Len=0 TSval=3404581643 TSecr=259613687"
"126","12.348168102","192.168.105.71","192.168.105.117","MQTT","80","Publish Message (id=11) [res]"
"127","12.562040370","192.168.105.117","192.168.105.71","MQTT","70","Publish Ack (id=11)"
"128","12.777935715","192.168.105.117","192.168.105.71","TCP","70","[TCP Retransmission] 1883  >  52705 [PSH, ACK] Seq=186 Ack=167 Win=31872 Len=4 TSval=259614174 TSecr=3404581686"
"129","12.778032531","192.168.105.117","192.168.105.183","MQTT","78","Publish Message [res]"
"130","12.791463262","192.168.105.183","192.168.105.117","TCP","66","50369  >  1883 [ACK] Seq=185 Ack=170 Win=32128 Len=0 TSval=3256286333 TSecr=4176516229"
"131","13.289501808","192.168.105.183","192.168.105.117","MQTT","83","Publish Message (id=12) [topic]"
"132","13.290759672","192.168.105.117","192.168.105.183","MQTT","70","Publish Ack (id=12)"
"133","13.297494771","192.168.105.183","192.168.105.117","TCP","66","50369  >  1883 [ACK] Seq=202 Ack=174 Win=32128 Len=0 TSval=3256286838 TSecr=4176516741"
"134","14.081923075","192.168.105.117","192.168.105.71","TCP","70","[TCP Retransmission] 1883  >  52705 [PSH, ACK] Seq=186 Ack=167 Win=31872 Len=4 TSval=259615478 TSecr=3404581686"
"135","14.093819743","192.168.105.71","192.168.105.117","TCP","78","52705  >  1883 [ACK] Seq=167 Ack=190 Win=32128 Len=0 TSval=3404583435 TSecr=259615478 SLE=186 SRE=190"
"136","14.094052141","192.168.105.117","192.168.105.71","MQTT","81","Publish Message [topic]"
"137","14.099721285","192.168.105.71","192.168.105.117","TCP","66","52705  >  1883 [ACK] Seq=167 Ack=205 Win=32128 Len=0 TSval=3404583440 TSecr=259615490"
"138","14.149379058","192.168.105.71","192.168.105.117","MQTT","81","Publish Message (id=12) [res]"
"139","14.150615089","192.168.105.117","192.168.105.71","MQTT","70","Publish Ack (id=12)"
"140","14.151109273","192.168.105.117","192.168.105.183","MQTT","79","Publish Message [res]"
"141","14.156849700","192.168.105.71","192.168.105.117","TCP","66","52705  >  1883 [ACK] Seq=182 Ack=209 Win=32128 Len=0 TSval=3404583497 TSecr=259615546"
"142","14.160639447","192.168.105.183","192.168.105.117","TCP","66","50369  >  1883 [ACK] Seq=202 Ack=187 Win=32128 Len=0 TSval=3256287701 TSecr=4176517602"
"143","14.294017349","192.168.105.183","192.168.105.117","MQTT","83","Publish Message (id=13) [topic]"
"144","14.295143736","192.168.105.117","192.168.105.183","MQTT","70","Publish Ack (id=13)"
"145","14.295592895","192.168.105.117","192.168.105.71","MQTT","81","Publish Message [topic]"
"146","14.301452484","192.168.105.183","192.168.105.117","TCP","66","50369  >  1883 [ACK] Seq=219 Ack=191 Win=32128 Len=0 TSval=3256287841 TSecr=4176517746"
"147","14.304663707","192.168.105.71","192.168.105.117","TCP","66","52705  >  1883 [ACK] Seq=182 Ack=224 Win=32128 Len=0 TSval=3404583646 TSecr=259615691"
"148","14.354532383","192.168.105.71","192.168.105.117","MQTT","81","Publish Message (id=13) [res]"
"149","14.355609217","192.168.105.117","192.168.105.71","MQTT","70","Publish Ack (id=13)"
"150","14.356144820","192.168.105.117","192.168.105.183","MQTT","79","Publish Message [res]"
"151","14.361591935","192.168.105.71","192.168.105.117","TCP","66","52705  >  1883 [ACK] Seq=197 Ack=228 Win=32128 Len=0 TSval=3404583702 TSecr=259615751"
"152","14.362527664","192.168.105.183","192.168.105.117","TCP","66","50369  >  1883 [ACK] Seq=219 Ack=204 Win=32128 Len=0 TSval=3256287903 TSecr=4176517807"
"153","15.294809828","192.168.105.183","192.168.105.117","MQTT","83","Publish Message (id=14) [topic]"
"154","15.296399740","192.168.105.117","192.168.105.71","MQTT","81","Publish Message [topic]"
"155","15.308141471","192.168.105.71","192.168.105.117","TCP","66","52705  >  1883 [ACK] Seq=197 Ack=243 Win=32128 Len=0 TSval=3404584645 TSecr=259616692"
"156","15.354180284","192.168.105.71","192.168.105.117","MQTT","81","Publish Message (id=14) [res]"
"157","15.355223082","192.168.105.117","192.168.105.71","MQTT","70","Publish Ack (id=14)"
"158","15.355693131","192.168.105.117","192.168.105.183","MQTT","79","[TCP Previous segment not captured] , Publish Message [res]"
"159","15.362502973","192.168.105.71","192.168.105.117","TCP","66","52705  >  1883 [ACK] Seq=212 Ack=247 Win=32128 Len=0 TSval=3404584703 TSecr=259616751"
"160","15.364029263","192.168.105.183","192.168.105.117","TCP","78","[TCP Dup ACK 152#1] 50369  >  1883 [ACK] Seq=236 Ack=204 Win=32128 Len=0 TSval=3256288904 TSecr=4176517807 SLE=208 SRE=221"
"161","15.364196993","192.168.105.117","192.168.105.183","TCP","70","[TCP Retransmission] 1883  >  50369 [PSH, ACK] Seq=204 Ack=236 Win=31872 Len=4 TSval=4176518815 TSecr=3256288904"
"162","15.372713152","192.168.105.183","192.168.105.117","TCP","66","50369  >  1883 [ACK] Seq=236 Ack=221 Win=32128 Len=0 TSval=3256288911 TSecr=4176518815"
"163","16.296205364","192.168.105.183","192.168.105.117","MQTT","83","Publish Message (id=15) [topic]"
"164","16.297443236","192.168.105.117","192.168.105.183","MQTT","70","Publish Ack (id=15)"
"165","16.298069180","192.168.105.117","192.168.105.71","MQTT","81","Publish Message [topic]"
"166","16.304451170","192.168.105.183","192.168.105.117","TCP","66","50369  >  1883 [ACK] Seq=253 Ack=225 Win=32128 Len=0 TSval=3256289844 TSecr=4176519748"
"167","16.308192400","192.168.105.71","192.168.105.117","TCP","66","52705  >  1883 [ACK] Seq=212 Ack=262 Win=32128 Len=0 TSval=3404585648 TSecr=259617694"
"168","16.363520824","192.168.105.71","192.168.105.117","MQTT","81","Publish Message (id=15) [res]"
"169","16.364887865","192.168.105.117","192.168.105.183","MQTT","79","Publish Message [res]"
"170","16.370785326","192.168.105.183","192.168.105.117","TCP","66","50369  >  1883 [ACK] Seq=253 Ack=238 Win=32128 Len=0 TSval=3256289910 TSecr=4176519816"
"171","16.577948146","192.168.105.117","192.168.105.71","MQTT","70","Publish Ack (id=15)"
"172","16.591505903","192.168.105.71","192.168.105.117","TCP","66","52705  >  1883 [ACK] Seq=227 Ack=266 Win=32128 Len=0 TSval=3404585929 TSecr=259617974"
"173","17.299919079","192.168.105.183","192.168.105.117","MQTT","83","Publish Message (id=16) [topic]"
"174","17.301178666","192.168.105.117","192.168.105.183","MQTT","70","Publish Ack (id=16)"
"175","17.301809814","192.168.105.117","192.168.105.71","MQTT","81","Publish Message [topic]"
"176","17.309600926","192.168.105.183","192.168.105.117","TCP","66","50369  >  1883 [ACK] Seq=270 Ack=242 Win=32128 Len=0 TSval=3256290848 TSecr=4176520752"
"177","17.313822998","192.168.105.71","192.168.105.117","TCP","66","52705  >  1883 [ACK] Seq=227 Ack=281 Win=32128 Len=0 TSval=3404586653 TSecr=259618697"
"178","17.362143655","192.168.105.71","192.168.105.117","MQTT","81","Publish Message (id=16) [res]"
"179","17.363215612","192.168.105.117","192.168.105.71","MQTT","70","Publish Ack (id=16)"
"180","17.363689351","192.168.105.117","192.168.105.183","MQTT","79","Publish Message [res]"
"181","17.370144385","192.168.105.71","192.168.105.117","TCP","66","52705  >  1883 [ACK] Seq=242 Ack=285 Win=32128 Len=0 TSval=3404586708 TSecr=259618759"
"182","17.377080974","192.168.105.183","192.168.105.117","TCP","66","50369  >  1883 [ACK] Seq=270 Ack=255 Win=32128 Len=0 TSval=3256290914 TSecr=4176520814"
"183","18.301399394","192.168.105.183","192.168.105.117","MQTT","83","Publish Message (id=17) [topic]"
"184","18.302252085","192.168.105.117","192.168.105.183","MQTT","70","Publish Ack (id=17)"
"185","18.302607803","192.168.105.117","192.168.105.71","MQTT","81","Publish Message [topic]"
"186","18.308318775","192.168.105.183","192.168.105.117","TCP","66","50369  >  1883 [ACK] Seq=287 Ack=259 Win=32128 Len=0 TSval=3256291847 TSecr=4176521753"
"187","18.312495112","192.168.105.71","192.168.105.117","TCP","66","52705  >  1883 [ACK] Seq=242 Ack=300 Win=32128 Len=0 TSval=3404587652 TSecr=259619698"
"188","18.368393303","192.168.105.71","192.168.105.117","MQTT","81","Publish Message (id=17) [res]"
"189","18.369075300","192.168.105.117","192.168.105.71","MQTT","70","Publish Ack (id=17)"
"190","18.369377819","192.168.105.117","192.168.105.183","MQTT","79","Publish Message [res]"
"191","18.374423156","192.168.105.71","192.168.105.117","TCP","66","52705  >  1883 [ACK] Seq=257 Ack=304 Win=32128 Len=0 TSval=3404587714 TSecr=259619765"
"192","18.380439253","192.168.105.183","192.168.105.117","TCP","66","50369  >  1883 [ACK] Seq=287 Ack=272 Win=32128 Len=0 TSval=3256291918 TSecr=4176521820"
"193","19.305528845","192.168.105.183","192.168.105.117","MQTT","83","Publish Message (id=18) [topic]"
"194","19.306437905","192.168.105.117","192.168.105.183","MQTT","70","Publish Ack (id=18)"
"195","19.306863595","192.168.105.117","192.168.105.71","MQTT","81","Publish Message [topic]"
"196","19.312287943","192.168.105.183","192.168.105.117","TCP","66","50369  >  1883 [ACK] Seq=304 Ack=276 Win=32128 Len=0 TSval=3256292850 TSecr=4176522757"
"197","19.316333043","192.168.105.71","192.168.105.117","TCP","66","52705  >  1883 [ACK] Seq=257 Ack=319 Win=32128 Len=0 TSval=3404588655 TSecr=259620703"
"198","19.363106776","192.168.105.71","192.168.105.117","MQTT","81","Publish Message (id=18) [res]"
"199","19.364375250","192.168.105.117","192.168.105.71","MQTT","70","Publish Ack (id=18)"
"200","19.370021196","192.168.105.71","192.168.105.117","TCP","66","52705  >  1883 [ACK] Seq=272 Ack=323 Win=32128 Len=0 TSval=3404588709 TSecr=259620760"
"201","19.577907167","192.168.105.117","192.168.105.183","MQTT","79","Publish Message [res]"
"202","19.587146836","192.168.105.183","192.168.105.117","TCP","66","50369  >  1883 [ACK] Seq=304 Ack=289 Win=32128 Len=0 TSval=3256293125 TSecr=4176523029"
"203","19.888713866","192.168.105.174","224.0.0.251","MDNS","82","Standard query 0x026e PTR _quickshare._tcp.local, ""QM"" question"
"204","19.890733421","fe80::a081:24ff:fe63:2646","ff02::fb","MDNS","102","Standard query 0x026e PTR _quickshare._tcp.local, ""QM"" question"
"205","20.306327989","192.168.105.183","192.168.105.117","MQTT","83","Publish Message (id=19) [topic]"
"206","20.307534501","192.168.105.117","192.168.105.183","MQTT","70","Publish Ack (id=19)"
"207","20.308071637","192.168.105.117","192.168.105.71","MQTT","81","Publish Message [topic]"
"208","20.318111586","192.168.105.183","192.168.105.117","TCP","66","50369  >  1883 [ACK] Seq=321 Ack=293 Win=32128 Len=0 TSval=3256293851 TSecr=4176523758"
"209","20.318768769","192.168.105.71","192.168.105.117","TCP","66","52705  >  1883 [ACK] Seq=272 Ack=338 Win=32128 Len=0 TSval=3404589657 TSecr=259621704"
"210","20.367777586","192.168.105.71","192.168.105.117","MQTT","81","Publish Message (id=19) [res]"
"211","20.369043755","192.168.105.117","192.168.105.71","MQTT","70","Publish Ack (id=19)"
"212","20.374256462","192.168.105.71","192.168.105.117","TCP","66","52705  >  1883 [ACK] Seq=287 Ack=342 Win=32128 Len=0 TSval=3404589712 TSecr=259621765"
"213","20.581882019","192.168.105.117","192.168.105.183","MQTT","79","Publish Message [res]"
"214","20.594608848","192.168.105.183","192.168.105.117","TCP","66","50369  >  1883 [ACK] Seq=321 Ack=306 Win=32128 Len=0 TSval=3256294131 TSecr=4176524033"
"215","21.309388928","192.168.105.183","192.168.105.117","MQTT","83","Publish Message (id=20) [topic]"
"216","21.310748143","192.168.105.117","192.168.105.183","MQTT","70","Publish Ack (id=20)"
"217","21.310866313","192.168.105.117","192.168.105.71","MQTT","81","Publish Message [topic]"
"218","21.316892772","192.168.105.183","192.168.105.117","TCP","66","50369  >  1883 [ACK] Seq=338 Ack=310 Win=32128 Len=0 TSval=3256294854 TSecr=4176524761"
"219","21.322683985","192.168.105.71","192.168.105.117","TCP","66","52705  >  1883 [ACK] Seq=287 Ack=357 Win=32128 Len=0 TSval=3404590658 TSecr=259622707"
"220","21.369891525","192.168.105.71","192.168.105.117","MQTT","81","Publish Message (id=20) [res]"
"221","21.371094379","192.168.105.117","192.168.105.71","MQTT","70","Publish Ack (id=20)"
"222","21.371271529","192.168.105.117","192.168.105.183","MQTT","79","Publish Message [res]"
"223","21.377323519","192.168.105.71","192.168.105.117","TCP","66","52705  >  1883 [ACK] Seq=302 Ack=361 Win=32128 Len=0 TSval=3404590715 TSecr=259622767"
"224","21.382758503","192.168.105.183","192.168.105.117","TCP","66","50369  >  1883 [ACK] Seq=338 Ack=323 Win=32128 Len=0 TSval=3256294919 TSecr=4176524822"
"225","22.312135422","192.168.105.183","192.168.105.117","MQTT","83","Publish Message (id=21) [topic]"
"226","22.313383594","192.168.105.117","192.168.105.183","MQTT","70","Publish Ack (id=21)"
"227","22.313573092","192.168.105.117","192.168.105.71","MQTT","81","Publish Message [topic]"
"228","22.320633476","192.168.105.183","192.168.105.117","TCP","66","50369  >  1883 [ACK] Seq=355 Ack=327 Win=32128 Len=0 TSval=3256295856 TSecr=4176525764"
"229","22.327772014","192.168.105.71","192.168.105.117","TCP","66","52705  >  1883 [ACK] Seq=302 Ack=376 Win=32128 Len=0 TSval=3404591661 TSecr=259623709"
"230","22.378975210","192.168.105.71","192.168.105.117","MQTT","81","Publish Message (id=21) [res]"
"231","22.380134651","192.168.105.117","192.168.105.183","MQTT","79","Publish Message [res]"
"232","22.380186962","192.168.105.117","192.168.105.71","MQTT","70","Publish Ack (id=21)"
"233","22.380400010","a2:81:24:63:26:46","Broadcast","ARP","42","Who has 192.168.105.237? Tell 192.168.105.174"
"234","22.388761347","192.168.105.71","192.168.105.117","TCP","66","52705  >  1883 [ACK] Seq=317 Ack=380 Win=32128 Len=0 TSval=3404591726 TSecr=259623776"
"235","22.389949705","192.168.105.183","192.168.105.117","TCP","66","50369  >  1883 [ACK] Seq=355 Ack=340 Win=32128 Len=0 TSval=3256295927 TSecr=4176525831"
"236","23.314183936","192.168.105.183","192.168.105.117","MQTT","83","Publish Message (id=22) [topic]"
"237","23.315419228","192.168.105.117","192.168.105.183","MQTT","70","Publish Ack (id=22)"
"238","23.408003412","a2:81:24:63:26:46","Broadcast","ARP","42","Who has 192.168.105.237? Tell 192.168.105.174"
"239","23.529937418","192.168.105.117","192.168.105.71","MQTT","81","Publish Message [topic]"
"240","23.530014894","192.168.105.117","192.168.105.183","TCP","70","[TCP Retransmission] 1883  >  50369 [PSH, ACK] Seq=340 Ack=372 Win=31872 Len=4 TSval=4176526981 TSecr=3256296842"
"241","23.538375898","192.168.105.71","192.168.105.117","TCP","66","52705  >  1883 [ACK] Seq=317 Ack=395 Win=32128 Len=0 TSval=3404592875 TSecr=259624926"
"242","23.538584255","192.168.105.183","192.168.105.117","TCP","78","50369  >  1883 [ACK] Seq=372 Ack=344 Win=32128 Len=0 TSval=3256297076 TSecr=4176526981 SLE=340 SRE=344"
"243","23.584651604","192.168.105.71","192.168.105.117","MQTT","81","Publish Message (id=22) [res]"
"244","23.585905445","192.168.105.117","192.168.105.71","MQTT","70","Publish Ack (id=22)"
"245","23.591107907","192.168.105.71","192.168.105.117","TCP","66","52705  >  1883 [ACK] Seq=332 Ack=399 Win=32128 Len=0 TSval=3404592928 TSecr=259624981"
"246","23.801967373","192.168.105.117","192.168.105.183","MQTT","79","Publish Message [res]"
"247","23.815066190","192.168.105.183","192.168.105.117","TCP","66","50369  >  1883 [ACK] Seq=372 Ack=357 Win=32128 Len=0 TSval=3256297352 TSecr=4176527253"
"248","24.311868604","192.168.105.183","192.168.105.117","MQTT","83","Publish Message (id=23) [topic]"
"249","24.313112743","192.168.105.117","192.168.105.183","MQTT","70","Publish Ack (id=23)"
"250","24.313174484","192.168.105.117","192.168.105.71","MQTT","81","Publish Message [topic]"
"251","24.324905310","192.168.105.71","192.168.105.117","TCP","66","52705  >  1883 [ACK] Seq=332 Ack=414 Win=32128 Len=0 TSval=3404593661 TSecr=259625709"
"252","24.379074412","192.168.105.71","192.168.105.117","MQTT","81","Publish Message (id=23) [res]"
"253","24.380251757","192.168.105.117","192.168.105.71","MQTT","70","Publish Ack (id=23)"
"254","24.380303755","192.168.105.117","192.168.105.183","MQTT","79","Publish Message [res]"
"255","24.389994847","192.168.105.183","192.168.105.117","TCP","66","50369  >  1883 [ACK] Seq=389 Ack=374 Win=32128 Len=0 TSval=3256297926 TSecr=4176527831"
"256","24.433047404","a2:81:24:63:26:46","Broadcast","ARP","42","Who has 192.168.105.237? Tell 192.168.105.174"
"257","24.593904855","192.168.105.117","192.168.105.71","TCP","70","[TCP Retransmission] 1883  >  52705 [PSH, ACK] Seq=414 Ack=347 Win=31872 Len=4 TSval=259625990 TSecr=3404593709"
"258","24.606142059","192.168.105.71","192.168.105.117","TCP","78","52705  >  1883 [ACK] Seq=347 Ack=418 Win=32128 Len=0 TSval=3404593942 TSecr=259625990 SLE=414 SRE=418"
"259","25.314965590","192.168.105.183","192.168.105.117","MQTT","83","Publish Message (id=24) [topic]"
"260","25.316257912","192.168.105.117","192.168.105.71","MQTT","81","Publish Message [topic]"
"261","25.326033484","192.168.105.71","192.168.105.117","TCP","66","52705  >  1883 [ACK] Seq=347 Ack=433 Win=32128 Len=0 TSval=3404594662 TSecr=259626712"
"262","25.380971360","192.168.105.71","192.168.105.117","MQTT","81","Publish Message (id=24) [res]"
"263","25.382566600","192.168.105.117","192.168.105.183","MQTT","79","[TCP Previous segment not captured] , Publish Message [res]"
"264","25.392434339","192.168.105.183","192.168.105.117","TCP","78","[TCP Dup ACK 255#1] 50369  >  1883 [ACK] Seq=406 Ack=374 Win=32128 Len=0 TSval=3256298927 TSecr=4176527831 SLE=378 SRE=391"
"265","25.392677496","192.168.105.117","192.168.105.183","TCP","70","[TCP Retransmission] 1883  >  50369 [PSH, ACK] Seq=374 Ack=406 Win=31872 Len=4 TSval=4176528843 TSecr=3256298927"
"266","25.399861911","192.168.105.183","192.168.105.117","TCP","66","50369  >  1883 [ACK] Seq=406 Ack=391 Win=32128 Len=0 TSval=3256298934 TSecr=4176528843"
"267","25.681943744","192.168.105.71","192.168.105.117","TCP","81","[TCP Retransmission] 52705  >  1883 [PSH, ACK] Seq=347 Ack=433 Win=32128 Len=15 TSval=3404595011 TSecr=259626712"
"268","25.682231500","192.168.105.117","192.168.105.71","TCP","78","[TCP Previous segment not captured] 1883  >  52705 [ACK] Seq=437 Ack=362 Win=31872 Len=0 TSval=259627078 TSecr=3404595011 SLE=347 SRE=362"
"269","25.817921553","192.168.105.117","192.168.105.71","TCP","70","[TCP Retransmission] 1883  >  52705 [PSH, ACK] Seq=433 Ack=362 Win=31872 Len=4 TSval=259627214 TSecr=3404595011"
"270","25.829777325","192.168.105.71","192.168.105.117","TCP","66","52705  >  1883 [ACK] Seq=362 Ack=437 Win=32128 Len=0 TSval=3404595165 TSecr=259627214"
"271","26.319727529","192.168.105.183","192.168.105.117","MQTT","83","Publish Message (id=25) [topic]"
"272","26.321329165","192.168.105.117","192.168.105.71","MQTT","81","Publish Message [topic]"
"273","26.329759254","192.168.105.71","192.168.105.117","TCP","66","52705  >  1883 [ACK] Seq=362 Ack=452 Win=32128 Len=0 TSval=3404595665 TSecr=259627717"
"274","26.379584690","192.168.105.71","192.168.105.117","MQTT","81","Publish Message (id=25) [res]"
"275","26.379787727","192.168.105.117","192.168.105.71","TCP","66","1883  >  52705 [ACK] Seq=452 Ack=377 Win=31872 Len=0 TSval=259627775 TSecr=3404595709"
"276","26.380699494","192.168.105.117","192.168.105.71","MQTT","70","Publish Ack (id=25)"
"277","26.381180803","192.168.105.117","192.168.105.183","MQTT","79","[TCP Previous segment not captured] , Publish Message [res]"
"278","26.386517867","192.168.105.71","192.168.105.117","TCP","66","52705  >  1883 [ACK] Seq=377 Ack=456 Win=32128 Len=0 TSval=3404595721 TSecr=259627776"
"279","26.391097071","192.168.105.183","192.168.105.117","TCP","78","[TCP Dup ACK 266#1] 50369  >  1883 [ACK] Seq=423 Ack=391 Win=32128 Len=0 TSval=3256299927 TSecr=4176528843 SLE=395 SRE=408"
"280","26.391269734","192.168.105.117","192.168.105.183","TCP","70","[TCP Retransmission] 1883  >  50369 [PSH, ACK] Seq=391 Ack=423 Win=31872 Len=4 TSval=4176529842 TSecr=3256299927"
"281","26.399546021","192.168.105.183","192.168.105.117","TCP","66","50369  >  1883 [ACK] Seq=423 Ack=408 Win=32128 Len=0 TSval=3256299933 TSecr=4176529842"
"282","27.322604854","192.168.105.183","192.168.105.117","MQTT","83","Publish Message (id=26) [topic]"
"283","27.324302601","192.168.105.117","192.168.105.71","MQTT","81","Publish Message [topic]"
"284","27.334010283","192.168.105.71","192.168.105.117","TCP","66","52705  >  1883 [ACK] Seq=377 Ack=471 Win=32128 Len=0 TSval=3404596669 TSecr=259628720"
"285","27.389212560","192.168.105.71","192.168.105.117","MQTT","81","Publish Message (id=26) [res]"
"286","27.390851538","192.168.105.117","192.168.105.183","MQTT","79","[TCP Previous segment not captured] , Publish Message [res]"
"287","27.400192381","192.168.105.183","192.168.105.117","TCP","78","[TCP Dup ACK 281#1] 50369  >  1883 [ACK] Seq=440 Ack=408 Win=32128 Len=0 TSval=3256300935 TSecr=4176529842 SLE=412 SRE=425"
"288","27.400414902","192.168.105.117","192.168.105.183","TCP","70","[TCP Retransmission] 1883  >  50369 [PSH, ACK] Seq=408 Ack=440 Win=31872 Len=4 TSval=4176530851 TSecr=3256300935"
"289","27.409825872","192.168.105.183","192.168.105.117","TCP","66","50369  >  1883 [ACK] Seq=440 Ack=425 Win=32128 Len=0 TSval=3256300943 TSecr=4176530851"
"290","27.609952738","192.168.105.117","192.168.105.71","MQTT","70","Publish Ack (id=26)"
"291","27.621771898","192.168.105.71","192.168.105.117","TCP","66","52705  >  1883 [ACK] Seq=392 Ack=475 Win=32128 Len=0 TSval=3404596957 TSecr=259629006"
"292","28.321875183","192.168.105.183","192.168.105.117","MQTT","83","Publish Message (id=27) [topic]"
"293","28.323203892","192.168.105.117","192.168.105.183","MQTT","70","Publish Ack (id=27)"
"294","28.323734636","192.168.105.117","192.168.105.71","MQTT","81","Publish Message [topic]"
"295","28.330844217","192.168.105.183","192.168.105.117","TCP","66","50369  >  1883 [ACK] Seq=457 Ack=429 Win=32128 Len=0 TSval=3256301863 TSecr=4176531774"
"296","28.381080810","192.168.105.71","192.168.105.117","MQTT","81","Publish Message (id=27) [res]"
"297","28.382660381","192.168.105.117","192.168.105.183","MQTT","79","Publish Message [res]"
"298","28.392101337","192.168.105.183","192.168.105.117","TCP","66","50369  >  1883 [ACK] Seq=457 Ack=442 Win=32128 Len=0 TSval=3256301926 TSecr=4176531833"
"299","28.821914374","192.168.105.117","192.168.105.71","MQTT","70","Publish Ack (id=27)"
"300","28.837725716","192.168.105.71","192.168.105.117","TCP","66","52705  >  1883 [ACK] Seq=407 Ack=494 Win=32128 Len=0 TSval=3404598170 TSecr=259630218"
"301","29.327583832","192.168.105.183","192.168.105.117","MQTT","83","Publish Message (id=28) [topic]"
"302","29.328449364","192.168.105.117","192.168.105.183","MQTT","70","Publish Ack (id=28)"
"303","29.328796556","192.168.105.117","192.168.105.71","MQTT","81","Publish Message [topic]"
"304","29.334342934","192.168.105.183","192.168.105.117","TCP","66","50369  >  1883 [ACK] Seq=474 Ack=446 Win=32128 Len=0 TSval=3256302868 TSecr=4176532779"
"305","29.344813828","192.168.105.71","192.168.105.117","TCP","66","52705  >  1883 [ACK] Seq=407 Ack=509 Win=32128 Len=0 TSval=3404598673 TSecr=259630725"
"306","29.392958016","192.168.105.71","192.168.105.117","MQTT","81","Publish Message (id=28) [res]"
"307","29.393781504","192.168.105.117","192.168.105.71","MQTT","70","Publish Ack (id=28)"
"308","29.394192258","192.168.105.117","192.168.105.183","MQTT","79","Publish Message [res]"
"309","29.399964280","192.168.105.71","192.168.105.117","TCP","66","52705  >  1883 [ACK] Seq=422 Ack=513 Win=32128 Len=0 TSval=3404598734 TSecr=259630789"
"310","29.403957201","192.168.105.183","192.168.105.117","TCP","66","50369  >  1883 [ACK] Seq=474 Ack=459 Win=32128 Len=0 TSval=3256302939 TSecr=4176532845"
"311","30.335102534","192.168.105.183","192.168.105.117","MQTT","83","Publish Message (id=29) [topic]"
"312","30.335937842","192.168.105.117","192.168.105.183","MQTT","70","Publish Ack (id=29)"
"313","30.336295295","192.168.105.117","192.168.105.71","MQTT","81","Publish Message [topic]"
"314","30.343800668","192.168.105.183","192.168.105.117","TCP","66","50369  >  1883 [ACK] Seq=491 Ack=463 Win=32128 Len=0 TSval=3256303878 TSecr=4176533787"
"315","30.347403491","192.168.105.71","192.168.105.117","TCP","66","52705  >  1883 [ACK] Seq=422 Ack=528 Win=32128 Len=0 TSval=3404599682 TSecr=259631732"
"316","30.394112442","192.168.105.71","192.168.105.117","MQTT","81","Publish Message (id=29) [res]"
"317","30.394880906","192.168.105.117","192.168.105.71","MQTT","70","Publish Ack (id=29)"
"318","30.395181311","192.168.105.117","192.168.105.183","MQTT","79","Publish Message [res]"
"319","30.400570202","192.168.105.71","192.168.105.117","TCP","66","52705  >  1883 [ACK] Seq=437 Ack=532 Win=32128 Len=0 TSval=3404599734 TSecr=259631791"
"320","30.400709255","192.168.105.183","192.168.105.117","TCP","66","50369  >  1883 [ACK] Seq=491 Ack=476 Win=32128 Len=0 TSval=3256303936 TSecr=4176533846"
"321","31.572735859","192.168.105.183","192.168.105.117","MQTT","83","Publish Message (id=30) [topic]"
