"No.","Time","Source","Destination","Protocol","Length","Info"
"1","0.000000000","192.168.105.71","192.168.105.117","TCP","74","33761  >  1883 [SYN] Seq=0 Win=32120 Len=0 MSS=1460 SACK_PERM TSval=56482747 TSecr=0 WS=128"
"2","0.000416715","192.168.105.117","192.168.105.71","TCP","74","1883  >  33761 [SYN, ACK] Seq=0 Ack=1 Win=31856 Len=0 MSS=1460 SACK_PERM TSval=3418145121 TSecr=56482747 WS=128"
"3","0.008922214","192.168.105.71","192.168.105.117","TCP","66","33761  >  1883 [ACK] Seq=1 Ack=1 Win=32128 Len=0 TSval=56482945 TSecr=3418145121"
"4","0.009178357","192.168.105.71","192.168.105.117","MQTT","80","Connect Command"
"5","0.009311950","192.168.105.117","192.168.105.71","TCP","66","1883  >  33761 [ACK] Seq=1 Ack=15 Win=31872 Len=0 TSval=3418145130 TSecr=56482945"
"6","0.013225561","192.168.105.117","192.168.105.71","MQTT","70","Connect Ack"
"7","0.014880755","192.168.105.71","192.168.105.117","MQTT","78","Subscribe Request (id=1) [topic]"
"8","0.016870633","192.168.105.117","192.168.105.71","MQTT","71","Subscribe Ack (id=1)"
"9","0.018306871","192.168.105.71","192.168.105.117","TCP","66","33761  >  1883 [ACK] Seq=27 Ack=5 Win=32128 Len=0 TSval=56482954 TSecr=3418145134"
"10","0.022089494","192.168.105.71","192.168.105.117","TCP","66","33761  >  1883 [ACK] Seq=27 Ack=10 Win=32128 Len=0 TSval=56482958 TSecr=3418145138"
"11","1.879067718","192.168.105.183","192.168.105.117","TCP","74","44065  >  1883 [SYN] Seq=0 Win=32120 Len=0 MSS=1460 SACK_PERM TSval=2887411901 TSecr=0 WS=128"
"12","1.879462298","192.168.105.117","192.168.105.183","TCP","74","1883  >  44065 [SYN, ACK] Seq=0 Ack=1 Win=31856 Len=0 MSS=1460 SACK_PERM TSval=852097396 TSecr=2887411901 WS=128"
"13","1.884880271","192.168.105.183","192.168.105.117","TCP","66","44065  >  1883 [ACK] Seq=1 Ack=1 Win=32128 Len=0 TSval=2887411914 TSecr=852097396"
"14","1.885152977","192.168.105.183","192.168.105.117","MQTT","80","Connect Command"
"15","1.885291152","192.168.105.117","192.168.105.183","TCP","66","1883  >  44065 [ACK] Seq=1 Ack=15 Win=31872 Len=0 TSval=852097402 TSecr=2887411915"
"16","1.889317679","192.168.105.117","192.168.105.183","MQTT","70","Connect Ack"
"17","1.891021050","192.168.105.183","192.168.105.117","MQTT","90","Subscribe Request (id=1) [res], Publish Message [topic]"
"18","1.893381029","192.168.105.117","192.168.105.183","MQTT","71","Subscribe Ack (id=1)"
"19","1.893985451","192.168.105.117","192.168.105.71","MQTT","80","Publish Message [topic]"
"20","1.895363199","192.168.105.183","192.168.105.117","TCP","66","44065  >  1883 [ACK] Seq=39 Ack=5 Win=32128 Len=0 TSval=2887411924 TSecr=852097406"
"21","1.899082958","192.168.105.183","192.168.105.117","TCP","66","44065  >  1883 [ACK] Seq=39 Ack=10 Win=32128 Len=0 TSval=2887411928 TSecr=852097410"
"22","1.903227348","192.168.105.71","192.168.105.117","TCP","66","33761  >  1883 [ACK] Seq=27 Ack=24 Win=32128 Len=0 TSval=56484839 TSecr=3418147015"
"23","1.952950034","192.168.105.71","192.168.105.117","MQTT","78","Publish Message [res]"
"24","1.954403615","192.168.105.117","192.168.105.183","MQTT","78","Publish Message [res]"
"25","1.959372530","192.168.105.183","192.168.105.117","TCP","66","44065  >  1883 [ACK] Seq=39 Ack=22 Win=32128 Len=0 TSval=2887411989 TSecr=852097471"
"26","1.995676532","192.168.105.117","192.168.105.71","TCP","66","1883  >  33761 [ACK] Seq=24 Ack=39 Win=31872 Len=0 TSval=3418147117 TSecr=56484883"
"27","2.902066537","192.168.105.183","192.168.105.117","MQTT","80","Publish Message [topic]"
"28","2.903429754","192.168.105.117","192.168.105.71","MQTT","80","Publish Message [topic]"
"29","2.912041188","192.168.105.71","192.168.105.117","TCP","66","33761  >  1883 [ACK] Seq=39 Ack=38 Win=32128 Len=0 TSval=56485847 TSecr=3418148024"
"30","2.943684085","192.168.105.117","192.168.105.183","TCP","66","1883  >  44065 [ACK] Seq=22 Ack=53 Win=31872 Len=0 TSval=852098461 TSecr=2887412923"
"31","2.957267402","192.168.105.71","192.168.105.117","MQTT","78","Publish Message [res]"
"32","2.957411151","192.168.105.117","192.168.105.71","TCP","66","1883  >  33761 [ACK] Seq=38 Ack=51 Win=31872 Len=0 TSval=3418148078 TSecr=56485891"
"33","2.958573641","192.168.105.117","192.168.105.183","MQTT","78","Publish Message [res]"
"34","2.974737560","192.168.105.183","192.168.105.117","TCP","66","44065  >  1883 [ACK] Seq=53 Ack=34 Win=32128 Len=0 TSval=2887413001 TSecr=852098475"
"35","3.904588795","192.168.105.183","192.168.105.117","MQTT","80","Publish Message [topic]"
"36","3.904802335","192.168.105.117","192.168.105.183","TCP","66","1883  >  44065 [ACK] Seq=34 Ack=67 Win=31872 Len=0 TSval=852099422 TSecr=2887413925"
"37","3.905491496","192.168.105.117","192.168.105.71","MQTT","80","Publish Message [topic]"
"38","3.915638385","192.168.105.71","192.168.105.117","TCP","66","33761  >  1883 [ACK] Seq=51 Ack=52 Win=32128 Len=0 TSval=56486850 TSecr=3418149026"
"39","3.960648819","192.168.105.71","192.168.105.117","MQTT","78","Publish Message [res]"
"40","3.960749912","192.168.105.117","192.168.105.71","TCP","66","1883  >  33761 [ACK] Seq=52 Ack=63 Win=31872 Len=0 TSval=3418149082 TSecr=56486894"
"41","3.961417041","192.168.105.117","192.168.105.183","MQTT","78","Publish Message [res]"
"42","3.969207180","192.168.105.183","192.168.105.117","TCP","66","44065  >  1883 [ACK] Seq=67 Ack=46 Win=32128 Len=0 TSval=2887413998 TSecr=852099478"
"43","4.901336239","192.168.105.183","192.168.105.117","MQTT","80","Publish Message [topic]"
"44","4.901549101","192.168.105.117","192.168.105.183","TCP","66","1883  >  44065 [ACK] Seq=46 Ack=81 Win=31872 Len=0 TSval=852100418 TSecr=2887414927"
"45","4.902299459","192.168.105.117","192.168.105.71","MQTT","80","Publish Message [topic]"
"46","4.912677284","192.168.105.71","192.168.105.117","TCP","66","33761  >  1883 [ACK] Seq=63 Ack=66 Win=32128 Len=0 TSval=56487848 TSecr=3418150023"
"47","4.963614695","192.168.105.71","192.168.105.117","MQTT","78","Publish Message [res]"
"48","4.963723600","192.168.105.117","192.168.105.71","TCP","66","1883  >  33761 [ACK] Seq=66 Ack=75 Win=31872 Len=0 TSval=3418150085 TSecr=56487891"
"49","4.964405053","192.168.105.117","192.168.105.183","MQTT","78","Publish Message [res]"
"50","4.972525605","192.168.105.183","192.168.105.117","TCP","66","44065  >  1883 [ACK] Seq=81 Ack=58 Win=32128 Len=0 TSval=2887415001 TSecr=852100481"
"51","5.909323612","192.168.105.183","192.168.105.117","MQTT","80","Publish Message [topic]"
"52","5.909641213","192.168.105.117","192.168.105.183","TCP","66","1883  >  44065 [ACK] Seq=58 Ack=95 Win=31872 Len=0 TSval=852101426 TSecr=2887415929"
"53","5.910785526","192.168.105.117","192.168.105.71","MQTT","80","Publish Message [topic]"
"54","5.920548772","192.168.105.71","192.168.105.117","TCP","66","33761  >  1883 [ACK] Seq=75 Ack=80 Win=32128 Len=0 TSval=56488856 TSecr=3418151032"
"55","5.975084640","192.168.105.71","192.168.105.117","MQTT","78","Publish Message [res]"
"56","5.975272242","192.168.105.117","192.168.105.71","TCP","66","1883  >  33761 [ACK] Seq=80 Ack=87 Win=31872 Len=0 TSval=3418151096 TSecr=56488904"
"57","5.976426763","192.168.105.117","192.168.105.183","MQTT","78","Publish Message [res]"
"58","5.985023665","192.168.105.183","192.168.105.117","TCP","66","44065  >  1883 [ACK] Seq=95 Ack=70 Win=32128 Len=0 TSval=2887416014 TSecr=852101493"
"59","6.909882851","192.168.105.183","192.168.105.117","MQTT","80","Publish Message [topic]"
"60","6.910186338","192.168.105.117","192.168.105.183","TCP","66","1883  >  44065 [ACK] Seq=70 Ack=109 Win=31872 Len=0 TSval=852102427 TSecr=2887416930"
"61","6.911261901","192.168.105.117","192.168.105.71","MQTT","80","Publish Message [topic]"
"62","6.920154426","192.168.105.71","192.168.105.117","TCP","66","33761  >  1883 [ACK] Seq=87 Ack=94 Win=32128 Len=0 TSval=56489856 TSecr=3418152032"
"63","6.969422996","192.168.105.71","192.168.105.117","MQTT","78","Publish Message [res]"
"64","6.969606588","192.168.105.117","192.168.105.71","TCP","66","1883  >  33761 [ACK] Seq=94 Ack=99 Win=31872 Len=0 TSval=3418152090 TSecr=56489899"
"65","6.970714390","192.168.105.117","192.168.105.183","MQTT","78","Publish Message [res]"
"66","6.983079748","192.168.105.183","192.168.105.117","TCP","66","44065  >  1883 [ACK] Seq=109 Ack=82 Win=32128 Len=0 TSval=2887417011 TSecr=852102488"
"67","7.912515487","192.168.105.183","192.168.105.117","MQTT","80","Publish Message [topic]"
"68","7.912831317","192.168.105.117","192.168.105.183","TCP","66","1883  >  44065 [ACK] Seq=82 Ack=123 Win=31872 Len=0 TSval=852103430 TSecr=2887417933"
"69","7.913910995","192.168.105.117","192.168.105.71","MQTT","80","Publish Message [topic]"
"70","7.922495970","192.168.105.71","192.168.105.117","TCP","66","33761  >  1883 [ACK] Seq=99 Ack=108 Win=32128 Len=0 TSval=56490858 TSecr=3418153035"
"71","7.968940241","192.168.105.71","192.168.105.117","MQTT","78","Publish Message [res]"
"72","7.969121490","192.168.105.117","192.168.105.71","TCP","66","1883  >  33761 [ACK] Seq=108 Ack=111 Win=31872 Len=0 TSval=3418153090 TSecr=56490901"
"73","7.970218511","192.168.105.117","192.168.105.183","MQTT","78","Publish Message [res]"
"74","7.982813867","192.168.105.183","192.168.105.117","TCP","66","44065  >  1883 [ACK] Seq=123 Ack=94 Win=32128 Len=0 TSval=2887418010 TSecr=852103487"
"75","8.549067067","192.168.105.174","224.0.0.251","MDNS","82","Standard query 0x00aa PTR _quickshare._tcp.local, ""QM"" question"
"76","8.549591281","fe80::a081:24ff:fe63:2646","ff02::fb","MDNS","102","Standard query 0x00aa PTR _quickshare._tcp.local, ""QM"" question"
"77","8.915438097","192.168.105.183","192.168.105.117","MQTT","80","Publish Message [topic]"
"78","8.915775490","192.168.105.117","192.168.105.183","TCP","66","1883  >  44065 [ACK] Seq=94 Ack=137 Win=31872 Len=0 TSval=852104433 TSecr=2887418936"
"79","8.916865897","192.168.105.117","192.168.105.71","MQTT","80","Publish Message [topic]"
"80","8.926477373","192.168.105.71","192.168.105.117","TCP","66","33761  >  1883 [ACK] Seq=111 Ack=122 Win=32128 Len=0 TSval=56491861 TSecr=3418154038"
"81","8.972149306","192.168.105.71","192.168.105.117","MQTT","78","Publish Message [res]"
"82","8.972359409","192.168.105.117","192.168.105.71","TCP","66","1883  >  33761 [ACK] Seq=122 Ack=123 Win=31872 Len=0 TSval=3418154093 TSecr=56491905"
"83","8.973387785","192.168.105.117","192.168.105.183","MQTT","78","Publish Message [res]"
"84","8.985725851","192.168.105.183","192.168.105.117","TCP","66","44065  >  1883 [ACK] Seq=137 Ack=106 Win=32128 Len=0 TSval=2887419013 TSecr=852104490"
"85","9.919594633","192.168.105.183","192.168.105.117","MQTT","80","Publish Message [topic]"
"86","9.919904578","192.168.105.117","192.168.105.183","TCP","66","1883  >  44065 [ACK] Seq=106 Ack=151 Win=31872 Len=0 TSval=852105437 TSecr=2887419938"
"87","9.921026807","192.168.105.117","192.168.105.71","MQTT","80","Publish Message [topic]"
"88","9.929582147","192.168.105.71","192.168.105.117","TCP","66","33761  >  1883 [ACK] Seq=123 Ack=136 Win=32128 Len=0 TSval=56492865 TSecr=3418155042"
"89","9.978939723","192.168.105.71","192.168.105.117","MQTT","78","Publish Message [res]"
"90","9.979151961","192.168.105.117","192.168.105.71","TCP","66","1883  >  33761 [ACK] Seq=136 Ack=135 Win=31872 Len=0 TSval=3418155100 TSecr=56492908"
"91","9.980323721","192.168.105.117","192.168.105.183","MQTT","78","Publish Message [res]"
"92","9.989637283","192.168.105.183","192.168.105.117","TCP","66","44065  >  1883 [ACK] Seq=151 Ack=118 Win=32128 Len=0 TSval=2887420018 TSecr=852105497"
"93","10.921955641","192.168.105.183","192.168.105.117","MQTT","80","Publish Message [topic]"
"94","10.922269961","192.168.105.117","192.168.105.183","TCP","66","1883  >  44065 [ACK] Seq=118 Ack=165 Win=31872 Len=0 TSval=852106439 TSecr=2887420940"
"95","10.923420367","192.168.105.117","192.168.105.71","MQTT","80","Publish Message [topic]"
"96","10.933763764","192.168.105.71","192.168.105.117","TCP","66","33761  >  1883 [ACK] Seq=135 Ack=150 Win=32128 Len=0 TSval=56493868 TSecr=3418156044"
"97","10.977972114","192.168.105.71","192.168.105.117","MQTT","78","Publish Message [res]"
"98","10.978194143","192.168.105.117","192.168.105.71","TCP","66","1883  >  33761 [ACK] Seq=150 Ack=147 Win=31872 Len=0 TSval=3418156099 TSecr=56493911"
"99","10.979259655","192.168.105.117","192.168.105.183","MQTT","78","Publish Message [res]"
"100","10.989055400","192.168.105.183","192.168.105.117","TCP","66","44065  >  1883 [ACK] Seq=165 Ack=130 Win=32128 Len=0 TSval=2887421018 TSecr=852106496"
"101","11.921315508","192.168.105.183","192.168.105.117","MQTT","81","Publish Message [topic]"
"102","11.921628214","192.168.105.117","192.168.105.183","TCP","66","1883  >  44065 [ACK] Seq=130 Ack=180 Win=31872 Len=0 TSval=852107438 TSecr=2887421941"
"103","11.922697006","192.168.105.117","192.168.105.71","MQTT","81","Publish Message [topic]"
"104","11.931330209","192.168.105.71","192.168.105.117","TCP","66","33761  >  1883 [ACK] Seq=147 Ack=165 Win=32128 Len=0 TSval=56494867 TSecr=3418157044"
"105","11.979933936","192.168.105.71","192.168.105.117","MQTT","79","Publish Message [res]"
"106","11.980174819","192.168.105.117","192.168.105.71","TCP","66","1883  >  33761 [ACK] Seq=165 Ack=160 Win=31872 Len=0 TSval=3418157101 TSecr=56494910"
"107","11.981339288","192.168.105.117","192.168.105.183","MQTT","79","Publish Message [res]"
"108","11.992166898","192.168.105.183","192.168.105.117","TCP","66","44065  >  1883 [ACK] Seq=180 Ack=143 Win=32128 Len=0 TSval=2887422021 TSecr=852107498"
"109","12.922782678","192.168.105.183","192.168.105.117","MQTT","81","Publish Message [topic]"
"110","12.923104446","192.168.105.117","192.168.105.183","TCP","66","1883  >  44065 [ACK] Seq=143 Ack=195 Win=31872 Len=0 TSval=852108440 TSecr=2887422943"
"111","12.924262456","192.168.105.117","192.168.105.71","MQTT","81","Publish Message [topic]"
"112","12.932975919","192.168.105.71","192.168.105.117","TCP","66","33761  >  1883 [ACK] Seq=160 Ack=180 Win=32128 Len=0 TSval=56495869 TSecr=3418158045"
"113","12.987357040","192.168.105.71","192.168.105.117","MQTT","79","Publish Message [res]"
"114","12.987548236","192.168.105.117","192.168.105.71","TCP","66","1883  >  33761 [ACK] Seq=180 Ack=173 Win=31872 Len=0 TSval=3418158108 TSecr=56495917"
"115","12.988623174","192.168.105.117","192.168.105.183","MQTT","79","Publish Message [res]"
"116","12.998785946","192.168.105.183","192.168.105.117","TCP","66","44065  >  1883 [ACK] Seq=195 Ack=156 Win=32128 Len=0 TSval=2887423025 TSecr=852108505"
"117","13.928447443","192.168.105.183","192.168.105.117","MQTT","81","Publish Message [topic]"
"118","13.928756816","192.168.105.117","192.168.105.183","TCP","66","1883  >  44065 [ACK] Seq=156 Ack=210 Win=31872 Len=0 TSval=852109446 TSecr=2887423946"
"119","13.929764254","192.168.105.117","192.168.105.71","MQTT","81","Publish Message [topic]"
"120","13.938561883","192.168.105.71","192.168.105.117","TCP","66","33761  >  1883 [ACK] Seq=173 Ack=195 Win=32128 Len=0 TSval=56496874 TSecr=3418159051"
"121","13.993535289","192.168.105.71","192.168.105.117","MQTT","79","Publish Message [res]"
"122","13.993630444","192.168.105.117","192.168.105.71","TCP","66","1883  >  33761 [ACK] Seq=195 Ack=186 Win=31872 Len=0 TSval=3418159115 TSecr=56496922"
"123","13.994264240","192.168.105.117","192.168.105.183","MQTT","79","Publish Message [res]"
"124","14.004434512","192.168.105.183","192.168.105.117","TCP","66","44065  >  1883 [ACK] Seq=210 Ack=169 Win=32128 Len=0 TSval=2887424032 TSecr=852109511"
"125","14.928635362","192.168.105.183","192.168.105.117","MQTT","81","Publish Message [topic]"
"126","14.928846610","192.168.105.117","192.168.105.183","TCP","66","1883  >  44065 [ACK] Seq=169 Ack=225 Win=31872 Len=0 TSval=852110446 TSecr=2887424948"
"127","14.929518531","192.168.105.117","192.168.105.71","MQTT","81","Publish Message [topic]"
"128","14.937848715","192.168.105.71","192.168.105.117","TCP","66","33761  >  1883 [ACK] Seq=186 Ack=210 Win=32128 Len=0 TSval=56497874 TSecr=3418160050"
"129","14.992290458","192.168.105.71","192.168.105.117","MQTT","79","Publish Message [res]"
"130","14.992381447","192.168.105.117","192.168.105.71","TCP","66","1883  >  33761 [ACK] Seq=210 Ack=199 Win=31872 Len=0 TSval=3418160113 TSecr=56497922"
"131","14.993002587","192.168.105.117","192.168.105.183","MQTT","79","Publish Message [res]"
"132","15.001762976","192.168.105.183","192.168.105.117","TCP","66","44065  >  1883 [ACK] Seq=225 Ack=182 Win=32128 Len=0 TSval=2887425030 TSecr=852110510"
"133","15.929574501","192.168.105.183","192.168.105.117","MQTT","81","Publish Message [topic]"
"134","15.929859810","192.168.105.117","192.168.105.183","TCP","66","1883  >  44065 [ACK] Seq=182 Ack=240 Win=31872 Len=0 TSval=852111447 TSecr=2887425950"
"135","15.930796729","192.168.105.117","192.168.105.71","MQTT","81","Publish Message [topic]"
"136","15.942349123","192.168.105.71","192.168.105.117","TCP","66","33761  >  1883 [ACK] Seq=199 Ack=225 Win=32128 Len=0 TSval=56498878 TSecr=3418161052"
"137","16.001640300","192.168.105.71","192.168.105.117","MQTT","79","Publish Message [res]"
"138","16.001796653","192.168.105.117","192.168.105.71","TCP","66","1883  >  33761 [ACK] Seq=225 Ack=212 Win=31872 Len=0 TSval=3418161123 TSecr=56498931"
"139","16.002621749","192.168.105.117","192.168.105.183","MQTT","79","Publish Message [res]"
"140","16.009760070","192.168.105.183","192.168.105.117","TCP","66","44065  >  1883 [ACK] Seq=240 Ack=195 Win=32128 Len=0 TSval=2887426039 TSecr=852111519"
"141","16.931396995","192.168.105.183","192.168.105.117","MQTT","81","Publish Message [topic]"
"142","16.931625795","192.168.105.117","192.168.105.183","TCP","66","1883  >  44065 [ACK] Seq=195 Ack=255 Win=31872 Len=0 TSval=852112449 TSecr=2887426952"
"143","16.932309278","192.168.105.117","192.168.105.71","MQTT","81","Publish Message [topic]"
"144","16.941026802","192.168.105.71","192.168.105.117","TCP","66","33761  >  1883 [ACK] Seq=212 Ack=240 Win=32128 Len=0 TSval=56499877 TSecr=3418162053"
"145","16.990104686","192.168.105.71","192.168.105.117","MQTT","79","Publish Message [res]"
"146","16.990208175","192.168.105.117","192.168.105.71","TCP","66","1883  >  33761 [ACK] Seq=240 Ack=225 Win=31872 Len=0 TSval=3418162111 TSecr=56499920"
"147","16.990805200","192.168.105.117","192.168.105.183","MQTT","79","Publish Message [res]"
"148","17.001110575","192.168.105.183","192.168.105.117","TCP","66","44065  >  1883 [ACK] Seq=255 Ack=208 Win=32128 Len=0 TSval=2887427028 TSecr=852112508"
"149","17.932924262","192.168.105.183","192.168.105.117","MQTT","81","Publish Message [topic]"
"150","17.933234207","192.168.105.117","192.168.105.183","TCP","66","1883  >  44065 [ACK] Seq=208 Ack=270 Win=31872 Len=0 TSval=852113450 TSecr=2887427953"
"151","17.934258208","192.168.105.117","192.168.105.71","MQTT","81","Publish Message [topic]"
"152","17.945459146","192.168.105.71","192.168.105.117","TCP","66","33761  >  1883 [ACK] Seq=225 Ack=255 Win=32128 Len=0 TSval=56500881 TSecr=3418163055"
"153","17.999751564","192.168.105.71","192.168.105.117","MQTT","79","Publish Message [res]"
"154","17.999923542","192.168.105.117","192.168.105.71","TCP","66","1883  >  33761 [ACK] Seq=255 Ack=238 Win=31872 Len=0 TSval=3418163121 TSecr=56500929"
"155","18.000878273","192.168.105.117","192.168.105.183","MQTT","79","Publish Message [res]"
"156","18.009140124","192.168.105.183","192.168.105.117","TCP","66","44065  >  1883 [ACK] Seq=270 Ack=221 Win=32128 Len=0 TSval=2887428038 TSecr=852113518"
"157","18.935257072","192.168.105.183","192.168.105.117","MQTT","81","Publish Message [topic]"
"158","18.935593371","192.168.105.117","192.168.105.183","TCP","66","1883  >  44065 [ACK] Seq=221 Ack=285 Win=31872 Len=0 TSval=852114452 TSecr=2887428955"
"159","18.936618622","192.168.105.117","192.168.105.71","MQTT","81","Publish Message [topic]"
"160","18.946250356","192.168.105.71","192.168.105.117","TCP","66","33761  >  1883 [ACK] Seq=238 Ack=270 Win=32128 Len=0 TSval=56501882 TSecr=3418164057"
"161","19.000536262","192.168.105.71","192.168.105.117","MQTT","79","Publish Message [res]"
"162","19.000717875","192.168.105.117","192.168.105.71","TCP","66","1883  >  33761 [ACK] Seq=270 Ack=251 Win=31872 Len=0 TSval=3418164122 TSecr=56501930"
"163","19.001714585","192.168.105.117","192.168.105.183","MQTT","79","Publish Message [res]"
"164","19.013611194","192.168.105.183","192.168.105.117","TCP","66","44065  >  1883 [ACK] Seq=285 Ack=234 Win=32128 Len=0 TSval=2887429041 TSecr=852114519"
"165","19.937411007","192.168.105.183","192.168.105.117","MQTT","81","Publish Message [topic]"
"166","19.937723348","192.168.105.117","192.168.105.183","TCP","66","1883  >  44065 [ACK] Seq=234 Ack=300 Win=31872 Len=0 TSval=852115455 TSecr=2887429957"
"167","19.938705526","192.168.105.117","192.168.105.71","MQTT","81","Publish Message [topic]"
"168","19.947876692","192.168.105.71","192.168.105.117","TCP","66","33761  >  1883 [ACK] Seq=251 Ack=285 Win=32128 Len=0 TSval=56502883 TSecr=3418165060"
"169","19.997026655","192.168.105.71","192.168.105.117","MQTT","79","Publish Message [res]"
"170","19.997220507","192.168.105.117","192.168.105.71","TCP","66","1883  >  33761 [ACK] Seq=285 Ack=264 Win=31872 Len=0 TSval=3418165118 TSecr=56502926"
"171","19.998217477","192.168.105.117","192.168.105.183","MQTT","79","Publish Message [res]"
"172","20.008127698","192.168.105.183","192.168.105.117","TCP","66","44065  >  1883 [ACK] Seq=300 Ack=247 Win=32128 Len=0 TSval=2887430035 TSecr=852115515"
"173","20.938896385","192.168.105.183","192.168.105.117","MQTT","81","Publish Message [topic]"
"174","20.939105029","192.168.105.117","192.168.105.183","TCP","66","1883  >  44065 [ACK] Seq=247 Ack=315 Win=31872 Len=0 TSval=852116456 TSecr=2887430960"
"175","20.939774190","192.168.105.117","192.168.105.71","MQTT","81","Publish Message [topic]"
"176","20.948550983","192.168.105.71","192.168.105.117","TCP","66","33761  >  1883 [ACK] Seq=264 Ack=300 Win=32128 Len=0 TSval=56503884 TSecr=3418166061"
"177","21.002402100","192.168.105.71","192.168.105.117","MQTT","79","Publish Message [res]"
"178","21.002521161","192.168.105.117","192.168.105.71","TCP","66","1883  >  33761 [ACK] Seq=300 Ack=277 Win=31872 Len=0 TSval=3418166123 TSecr=56503932"
"179","21.003124020","192.168.105.117","192.168.105.183","MQTT","79","Publish Message [res]"
"180","21.012245811","192.168.105.183","192.168.105.117","TCP","66","44065  >  1883 [ACK] Seq=315 Ack=260 Win=32128 Len=0 TSval=2887431041 TSecr=852116520"
"181","21.511645926","192.168.105.237","224.0.0.251","MDNS","337","Standard query 0x0000 PTR lb._dns-sd._udp.local, ""QM"" question PTR _airport._tcp.local, ""QM"" question PTR _rdlink._tcp.local, ""QM"" question PTR _printer._tcp.local, ""QM"" question PTR _uscans._tcp.local, ""QM"" question PTR _pdl-datastream._tcp.local, ""QM"" question PTR _uscan._tcp.local, ""QM"" question PTR _ptp._tcp.local, ""QM"" question PTR _scanner._tcp.local, ""QM"" question PTR _ippusb._tcp.local, ""QM"" question PTR _apple-mobdev._tcp.local, ""QM"" question PTR 8ef107cb._sub._apple-mobdev2._tcp.local, ""QM"" question PTR _apple-pairable._tcp.local, ""QM"" question PTR _companion-link._tcp.local, ""QM"" question PTR _sleep-proxy._udp.local, ""QM"" question"
"182","21.515004489","fe80::10ae:eaf2:aeb4:796a","ff02::fb","MDNS","357","Standard query 0x0000 PTR lb._dns-sd._udp.local, ""QM"" question PTR _airport._tcp.local, ""QM"" question PTR _rdlink._tcp.local, ""QM"" question PTR _printer._tcp.local, ""QM"" question PTR _uscans._tcp.local, ""QM"" question PTR _pdl-datastream._tcp.local, ""QM"" question PTR _uscan._tcp.local, ""QM"" question PTR _ptp._tcp.local, ""QM"" question PTR _scanner._tcp.local, ""QM"" question PTR _ippusb._tcp.local, ""QM"" question PTR _apple-mobdev._tcp.local, ""QM"" question PTR 8ef107cb._sub._apple-mobdev2._tcp.local, ""QM"" question PTR _apple-pairable._tcp.local, ""QM"" question PTR _companion-link._tcp.local, ""QM"" question PTR _sleep-proxy._udp.local, ""QM"" question"
"183","21.941707354","192.168.105.183","192.168.105.117","MQTT","81","Publish Message [topic]"
"184","21.941989175","192.168.105.117","192.168.105.183","TCP","66","1883  >  44065 [ACK] Seq=260 Ack=330 Win=31872 Len=0 TSval=852117459 TSecr=2887431962"
"185","21.942982707","192.168.105.117","192.168.105.71","MQTT","81","Publish Message [topic]"
"186","21.951255443","192.168.105.71","192.168.105.117","TCP","66","33761  >  1883 [ACK] Seq=277 Ack=315 Win=32128 Len=0 TSval=56504887 TSecr=3418167064"
"187","22.004940570","192.168.105.71","192.168.105.117","MQTT","79","Publish Message [res]"
"188","22.005166036","192.168.105.117","192.168.105.71","TCP","66","1883  >  33761 [ACK] Seq=315 Ack=290 Win=31872 Len=0 TSval=3418167126 TSecr=56504935"
"189","22.006190662","192.168.105.117","192.168.105.183","MQTT","79","Publish Message [res]"
"190","22.017733524","192.168.105.183","192.168.105.117","TCP","66","44065  >  1883 [ACK] Seq=330 Ack=273 Win=32128 Len=0 TSval=2887432046 TSecr=852117523"
"191","22.943568623","192.168.105.183","192.168.105.117","MQTT","81","Publish Message [topic]"
"192","22.943870182","192.168.105.117","192.168.105.183","TCP","66","1883  >  44065 [ACK] Seq=273 Ack=345 Win=31872 Len=0 TSval=852118461 TSecr=2887432964"
"193","22.944948766","192.168.105.117","192.168.105.71","MQTT","81","Publish Message [topic]"
"194","22.955684291","192.168.105.71","192.168.105.117","TCP","66","33761  >  1883 [ACK] Seq=290 Ack=330 Win=32128 Len=0 TSval=56505891 TSecr=3418168066"
"195","23.001449126","192.168.105.71","192.168.105.117","MQTT","79","Publish Message [res]"
"196","23.001675843","192.168.105.117","192.168.105.71","TCP","66","1883  >  33761 [ACK] Seq=330 Ack=303 Win=31872 Len=0 TSval=3418168123 TSecr=56505934"
"197","23.002642500","192.168.105.117","192.168.105.183","MQTT","79","Publish Message [res]"
"198","23.011070339","192.168.105.183","192.168.105.117","TCP","66","44065  >  1883 [ACK] Seq=345 Ack=286 Win=32128 Len=0 TSval=2887433040 TSecr=852118519"
"199","23.945395651","192.168.105.183","192.168.105.117","MQTT","81","Publish Message [topic]"
"200","23.945699033","192.168.105.117","192.168.105.183","TCP","66","1883  >  44065 [ACK] Seq=286 Ack=360 Win=31872 Len=0 TSval=852119463 TSecr=2887433966"
"201","23.946702930","192.168.105.117","192.168.105.71","MQTT","81","Publish Message [topic]"
"202","23.956875231","192.168.105.71","192.168.105.117","TCP","66","33761  >  1883 [ACK] Seq=303 Ack=345 Win=32128 Len=0 TSval=56506891 TSecr=3418169068"
"203","24.009955153","192.168.105.71","192.168.105.117","MQTT","79","Publish Message [res]"
"204","24.010168485","192.168.105.117","192.168.105.71","TCP","66","1883  >  33761 [ACK] Seq=345 Ack=316 Win=31872 Len=0 TSval=3418169131 TSecr=56506940"
"205","24.011166600","192.168.105.117","192.168.105.183","MQTT","79","Publish Message [res]"
"206","24.020925884","192.168.105.183","192.168.105.117","TCP","66","44065  >  1883 [ACK] Seq=360 Ack=299 Win=32128 Len=0 TSval=2887434049 TSecr=852119528"
"207","24.948767590","192.168.105.183","192.168.105.117","MQTT","81","Publish Message [topic]"
"208","24.949077952","192.168.105.117","192.168.105.183","TCP","66","1883  >  44065 [ACK] Seq=299 Ack=375 Win=31872 Len=0 TSval=852120466 TSecr=2887434968"
"209","24.950094297","192.168.105.117","192.168.105.71","MQTT","81","Publish Message [topic]"
"210","24.958665310","192.168.105.71","192.168.105.117","TCP","66","33761  >  1883 [ACK] Seq=316 Ack=360 Win=32128 Len=0 TSval=56507894 TSecr=3418170071"
"211","25.012799961","192.168.105.71","192.168.105.117","MQTT","79","Publish Message [res]"
"212","25.012982199","192.168.105.117","192.168.105.71","TCP","66","1883  >  33761 [ACK] Seq=360 Ack=329 Win=31872 Len=0 TSval=3418170134 TSecr=56507942"
"213","25.013983127","192.168.105.117","192.168.105.183","MQTT","79","Publish Message [res]"
"214","25.022851794","192.168.105.183","192.168.105.117","TCP","66","44065  >  1883 [ACK] Seq=375 Ack=312 Win=32128 Len=0 TSval=2887435051 TSecr=852120531"
"215","25.950602231","192.168.105.183","192.168.105.117","MQTT","81","Publish Message [topic]"
"216","25.950923009","192.168.105.117","192.168.105.183","TCP","66","1883  >  44065 [ACK] Seq=312 Ack=390 Win=31872 Len=0 TSval=852121468 TSecr=2887435970"
"217","25.952006645","192.168.105.117","192.168.105.71","MQTT","81","Publish Message [topic]"
"218","25.960674897","192.168.105.71","192.168.105.117","TCP","66","33761  >  1883 [ACK] Seq=329 Ack=375 Win=32128 Len=0 TSval=56508896 TSecr=3418171073"
"219","26.014930691","192.168.105.71","192.168.105.117","MQTT","79","Publish Message [res]"
"220","26.015089075","192.168.105.117","192.168.105.71","TCP","66","1883  >  33761 [ACK] Seq=375 Ack=342 Win=31872 Len=0 TSval=3418171136 TSecr=56508944"
"221","26.016167711","192.168.105.117","192.168.105.183","MQTT","79","Publish Message [res]"
"222","26.022465621","192.168.105.183","192.168.105.117","TCP","66","44065  >  1883 [ACK] Seq=390 Ack=325 Win=32128 Len=0 TSval=2887436050 TSecr=852121533"
"223","26.951325246","192.168.105.183","192.168.105.117","MQTT","81","Publish Message [topic]"
"224","26.951668784","192.168.105.117","192.168.105.183","TCP","66","1883  >  44065 [ACK] Seq=325 Ack=405 Win=31872 Len=0 TSval=852122469 TSecr=2887436971"
"225","26.952709348","192.168.105.117","192.168.105.71","MQTT","81","Publish Message [topic]"
"226","26.961367756","192.168.105.71","192.168.105.117","TCP","66","33761  >  1883 [ACK] Seq=342 Ack=390 Win=32128 Len=0 TSval=56509897 TSecr=3418172074"
"227","27.021768439","192.168.105.71","192.168.105.117","MQTT","79","Publish Message [res]"
"228","27.021942500","192.168.105.117","192.168.105.71","TCP","66","1883  >  33761 [ACK] Seq=390 Ack=355 Win=31872 Len=0 TSval=3418172143 TSecr=56509950"
"229","27.022881293","192.168.105.117","192.168.105.183","MQTT","79","Publish Message [res]"
"230","27.035497269","192.168.105.183","192.168.105.117","TCP","66","44065  >  1883 [ACK] Seq=405 Ack=338 Win=32128 Len=0 TSval=2887437064 TSecr=852122540"
"231","27.955693986","192.168.105.183","192.168.105.117","MQTT","81","Publish Message [topic]"
"232","27.956019452","192.168.105.117","192.168.105.183","TCP","66","1883  >  44065 [ACK] Seq=338 Ack=420 Win=31872 Len=0 TSval=852123473 TSecr=2887437974"
"233","27.957063661","192.168.105.117","192.168.105.71","MQTT","81","Publish Message [topic]"
"234","27.965213949","192.168.105.71","192.168.105.117","TCP","66","33761  >  1883 [ACK] Seq=355 Ack=405 Win=32128 Len=0 TSval=56510901 TSecr=3418173078"
"235","28.020320982","192.168.105.71","192.168.105.117","MQTT","79","Publish Message [res]"
"236","28.020487960","192.168.105.117","192.168.105.71","TCP","66","1883  >  33761 [ACK] Seq=405 Ack=368 Win=31872 Len=0 TSval=3418173141 TSecr=56510949"
"237","28.021433889","192.168.105.117","192.168.105.183","MQTT","79","Publish Message [res]"
"238","28.030131151","192.168.105.183","192.168.105.117","TCP","66","44065  >  1883 [ACK] Seq=420 Ack=351 Win=32128 Len=0 TSval=2887438058 TSecr=852123538"
"239","28.552810970","192.168.105.174","224.0.0.251","MDNS","82","Standard query 0x00ab PTR _quickshare._tcp.local, ""QM"" question"
"240","28.553141801","fe80::a081:24ff:fe63:2646","ff02::fb","MDNS","102","Standard query 0x00ab PTR _quickshare._tcp.local, ""QM"" question"
"241","28.956629143","192.168.105.183","192.168.105.117","MQTT","81","Publish Message [topic]"
"242","28.956844141","192.168.105.117","192.168.105.183","TCP","66","1883  >  44065 [ACK] Seq=351 Ack=435 Win=31872 Len=0 TSval=852124474 TSecr=2887438976"
"243","28.957520385","192.168.105.117","192.168.105.71","MQTT","81","Publish Message [topic]"
"244","28.965624944","192.168.105.71","192.168.105.117","TCP","66","33761  >  1883 [ACK] Seq=368 Ack=420 Win=32128 Len=0 TSval=56511901 TSecr=3418174078"
"245","29.019610529","192.168.105.71","192.168.105.117","MQTT","79","Publish Message [res]"
"246","29.019725892","192.168.105.117","192.168.105.71","TCP","66","1883  >  33761 [ACK] Seq=420 Ack=381 Win=31872 Len=0 TSval=3418174141 TSecr=56511950"
"247","29.020421146","192.168.105.117","192.168.105.183","MQTT","79","Publish Message [res]"
"248","29.028502216","192.168.105.183","192.168.105.117","TCP","66","44065  >  1883 [ACK] Seq=435 Ack=364 Win=32128 Len=0 TSval=2887439057 TSecr=852124537"
"249","29.957373187","192.168.105.183","192.168.105.117","MQTT","81","Publish Message [topic]"
"250","29.957686778","192.168.105.117","192.168.105.183","TCP","66","1883  >  44065 [ACK] Seq=364 Ack=450 Win=31872 Len=0 TSval=852125475 TSecr=2887439977"
"251","29.958698122","192.168.105.117","192.168.105.71","MQTT","81","Publish Message [topic]"
"252","29.969215940","192.168.105.71","192.168.105.117","TCP","66","33761  >  1883 [ACK] Seq=381 Ack=435 Win=32128 Len=0 TSval=56512905 TSecr=3418175080"
"253","30.023594853","192.168.105.71","192.168.105.117","MQTT","79","Publish Message [res]"
"254","30.023777924","192.168.105.117","192.168.105.71","TCP","66","1883  >  33761 [ACK] Seq=435 Ack=394 Win=31872 Len=0 TSval=3418175145 TSecr=56512953"
"255","30.024835570","192.168.105.117","192.168.105.183","MQTT","79","Publish Message [res]"
"256","30.033306584","192.168.105.183","192.168.105.117","TCP","66","44065  >  1883 [ACK] Seq=450 Ack=377 Win=32128 Len=0 TSval=2887440061 TSecr=852125542"
"257","30.959037929","192.168.105.183","192.168.105.117","MQTT","81","Publish Message [topic]"
"258","30.959353864","192.168.105.117","192.168.105.183","TCP","66","1883  >  44065 [ACK] Seq=377 Ack=465 Win=31872 Len=0 TSval=852126476 TSecr=2887440979"
"259","30.960422604","192.168.105.117","192.168.105.71","MQTT","81","Publish Message [topic]"
"260","30.978396913","192.168.105.71","192.168.105.117","TCP","66","33761  >  1883 [ACK] Seq=394 Ack=450 Win=32128 Len=0 TSval=56513912 TSecr=3418176081"
"261","31.035998399","192.168.105.71","192.168.105.117","MQTT","79","Publish Message [res]"
"262","31.036177251","192.168.105.117","192.168.105.71","TCP","66","1883  >  33761 [ACK] Seq=450 Ack=407 Win=31872 Len=0 TSval=3418176157 TSecr=56513965"
"263","31.037160992","192.168.105.117","192.168.105.183","MQTT","79","Publish Message [res]"
"264","31.048176148","192.168.105.183","192.168.105.117","TCP","66","44065  >  1883 [ACK] Seq=465 Ack=390 Win=32128 Len=0 TSval=2887441075 TSecr=852126554"
"265","31.959605786","192.168.105.183","192.168.105.117","MQTT","81","Publish Message [topic]"
"266","31.959913543","192.168.105.117","192.168.105.183","TCP","66","1883  >  44065 [ACK] Seq=390 Ack=480 Win=31872 Len=0 TSval=852127477 TSecr=2887441981"
"267","31.960917961","192.168.105.117","192.168.105.71","MQTT","81","Publish Message [topic]"
"268","31.970091624","192.168.105.71","192.168.105.117","TCP","66","33761  >  1883 [ACK] Seq=407 Ack=465 Win=32128 Len=0 TSval=56514906 TSecr=3418177082"
"269","32.017677735","Intel_c0:23:c6","RaspberryPiF_23:9f:e9","ARP","42","Who has 192.168.105.117? Tell 192.168.105.30"
"270","32.017723828","RaspberryPiF_23:9f:e9","Intel_c0:23:c6","ARP","42","192.168.105.117 is at b8:27:eb:23:9f:e9"
"271","32.022756124","192.168.105.71","192.168.105.117","MQTT","79","Publish Message [res]"
"272","32.022971799","192.168.105.117","192.168.105.71","TCP","66","1883  >  33761 [ACK] Seq=465 Ack=420 Win=31872 Len=0 TSval=3418177144 TSecr=56514954"
"273","32.024107309","192.168.105.117","192.168.105.183","MQTT","79","Publish Message [res]"
"274","32.032036348","192.168.105.183","192.168.105.117","TCP","66","44065  >  1883 [ACK] Seq=480 Ack=403 Win=32128 Len=0 TSval=2887442059 TSecr=852127541"
"275","32.961722148","192.168.105.183","192.168.105.117","MQTT","81","Publish Message [topic]"
"276","32.962027041","192.168.105.117","192.168.105.183","TCP","66","1883  >  44065 [ACK] Seq=403 Ack=495 Win=31872 Len=0 TSval=852128479 TSecr=2887442983"
"277","32.963031719","192.168.105.117","192.168.105.71","MQTT","81","Publish Message [topic]"
"278","32.979816299","192.168.105.71","192.168.105.117","TCP","66","33761  >  1883 [ACK] Seq=420 Ack=480 Win=32128 Len=0 TSval=56515909 TSecr=3418178084"
"279","33.023622445","192.168.105.71","192.168.105.117","MQTT","79","Publish Message [res]"
"280","33.023805932","192.168.105.117","192.168.105.71","TCP","66","1883  >  33761 [ACK] Seq=480 Ack=433 Win=31872 Len=0 TSval=3418178145 TSecr=56515952"
"281","33.024815298","192.168.105.117","192.168.105.183","MQTT","79","Publish Message [res]"
"282","33.034970722","192.168.105.183","192.168.105.117","TCP","66","44065  >  1883 [ACK] Seq=495 Ack=416 Win=32128 Len=0 TSval=2887443061 TSecr=852128542"
"283","33.963936144","192.168.105.183","192.168.105.117","MQTT","81","Publish Message [topic]"
"284","33.964233849","192.168.105.117","192.168.105.183","TCP","66","1883  >  44065 [ACK] Seq=416 Ack=510 Win=31872 Len=0 TSval=852129481 TSecr=2887443985"
"285","33.965192590","192.168.105.117","192.168.105.71","MQTT","81","Publish Message [topic]"
"286","33.973883862","192.168.105.71","192.168.105.117","TCP","66","33761  >  1883 [ACK] Seq=433 Ack=495 Win=32128 Len=0 TSval=56516910 TSecr=3418179086"
"287","34.028868494","192.168.105.71","192.168.105.117","MQTT","79","Publish Message [res]"
"288","34.029102710","192.168.105.117","192.168.105.71","TCP","66","1883  >  33761 [ACK] Seq=495 Ack=446 Win=31872 Len=0 TSval=3418179150 TSecr=56516958"
"289","34.030081242","192.168.105.117","192.168.105.183","MQTT","79","Publish Message [res]"
"290","34.038280383","192.168.105.183","192.168.105.117","TCP","66","44065  >  1883 [ACK] Seq=510 Ack=429 Win=32128 Len=0 TSval=2887444066 TSecr=852129547"
"291","34.967905779","192.168.105.183","192.168.105.117","MQTT","81","Publish Message [topic]"
"292","34.968211661","192.168.105.117","192.168.105.183","TCP","66","1883  >  44065 [ACK] Seq=429 Ack=525 Win=31872 Len=0 TSval=852130485 TSecr=2887444988"
"293","34.969288474","192.168.105.117","192.168.105.71","MQTT","81","Publish Message [topic]"
"294","34.983179018","192.168.105.71","192.168.105.117","TCP","66","33761  >  1883 [ACK] Seq=446 Ack=510 Win=32128 Len=0 TSval=56517916 TSecr=3418180090"
"295","35.025626790","192.168.105.71","192.168.105.117","MQTT","79","Publish Message [res]"
"296","35.025874340","192.168.105.117","192.168.105.71","TCP","66","1883  >  33761 [ACK] Seq=510 Ack=459 Win=31872 Len=0 TSval=3418180147 TSecr=56517959"
"297","35.026904955","192.168.105.117","192.168.105.183","MQTT","79","Publish Message [res]"
"298","35.031708503","192.168.105.183","192.168.105.117","TCP","66","44065  >  1883 [ACK] Seq=525 Ack=442 Win=32128 Len=0 TSval=2887445060 TSecr=852130544"
"299","35.969273230","192.168.105.183","192.168.105.117","MQTT","81","Publish Message [topic]"
"300","35.969585154","192.168.105.117","192.168.105.183","TCP","66","1883  >  44065 [ACK] Seq=442 Ack=540 Win=31872 Len=0 TSval=852131486 TSecr=2887445989"
"301","35.970605352","192.168.105.117","192.168.105.71","MQTT","81","Publish Message [topic]"
"302","35.979417612","192.168.105.71","192.168.105.117","TCP","66","33761  >  1883 [ACK] Seq=459 Ack=525 Win=32128 Len=0 TSval=56518915 TSecr=3418181091"
"303","36.020819663","192.168.105.71","192.168.105.117","MQTT","79","Publish Message [res]"
"304","36.020993724","192.168.105.117","192.168.105.71","TCP","66","1883  >  33761 [ACK] Seq=525 Ack=472 Win=31872 Len=0 TSval=3418181142 TSecr=56518953"
"305","36.021949757","192.168.105.117","192.168.105.183","MQTT","79","Publish Message [res]"
"306","36.030457019","192.168.105.183","192.168.105.117","TCP","66","44065  >  1883 [ACK] Seq=540 Ack=455 Win=32128 Len=0 TSval=2887446059 TSecr=852131539"
"307","36.971103676","192.168.105.183","192.168.105.117","MQTT","81","Publish Message [topic]"
"308","36.971417006","192.168.105.117","192.168.105.183","TCP","66","1883  >  44065 [ACK] Seq=455 Ack=555 Win=31872 Len=0 TSval=852132488 TSecr=2887446991"
"309","36.972518245","192.168.105.117","192.168.105.71","MQTT","81","Publish Message [topic]"
"310","37.033160007","192.168.105.71","192.168.105.117","TCP","66","33761  >  1883 [ACK] Seq=472 Ack=540 Win=32128 Len=0 TSval=56519966 TSecr=3418182093"
"311","37.045780563","192.168.105.71","192.168.105.117","MQTT","79","Publish Message [res]"
