"No.","Time","Source","Destination","Protocol","Length","Info"
"1","0.000000000","192.168.105.183","192.168.105.71","TCP","74","45298  >  8000 [SYN] Seq=0 Win=32120 Len=0 MSS=1460 SACK_PERM TSval=608387023 TSecr=0 WS=128"
"2","0.099809256","192.168.105.71","192.168.105.183","TCP","74","8000  >  45298 [SYN, ACK] Seq=0 Ack=1 Win=31856 Len=0 MSS=1460 SACK_PERM TSval=1640707430 TSecr=608387023 WS=128"
"3","0.099922017","192.168.105.183","192.168.105.71","TCP","66","45298  >  8000 [ACK] Seq=1 Ack=1 Win=32128 Len=0 TSval=608387123 TSecr=1640707430"
"4","0.100127329","192.168.105.183","192.168.105.71","TCP","262","45298  >  8000 [PSH, ACK] Seq=1 Ack=1 Win=32128 Len=196 TSval=608387124 TSecr=1640707430 [TCP segment of a reassembled PDU]"
"5","0.100221705","192.168.105.183","192.168.105.71","HTTP","71","POST / HTTP/1.1  (text/plain)"
"6","0.107960930","192.168.105.71","192.168.105.183","TCP","66","8000  >  45298 [ACK] Seq=1 Ack=202 Win=31872 Len=0 TSval=1640707441 TSecr=608387124"
"7","0.109581609","192.168.105.71","192.168.105.183","TCP","158","8000  >  45298 [PSH, ACK] Seq=1 Ack=202 Win=31872 Len=92 TSval=1640707444 TSecr=608387124 [TCP segment of a reassembled PDU]"
"8","0.109633796","192.168.105.183","192.168.105.71","TCP","66","45298  >  8000 [ACK] Seq=202 Ack=93 Win=32128 Len=0 TSval=608387133 TSecr=1640707444"
"9","0.109714161","192.168.105.71","192.168.105.183","HTTP","71","HTTP/1.0 200 OK "
"10","0.344178901","192.168.105.71","192.168.105.183","TCP","71","[TCP Retransmission] 8000  >  45298 [FIN, PSH, ACK] Seq=93 Ack=202 Win=31872 Len=5 TSval=1640707664 TSecr=608387133 [TCP segment of a reassembled PDU]"
"11","0.344261557","192.168.105.183","192.168.105.71","TCP","78","[TCP Previous segment not captured] 45298  >  8000 [ACK] Seq=203 Ack=99 Win=32128 Len=0 TSval=608387368 TSecr=1640707664 SLE=93 SRE=99"
"12","0.410033699","192.168.105.183","192.168.105.71","TCP","66","[TCP Out-Of-Order] 45298  >  8000 [FIN, ACK] Seq=202 Ack=99 Win=32128 Len=0 TSval=608387434 TSecr=1640707664"
"13","0.421971730","192.168.105.71","192.168.105.183","TCP","66","8000  >  45298 [ACK] Seq=99 Ack=203 Win=31872 Len=0 TSval=1640707756 TSecr=608387434"
"14","1.123176468","192.168.105.183","192.168.105.71","TCP","74","45300  >  8000 [SYN] Seq=0 Win=32120 Len=0 MSS=1460 SACK_PERM TSval=608388147 TSecr=0 WS=128"
"15","1.140916379","192.168.105.71","192.168.105.183","TCP","74","8000  >  45300 [SYN, ACK] Seq=0 Ack=1 Win=31856 Len=0 MSS=1460 SACK_PERM TSval=1640708471 TSecr=608388147 WS=128"
"16","1.141038931","192.168.105.183","192.168.105.71","TCP","66","45300  >  8000 [ACK] Seq=1 Ack=1 Win=32128 Len=0 TSval=608388165 TSecr=1640708471"
"17","1.141212056","192.168.105.183","192.168.105.71","TCP","262","45300  >  8000 [PSH, ACK] Seq=1 Ack=1 Win=32128 Len=196 TSval=608388165 TSecr=1640708471 [TCP segment of a reassembled PDU]"
"18","1.141356327","192.168.105.183","192.168.105.71","HTTP","71","POST / HTTP/1.1  (text/plain)"
"19","1.153409515","192.168.105.71","192.168.105.183","TCP","66","8000  >  45300 [ACK] Seq=1 Ack=202 Win=31872 Len=0 TSval=1640708487 TSecr=608388165"
"20","1.156169830","192.168.105.71","192.168.105.183","TCP","158","8000  >  45300 [PSH, ACK] Seq=1 Ack=202 Win=31872 Len=92 TSval=1640708490 TSecr=608388165 [TCP segment of a reassembled PDU]"
"21","1.156221445","192.168.105.183","192.168.105.71","TCP","66","45300  >  8000 [ACK] Seq=202 Ack=93 Win=32128 Len=0 TSval=608388180 TSecr=1640708490"
"22","1.156346549","192.168.105.71","192.168.105.183","HTTP","71","HTTP/1.0 200 OK "
"23","1.159380354","192.168.105.183","192.168.105.71","TCP","66","45300  >  8000 [FIN, ACK] Seq=202 Ack=99 Win=32128 Len=0 TSval=608388183 TSecr=1640708491"
"24","1.165710516","192.168.105.71","192.168.105.183","TCP","66","8000  >  45300 [ACK] Seq=99 Ack=203 Win=31872 Len=0 TSval=1640708499 TSecr=608388183"
"25","3.194054955","192.168.105.183","192.168.105.71","TCP","74","45308  >  8000 [SYN] Seq=0 Win=32120 Len=0 MSS=1460 SACK_PERM TSval=608390218 TSecr=0 WS=128"
"26","3.210171896","192.168.105.71","192.168.105.183","TCP","74","8000  >  45308 [SYN, ACK] Seq=0 Ack=1 Win=31856 Len=0 MSS=1460 SACK_PERM TSval=1640710544 TSecr=608390218 WS=128"
"27","3.210418146","192.168.105.183","192.168.105.71","TCP","262","45308  >  8000 [PSH, ACK] Seq=1 Ack=1 Win=32128 Len=196 TSval=608390234 TSecr=1640710544 [TCP segment of a reassembled PDU]"
"28","3.210513407","192.168.105.183","192.168.105.71","HTTP","71","POST / HTTP/1.1  (text/plain)"
"29","3.216038099","192.168.105.71","192.168.105.183","TCP","66","8000  >  45308 [ACK] Seq=1 Ack=197 Win=31872 Len=0 TSval=1640710550 TSecr=608390234"
"30","3.216138620","192.168.105.71","192.168.105.183","TCP","66","8000  >  45308 [ACK] Seq=1 Ack=202 Win=31872 Len=0 TSval=1640710551 TSecr=608390234"
"31","3.227943109","192.168.105.71","192.168.105.183","TCP","158","8000  >  45308 [PSH, ACK] Seq=1 Ack=202 Win=31872 Len=92 TSval=1640710555 TSecr=608390234 [TCP segment of a reassembled PDU]"
"32","3.227973161","192.168.105.183","192.168.105.71","TCP","66","45308  >  8000 [ACK] Seq=202 Ack=93 Win=32128 Len=0 TSval=608390251 TSecr=1640710555"
"33","3.229486288","192.168.105.71","192.168.105.183","HTTP","71","HTTP/1.0 200 OK "
"34","3.229794986","192.168.105.183","192.168.105.71","TCP","66","45308  >  8000 [FIN, ACK] Seq=202 Ack=99 Win=32128 Len=0 TSval=608390253 TSecr=1640710556"
"35","3.235863220","192.168.105.71","192.168.105.183","TCP","66","8000  >  45308 [ACK] Seq=99 Ack=203 Win=31872 Len=0 TSval=1640710569 TSecr=608390253"
"36","4.437682025","a2:81:24:63:26:46","Broadcast","ARP","42","Who has 192.168.105.237? Tell 192.168.105.174"
"37","5.242033188","192.168.105.183","192.168.105.71","TCP","74","45320  >  8000 [SYN] Seq=0 Win=32120 Len=0 MSS=1460 SACK_PERM TSval=608392266 TSecr=0 WS=128"
"38","5.254048407","192.168.105.71","192.168.105.183","TCP","74","8000  >  45320 [SYN, ACK] Seq=0 Ack=1 Win=31856 Len=0 MSS=1460 SACK_PERM TSval=1640712588 TSecr=608392266 WS=128"
"39","5.254128719","192.168.105.183","192.168.105.71","TCP","66","45320  >  8000 [ACK] Seq=1 Ack=1 Win=32128 Len=0 TSval=608392278 TSecr=1640712588"
"40","5.286042861","192.168.105.183","192.168.105.71","TCP","71","[TCP Previous segment not captured] 45320  >  8000 [PSH, ACK] Seq=197 Ack=1 Win=32128 Len=5 TSval=608392310 TSecr=1640712588"
"41","5.295106828","192.168.105.71","192.168.105.183","TCP","78","[TCP Window Update] 8000  >  45320 [ACK] Seq=1 Ack=1 Win=31872 Len=0 TSval=1640712629 TSecr=608392278 SLE=197 SRE=202"
"42","5.457877696","a2:81:24:63:26:46","Broadcast","ARP","42","Who has 192.168.105.237? Tell 192.168.105.174"
"43","6.482647116","a2:81:24:63:26:46","Broadcast","ARP","42","Who has 192.168.105.237? Tell 192.168.105.174"
"44","6.554050250","192.168.105.183","192.168.105.71","TCP","262","[TCP Retransmission] 45320  >  8000 [PSH, ACK] Seq=1 Ack=1 Win=32128 Len=196 TSval=608393578 TSecr=1640712629"
"45","6.569807971","192.168.105.71","192.168.105.183","TCP","66","8000  >  45320 [ACK] Seq=1 Ack=202 Win=31872 Len=0 TSval=1640713900 TSecr=608393578"
"46","6.569974742","192.168.105.71","192.168.105.183","TCP","158","8000  >  45320 [PSH, ACK] Seq=1 Ack=202 Win=31872 Len=92 TSval=1640713903 TSecr=608393578 [TCP segment of a reassembled PDU]"
"47","6.570015055","192.168.105.183","192.168.105.71","TCP","66","45320  >  8000 [ACK] Seq=202 Ack=93 Win=32128 Len=0 TSval=608393593 TSecr=1640713903"
"48","6.570110576","192.168.105.71","192.168.105.183","HTTP","71","HTTP/1.0 200 OK "
"49","6.571896254","192.168.105.183","192.168.105.71","TCP","66","45320  >  8000 [FIN, ACK] Seq=202 Ack=99 Win=32128 Len=0 TSval=608393595 TSecr=1640713903"
"50","6.579568188","192.168.105.71","192.168.105.183","TCP","66","8000  >  45320 [ACK] Seq=99 Ack=203 Win=31872 Len=0 TSval=1640713911 TSecr=608393595"
"51","7.546035364","a2:81:24:63:26:46","Broadcast","ARP","42","Who has 192.168.105.237? Tell 192.168.105.174"
"52","7.581895550","192.168.105.183","192.168.105.71","TCP","74","45330  >  8000 [SYN] Seq=0 Win=32120 Len=0 MSS=1460 SACK_PERM TSval=608394605 TSecr=0 WS=128"
"53","7.593850873","192.168.105.71","192.168.105.183","TCP","74","8000  >  45330 [SYN, ACK] Seq=0 Ack=1 Win=31856 Len=0 MSS=1460 SACK_PERM TSval=1640714928 TSecr=608394605 WS=128"
"54","7.593970196","192.168.105.183","192.168.105.71","TCP","66","45330  >  8000 [ACK] Seq=1 Ack=1 Win=32128 Len=0 TSval=608394617 TSecr=1640714928"
"55","7.594210300","192.168.105.183","192.168.105.71","TCP","71","[TCP Previous segment not captured] 45330  >  8000 [PSH, ACK] Seq=197 Ack=1 Win=32128 Len=5 TSval=608394618 TSecr=1640714928"
"56","7.600507858","192.168.105.71","192.168.105.183","TCP","78","[TCP Window Update] 8000  >  45330 [ACK] Seq=1 Ack=1 Win=31872 Len=0 TSval=1640714934 TSecr=608394617 SLE=197 SRE=202"
"57","7.606055935","192.168.105.183","192.168.105.71","TCP","262","[TCP Out-Of-Order] 45330  >  8000 [PSH, ACK] Seq=1 Ack=1 Win=32128 Len=196 TSval=608394630 TSecr=1640714934"
"58","7.611311825","192.168.105.71","192.168.105.183","TCP","66","8000  >  45330 [ACK] Seq=1 Ack=202 Win=31872 Len=0 TSval=1640714946 TSecr=608394630"
"59","7.615953392","192.168.105.71","192.168.105.183","TCP","158","8000  >  45330 [PSH, ACK] Seq=1 Ack=202 Win=31872 Len=92 TSval=1640714949 TSecr=608394630 [TCP segment of a reassembled PDU]"
"60","7.615996881","192.168.105.183","192.168.105.71","TCP","66","45330  >  8000 [ACK] Seq=202 Ack=93 Win=32128 Len=0 TSval=608394639 TSecr=1640714949"
"61","7.616115892","192.168.105.71","192.168.105.183","HTTP","71","HTTP/1.0 200 OK "
"62","7.618837561","192.168.105.183","192.168.105.71","TCP","66","45330  >  8000 [FIN, ACK] Seq=202 Ack=99 Win=32128 Len=0 TSval=608394642 TSecr=1640714949"
"63","7.624575378","192.168.105.71","192.168.105.183","TCP","66","8000  >  45330 [ACK] Seq=99 Ack=203 Win=31872 Len=0 TSval=1640714958 TSecr=608394642"
"64","8.562715753","a2:81:24:63:26:46","Broadcast","ARP","42","Who has 192.168.105.237? Tell 192.168.105.174"
"65","8.629374820","192.168.105.183","192.168.105.71","TCP","74","47078  >  8000 [SYN] Seq=0 Win=32120 Len=0 MSS=1460 SACK_PERM TSval=608395653 TSecr=0 WS=128"
"66","8.641685143","192.168.105.71","192.168.105.183","TCP","74","8000  >  47078 [SYN, ACK] Seq=0 Ack=1 Win=31856 Len=0 MSS=1460 SACK_PERM TSval=1640715976 TSecr=608395653 WS=128"
"67","8.641805455","192.168.105.183","192.168.105.71","TCP","66","47078  >  8000 [ACK] Seq=1 Ack=1 Win=32128 Len=0 TSval=608395665 TSecr=1640715976"
"68","8.641971810","192.168.105.183","192.168.105.71","TCP","262","47078  >  8000 [PSH, ACK] Seq=1 Ack=1 Win=32128 Len=196 TSval=608395665 TSecr=1640715976 [TCP segment of a reassembled PDU]"
"69","8.642144205","192.168.105.183","192.168.105.71","HTTP","71","POST / HTTP/1.1  (text/plain)"
"70","8.648799159","192.168.105.71","192.168.105.183","TCP","66","8000  >  47078 [ACK] Seq=1 Ack=202 Win=31872 Len=0 TSval=1640715983 TSecr=608395666"
"71","8.651436922","192.168.105.71","192.168.105.183","TCP","158","8000  >  47078 [PSH, ACK] Seq=1 Ack=202 Win=31872 Len=92 TSval=1640715985 TSecr=608395666 [TCP segment of a reassembled PDU]"
"72","8.651486870","192.168.105.183","192.168.105.71","TCP","66","47078  >  8000 [ACK] Seq=202 Ack=93 Win=32128 Len=0 TSval=608395675 TSecr=1640715985"
"73","8.651609318","192.168.105.71","192.168.105.183","HTTP","71","HTTP/1.0 200 OK "
"74","8.654283591","192.168.105.183","192.168.105.71","TCP","66","47078  >  8000 [FIN, ACK] Seq=202 Ack=99 Win=32128 Len=0 TSval=608395678 TSecr=1640715986"
"75","8.659956043","192.168.105.71","192.168.105.183","TCP","66","8000  >  47078 [ACK] Seq=99 Ack=203 Win=31872 Len=0 TSval=1640715993 TSecr=608395678"
"76","9.585896767","a2:81:24:63:26:46","Broadcast","ARP","42","Who has 192.168.105.237? Tell 192.168.105.174"
"77","10.682078200","192.168.105.183","192.168.105.71","TCP","74","47086  >  8000 [SYN] Seq=0 Win=32120 Len=0 MSS=1460 SACK_PERM TSval=608397706 TSecr=0 WS=128"
"78","10.694836752","192.168.105.71","192.168.105.183","TCP","74","8000  >  47086 [SYN, ACK] Seq=0 Ack=1 Win=31856 Len=0 MSS=1460 SACK_PERM TSval=1640718029 TSecr=608397706 WS=128"
"79","10.694948836","192.168.105.183","192.168.105.71","TCP","66","47086  >  8000 [ACK] Seq=1 Ack=1 Win=32128 Len=0 TSval=608397718 TSecr=1640718029"
"80","10.695181075","192.168.105.183","192.168.105.71","TCP","262","47086  >  8000 [PSH, ACK] Seq=1 Ack=1 Win=32128 Len=196 TSval=608397719 TSecr=1640718029 [TCP segment of a reassembled PDU]"
"81","10.695326648","192.168.105.183","192.168.105.71","HTTP","71","POST / HTTP/1.1  (text/plain)"
"82","10.700482017","192.168.105.71","192.168.105.183","TCP","66","8000  >  47086 [ACK] Seq=1 Ack=202 Win=31872 Len=0 TSval=1640718035 TSecr=608397719"
"83","10.704032541","192.168.105.71","192.168.105.183","TCP","158","8000  >  47086 [PSH, ACK] Seq=1 Ack=202 Win=31872 Len=92 TSval=1640718038 TSecr=608397719 [TCP segment of a reassembled PDU]"
"84","10.704086395","192.168.105.183","192.168.105.71","TCP","66","47086  >  8000 [ACK] Seq=202 Ack=93 Win=32128 Len=0 TSval=608397728 TSecr=1640718038"
"85","10.704207906","192.168.105.71","192.168.105.183","HTTP","71","HTTP/1.0 200 OK "
"86","10.706899210","192.168.105.183","192.168.105.71","TCP","66","47086  >  8000 [FIN, ACK] Seq=202 Ack=99 Win=32128 Len=0 TSval=608397730 TSecr=1640718038"
"87","10.713917341","192.168.105.71","192.168.105.183","TCP","66","8000  >  47086 [ACK] Seq=99 Ack=203 Win=31872 Len=0 TSval=1640718046 TSecr=608397730"
"88","11.872593297","192.168.105.183","192.168.105.71","TCP","74","47100  >  8000 [SYN] Seq=0 Win=32120 Len=0 MSS=1460 SACK_PERM TSval=608398896 TSecr=0 WS=128"
"89","11.894453107","192.168.105.71","192.168.105.183","TCP","74","8000  >  47100 [SYN, ACK] Seq=0 Ack=1 Win=31856 Len=0 MSS=1460 SACK_PERM TSval=1640719224 TSecr=608398896 WS=128"
"90","11.894636753","192.168.105.183","192.168.105.71","TCP","66","47100  >  8000 [ACK] Seq=1 Ack=1 Win=32128 Len=0 TSval=608398918 TSecr=1640719224"
"91","11.894942795","192.168.105.183","192.168.105.71","TCP","262","47100  >  8000 [PSH, ACK] Seq=1 Ack=1 Win=32128 Len=196 TSval=608398918 TSecr=1640719224 [TCP segment of a reassembled PDU]"
"92","11.895114253","192.168.105.183","192.168.105.71","HTTP","71","POST / HTTP/1.1  (text/plain)"
"93","11.906545617","192.168.105.71","192.168.105.183","TCP","66","8000  >  47100 [ACK] Seq=1 Ack=202 Win=31872 Len=0 TSval=1640719239 TSecr=608398919"
"94","11.909101452","192.168.105.71","192.168.105.183","TCP","158","8000  >  47100 [PSH, ACK] Seq=1 Ack=202 Win=31872 Len=92 TSval=1640719242 TSecr=608398919 [TCP segment of a reassembled PDU]"
"95","11.909239942","192.168.105.183","192.168.105.71","TCP","66","47100  >  8000 [ACK] Seq=202 Ack=93 Win=32128 Len=0 TSval=608398933 TSecr=1640719242"
"96","11.909381192","192.168.105.71","192.168.105.183","HTTP","71","HTTP/1.0 200 OK "
"97","11.912730570","192.168.105.183","192.168.105.71","TCP","66","47100  >  8000 [FIN, ACK] Seq=202 Ack=99 Win=32128 Len=0 TSval=608398936 TSecr=1640719242"
"98","11.930308866","192.168.105.71","192.168.105.183","TCP","66","8000  >  47100 [ACK] Seq=99 Ack=203 Win=31872 Len=0 TSval=1640719256 TSecr=608398936"
"99","13.284077681","192.168.105.174","224.0.0.251","MDNS","82","Standard query 0x03bc PTR _quickshare._tcp.local, ""QM"" question"
"100","13.284598358","fe80::a081:24ff:fe63:2646","ff02::fb","MDNS","102","Standard query 0x03bc PTR _quickshare._tcp.local, ""QM"" question"
"101","13.950077336","192.168.105.183","192.168.105.71","TCP","74","47106  >  8000 [SYN] Seq=0 Win=32120 Len=0 MSS=1460 SACK_PERM TSval=608400974 TSecr=0 WS=128"
"102","13.963015211","192.168.105.71","192.168.105.183","TCP","74","8000  >  47106 [SYN, ACK] Seq=0 Ack=1 Win=31856 Len=0 MSS=1460 SACK_PERM TSval=1640721297 TSecr=608400974 WS=128"
"103","13.963347242","192.168.105.183","192.168.105.71","TCP","262","47106  >  8000 [PSH, ACK] Seq=1 Ack=1 Win=32128 Len=196 TSval=608400987 TSecr=1640721297 [TCP segment of a reassembled PDU]"
"104","13.963497451","192.168.105.183","192.168.105.71","HTTP","71","POST / HTTP/1.1  (text/plain)"
"105","13.969207872","192.168.105.71","192.168.105.183","TCP","66","8000  >  47106 [ACK] Seq=1 Ack=197 Win=31872 Len=0 TSval=1640721303 TSecr=608400987"
"106","13.970712873","192.168.105.71","192.168.105.183","TCP","66","8000  >  47106 [ACK] Seq=1 Ack=202 Win=31872 Len=0 TSval=1640721305 TSecr=608400987"
"107","13.974073241","192.168.105.71","192.168.105.183","TCP","158","8000  >  47106 [PSH, ACK] Seq=1 Ack=202 Win=31872 Len=92 TSval=1640721308 TSecr=608400987 [TCP segment of a reassembled PDU]"
"108","13.974234907","192.168.105.71","192.168.105.183","HTTP","71","HTTP/1.0 200 OK "
"109","13.976631836","192.168.105.183","192.168.105.71","TCP","66","47106  >  8000 [FIN, ACK] Seq=202 Ack=99 Win=32128 Len=0 TSval=608401000 TSecr=1640721309"
"110","13.985750490","192.168.105.71","192.168.105.183","TCP","66","8000  >  47106 [ACK] Seq=99 Ack=203 Win=31872 Len=0 TSval=1640721321 TSecr=608401000"
"111","14.986534578","192.168.105.183","192.168.105.71","TCP","74","47116  >  8000 [SYN] Seq=0 Win=32120 Len=0 MSS=1460 SACK_PERM TSval=608402010 TSecr=0 WS=128"
"112","14.998664119","192.168.105.71","192.168.105.183","TCP","74","8000  >  47116 [SYN, ACK] Seq=0 Ack=1 Win=31856 Len=0 MSS=1460 SACK_PERM TSval=1640722333 TSecr=608402010 WS=128"
"113","14.998780682","192.168.105.183","192.168.105.71","TCP","66","47116  >  8000 [ACK] Seq=1 Ack=1 Win=32128 Len=0 TSval=608402022 TSecr=1640722333"
"114","14.998922088","192.168.105.183","192.168.105.71","TCP","262","47116  >  8000 [PSH, ACK] Seq=1 Ack=1 Win=32128 Len=196 TSval=608402022 TSecr=1640722333 [TCP segment of a reassembled PDU]"
"115","14.999042505","192.168.105.183","192.168.105.71","HTTP","71","POST / HTTP/1.1  (text/plain)"
"116","15.004918864","192.168.105.71","192.168.105.183","TCP","66","8000  >  47116 [ACK] Seq=1 Ack=202 Win=31872 Len=0 TSval=1640722339 TSecr=608402023"
"117","15.007435168","192.168.105.71","192.168.105.183","TCP","158","8000  >  47116 [PSH, ACK] Seq=1 Ack=202 Win=31872 Len=92 TSval=1640722341 TSecr=608402023 [TCP segment of a reassembled PDU]"
"118","15.007484230","192.168.105.183","192.168.105.71","TCP","66","47116  >  8000 [ACK] Seq=202 Ack=93 Win=32128 Len=0 TSval=608402031 TSecr=1640722341"
"119","15.007602460","192.168.105.71","192.168.105.183","HTTP","71","HTTP/1.0 200 OK "
"120","15.009951472","192.168.105.183","192.168.105.71","TCP","66","47116  >  8000 [FIN, ACK] Seq=202 Ack=99 Win=32128 Len=0 TSval=608402033 TSecr=1640722342"
"121","15.016380696","192.168.105.71","192.168.105.183","TCP","66","8000  >  47116 [ACK] Seq=99 Ack=203 Win=31872 Len=0 TSval=1640722349 TSecr=608402033"
"122","16.019764103","192.168.105.183","192.168.105.71","TCP","74","47130  >  8000 [SYN] Seq=0 Win=32120 Len=0 MSS=1460 SACK_PERM TSval=608403043 TSecr=0 WS=128"
"123","16.031826040","192.168.105.71","192.168.105.183","TCP","74","8000  >  47130 [SYN, ACK] Seq=0 Ack=1 Win=31856 Len=0 MSS=1460 SACK_PERM TSval=1640723366 TSecr=608403043 WS=128"
"124","16.031945415","192.168.105.183","192.168.105.71","TCP","66","47130  >  8000 [ACK] Seq=1 Ack=1 Win=32128 Len=0 TSval=608403055 TSecr=1640723366"
"125","16.032095780","192.168.105.183","192.168.105.71","TCP","262","47130  >  8000 [PSH, ACK] Seq=1 Ack=1 Win=32128 Len=196 TSval=608403056 TSecr=1640723366 [TCP segment of a reassembled PDU]"
"126","16.032222447","192.168.105.183","192.168.105.71","HTTP","72","POST / HTTP/1.1  (text/plain)"
"127","16.040859589","192.168.105.71","192.168.105.183","TCP","66","8000  >  47130 [ACK] Seq=1 Ack=203 Win=31872 Len=0 TSval=1640723374 TSecr=608403056"
"128","16.041016464","192.168.105.71","192.168.105.183","TCP","158","8000  >  47130 [PSH, ACK] Seq=1 Ack=203 Win=31872 Len=92 TSval=1640723376 TSecr=608403056 [TCP segment of a reassembled PDU]"
"129","16.041085058","192.168.105.183","192.168.105.71","TCP","66","47130  >  8000 [ACK] Seq=203 Ack=93 Win=32128 Len=0 TSval=608403065 TSecr=1640723376"
"130","16.042373184","192.168.105.71","192.168.105.183","HTTP","72","HTTP/1.0 200 OK "
"131","16.044061206","192.168.105.183","192.168.105.71","TCP","66","47130  >  8000 [FIN, ACK] Seq=203 Ack=100 Win=32128 Len=0 TSval=608403068 TSecr=1640723376"
"132","16.051651733","192.168.105.71","192.168.105.183","TCP","66","8000  >  47130 [ACK] Seq=100 Ack=204 Win=31872 Len=0 TSval=1640723385 TSecr=608403068"
"133","17.053888102","192.168.105.183","192.168.105.71","TCP","74","47134  >  8000 [SYN] Seq=0 Win=32120 Len=0 MSS=1460 SACK_PERM TSval=608404077 TSecr=0 WS=128"
"134","17.070225928","192.168.105.71","192.168.105.183","TCP","74","8000  >  47134 [SYN, ACK] Seq=0 Ack=1 Win=31856 Len=0 MSS=1460 SACK_PERM TSval=1640724400 TSecr=608404077 WS=128"
"135","17.070358897","192.168.105.183","192.168.105.71","TCP","66","47134  >  8000 [ACK] Seq=1 Ack=1 Win=32128 Len=0 TSval=608404094 TSecr=1640724400"
"136","17.070509209","192.168.105.183","192.168.105.71","TCP","262","47134  >  8000 [PSH, ACK] Seq=1 Ack=1 Win=32128 Len=196 TSval=608404094 TSecr=1640724400 [TCP segment of a reassembled PDU]"
"137","17.070648428","192.168.105.183","192.168.105.71","HTTP","72","POST / HTTP/1.1  (text/plain)"
"138","17.076561818","192.168.105.71","192.168.105.183","TCP","66","8000  >  47134 [ACK] Seq=1 Ack=203 Win=31872 Len=0 TSval=1640724411 TSecr=608404094"
"139","17.079538852","192.168.105.71","192.168.105.183","TCP","158","8000  >  47134 [PSH, ACK] Seq=1 Ack=203 Win=31872 Len=92 TSval=1640724413 TSecr=608404094 [TCP segment of a reassembled PDU]"
"140","17.082087135","192.168.105.71","192.168.105.183","HTTP","72","HTTP/1.0 200 OK "
"141","17.105771321","192.168.105.71","192.168.105.183","TCP","72","[TCP Retransmission] 8000  >  47134 [FIN, PSH, ACK] Seq=93 Ack=203 Win=31872 Len=6 TSval=1640724440 TSecr=608404094 [TCP segment of a reassembled PDU]"
"142","17.105880435","192.168.105.183","192.168.105.71","TCP","78","[TCP Previous segment not captured] 47134  >  8000 [ACK] Seq=204 Ack=100 Win=32128 Len=0 TSval=608404129 TSecr=1640724440 SLE=93 SRE=100"
"143","17.302068559","192.168.105.183","192.168.105.71","TCP","66","[TCP Retransmission] 47134  >  8000 [FIN, ACK] Seq=203 Ack=100 Win=32128 Len=0 TSval=608404326 TSecr=1640724440"
"144","17.313854714","192.168.105.71","192.168.105.183","TCP","66","8000  >  47134 [ACK] Seq=100 Ack=204 Win=31872 Len=0 TSval=1640724648 TSecr=608404326"
"145","18.092442619","192.168.105.183","192.168.105.71","TCP","74","47150  >  8000 [SYN] Seq=0 Win=32120 Len=0 MSS=1460 SACK_PERM TSval=608405116 TSecr=0 WS=128"
"146","19.098066167","192.168.105.183","192.168.105.71","TCP","74","[TCP Retransmission] 47150  >  8000 [SYN] Seq=0 Win=32120 Len=0 MSS=1460 SACK_PERM TSval=608406122 TSecr=0 WS=128"
"147","19.112965710","192.168.105.71","192.168.105.183","TCP","74","8000  >  47150 [SYN, ACK] Seq=0 Ack=1 Win=31856 Len=0 MSS=1460 SACK_PERM TSval=1640726447 TSecr=608405116 WS=128"
"148","19.113085502","192.168.105.183","192.168.105.71","TCP","66","47150  >  8000 [ACK] Seq=1 Ack=1 Win=32128 Len=0 TSval=608406137 TSecr=1640726447"
"149","19.113329512","192.168.105.183","192.168.105.71","TCP","262","47150  >  8000 [PSH, ACK] Seq=1 Ack=1 Win=32128 Len=196 TSval=608406137 TSecr=1640726447 [TCP segment of a reassembled PDU]"
"150","19.114034617","192.168.105.183","192.168.105.71","HTTP","72","POST / HTTP/1.1  (text/plain)"
"151","19.121611550","192.168.105.71","192.168.105.183","TCP","66","8000  >  47150 [ACK] Seq=1 Ack=203 Win=31872 Len=0 TSval=1640726456 TSecr=608406137"
"152","19.127261346","192.168.105.71","192.168.105.183","TCP","72","[TCP Previous segment not captured] 8000  >  47150 [FIN, PSH, ACK] Seq=93 Ack=203 Win=31872 Len=6 TSval=1640726461 TSecr=608406137 [TCP segment of a reassembled PDU]"
"153","19.127299836","192.168.105.183","192.168.105.71","TCP","78","[TCP Dup ACK 148#1] 47150  >  8000 [ACK] Seq=203 Ack=1 Win=32128 Len=0 TSval=608406151 TSecr=1640726456 SLE=93 SRE=100"
"154","19.139901200","192.168.105.71","192.168.105.183","TCP","158","[TCP Out-Of-Order] 8000  >  47150 [PSH, ACK] Seq=1 Ack=203 Win=31872 Len=92 TSval=1640726472 TSecr=608406151"
"155","19.139958127","192.168.105.183","192.168.105.71","TCP","66","47150  >  8000 [ACK] Seq=203 Ack=100 Win=32128 Len=0 TSval=608406163 TSecr=1640726472"
"156","19.142637191","192.168.105.183","192.168.105.71","TCP","66","47150  >  8000 [FIN, ACK] Seq=203 Ack=100 Win=32128 Len=0 TSval=608406166 TSecr=1640726472"
"157","19.148977821","192.168.105.71","192.168.105.183","TCP","66","8000  >  47150 [ACK] Seq=100 Ack=204 Win=31872 Len=0 TSval=1640726482 TSecr=608406166"
"158","20.152832507","192.168.105.183","192.168.105.71","TCP","74","57132  >  8000 [SYN] Seq=0 Win=32120 Len=0 MSS=1460 SACK_PERM TSval=608407176 TSecr=0 WS=128"
"159","20.167303091","192.168.105.71","192.168.105.183","TCP","74","8000  >  57132 [SYN, ACK] Seq=0 Ack=1 Win=31856 Len=0 MSS=1460 SACK_PERM TSval=1640727501 TSecr=608407176 WS=128"
"160","20.167442050","192.168.105.183","192.168.105.71","TCP","66","57132  >  8000 [ACK] Seq=1 Ack=1 Win=32128 Len=0 TSval=608407191 TSecr=1640727501"
"161","20.167730279","192.168.105.183","192.168.105.71","TCP","262","57132  >  8000 [PSH, ACK] Seq=1 Ack=1 Win=32128 Len=196 TSval=608407191 TSecr=1640727501 [TCP segment of a reassembled PDU]"
"162","20.167907727","192.168.105.183","192.168.105.71","HTTP","72","POST / HTTP/1.1  (text/plain)"
"163","20.173916430","192.168.105.71","192.168.105.183","TCP","66","8000  >  57132 [ACK] Seq=1 Ack=203 Win=31872 Len=0 TSval=1640727508 TSecr=608407191"
"164","20.176021171","192.168.105.71","192.168.105.183","TCP","158","8000  >  57132 [PSH, ACK] Seq=1 Ack=203 Win=31872 Len=92 TSval=1640727510 TSecr=608407191 [TCP segment of a reassembled PDU]"
"165","20.176090077","192.168.105.183","192.168.105.71","TCP","66","57132  >  8000 [ACK] Seq=203 Ack=93 Win=32128 Len=0 TSval=608407200 TSecr=1640727510"
"166","20.178217266","192.168.105.71","192.168.105.183","HTTP","72","HTTP/1.0 200 OK "
"167","20.178666121","192.168.105.183","192.168.105.71","TCP","66","57132  >  8000 [FIN, ACK] Seq=203 Ack=100 Win=32128 Len=0 TSval=608407202 TSecr=1640727511"
"168","20.184368990","192.168.105.71","192.168.105.183","TCP","66","8000  >  57132 [ACK] Seq=100 Ack=204 Win=31872 Len=0 TSval=1640727518 TSecr=608407202"
"169","20.922103986","192.168.105.183","192.168.105.237","SSH","1514","Server: Encrypted packet (len=1448)"
"170","21.188545076","192.168.105.183","192.168.105.71","TCP","74","57142  >  8000 [SYN] Seq=0 Win=32120 Len=0 MSS=1460 SACK_PERM TSval=608408212 TSecr=0 WS=128"
"171","21.197597166","192.168.105.71","192.168.105.183","TCP","74","8000  >  57142 [SYN, ACK] Seq=0 Ack=1 Win=31856 Len=0 MSS=1460 SACK_PERM TSval=1640728531 TSecr=608408212 WS=128"
"172","21.197724198","192.168.105.183","192.168.105.71","TCP","66","57142  >  8000 [ACK] Seq=1 Ack=1 Win=32128 Len=0 TSval=608408221 TSecr=1640728531"
"173","21.197886385","192.168.105.183","192.168.105.71","TCP","262","57142  >  8000 [PSH, ACK] Seq=1 Ack=1 Win=32128 Len=196 TSval=608408221 TSecr=1640728531 [TCP segment of a reassembled PDU]"
"174","21.198044042","192.168.105.183","192.168.105.71","HTTP","72","POST / HTTP/1.1  (text/plain)"
"175","21.203860557","192.168.105.71","192.168.105.183","TCP","66","8000  >  57142 [ACK] Seq=1 Ack=203 Win=31872 Len=0 TSval=1640728538 TSecr=608408222"
"176","21.208330768","192.168.105.71","192.168.105.183","TCP","72","[TCP Previous segment not captured] 8000  >  57142 [FIN, PSH, ACK] Seq=93 Ack=203 Win=31872 Len=6 TSval=1640728541 TSecr=608408222 [TCP segment of a reassembled PDU]"
"177","21.208375456","192.168.105.183","192.168.105.71","TCP","78","[TCP Dup ACK 172#1] 57142  >  8000 [ACK] Seq=203 Ack=1 Win=32128 Len=0 TSval=608408232 TSecr=1640728538 SLE=93 SRE=100"
"178","21.216979265","192.168.105.183","199.232.210.172","TLSv1.2","90","Application Data"
"179","21.217218432","192.168.105.183","199.232.210.172","TCP","66","38620  >  443 [FIN, ACK] Seq=25 Ack=1 Win=29568 Len=0 TSval=1646986243 TSecr=2755413737"
"180","21.221581872","192.168.105.71","192.168.105.183","TCP","158","[TCP Retransmission] 8000  >  57142 [PSH, ACK] Seq=1 Ack=203 Win=31872 Len=92 TSval=1640728556 TSecr=608408232"
"181","21.221669997","192.168.105.183","192.168.105.71","TCP","66","57142  >  8000 [ACK] Seq=203 Ack=100 Win=32128 Len=0 TSval=608408245 TSecr=1640728556"
"182","21.224309947","192.168.105.183","192.168.105.71","TCP","66","57142  >  8000 [FIN, ACK] Seq=203 Ack=100 Win=32128 Len=0 TSval=608408248 TSecr=1640728556"
"183","21.230286619","192.168.105.71","192.168.105.183","TCP","66","8000  >  57142 [ACK] Seq=100 Ack=204 Win=31872 Len=0 TSval=1640728564 TSecr=608408248"
"184","21.418472961","199.232.210.172","192.168.105.183","TCP","78","443  >  38620 [ACK] Seq=1 Ack=1 Win=287 Len=0 TSval=2755575975 TSecr=1646824741 SLE=25 SRE=26"
"185","21.423785360","199.232.210.172","192.168.105.183","TCP","66","443  >  38620 [ACK] Seq=1 Ack=26 Win=287 Len=0 TSval=2755575976 TSecr=1646986242"
"186","21.423896142","199.232.210.172","192.168.105.183","TCP","66","[TCP Previous segment not captured] 443  >  38620 [FIN, ACK] Seq=25 Ack=26 Win=287 Len=0 TSval=2755575976 TSecr=1646986242"
"187","21.423940673","192.168.105.183","199.232.210.172","TCP","54","38620  >  443 [RST] Seq=26 Win=0 Len=0"
"188","21.424023069","199.232.210.172","192.168.105.183","TCP","90","[TCP Out-Of-Order] 443  >  38620 [PSH, ACK] Seq=1 Ack=26 Win=287 Len=24 TSval=2755575976 TSecr=1646986242"
"189","21.424041715","192.168.105.183","199.232.210.172","TCP","54","38620  >  443 [RST] Seq=26 Win=0 Len=0"
"190","22.230709779","192.168.105.183","192.168.105.71","TCP","74","57150  >  8000 [SYN] Seq=0 Win=32120 Len=0 MSS=1460 SACK_PERM TSval=608409254 TSecr=0 WS=128"
"191","22.242578122","192.168.105.71","192.168.105.183","TCP","74","8000  >  57150 [SYN, ACK] Seq=0 Ack=1 Win=31856 Len=0 MSS=1460 SACK_PERM TSval=1640729577 TSecr=608409254 WS=128"
"192","22.242755674","192.168.105.183","192.168.105.71","TCP","262","57150  >  8000 [PSH, ACK] Seq=1 Ack=1 Win=32128 Len=196 TSval=608409266 TSecr=1640729577 [TCP segment of a reassembled PDU]"
"193","22.242850622","192.168.105.183","192.168.105.71","HTTP","72","POST / HTTP/1.1  (text/plain)"
"194","22.247583699","192.168.105.71","192.168.105.183","TCP","66","8000  >  57150 [ACK] Seq=1 Ack=203 Win=31872 Len=0 TSval=1640729582 TSecr=608409266"
"195","22.252137712","192.168.105.71","192.168.105.183","TCP","158","8000  >  57150 [PSH, ACK] Seq=1 Ack=203 Win=31872 Len=92 TSval=1640729585 TSecr=608409266 [TCP segment of a reassembled PDU]"
"196","22.252177087","192.168.105.183","192.168.105.71","TCP","66","57150  >  8000 [ACK] Seq=203 Ack=93 Win=32128 Len=0 TSval=608409276 TSecr=1640729585"
"197","22.253654484","192.168.105.71","192.168.105.183","HTTP","72","HTTP/1.0 200 OK "
"198","22.253955526","192.168.105.183","192.168.105.71","TCP","66","57150  >  8000 [FIN, ACK] Seq=203 Ack=100 Win=32128 Len=0 TSval=608409277 TSecr=1640729585"
"199","22.259265895","192.168.105.71","192.168.105.183","TCP","66","8000  >  57150 [ACK] Seq=100 Ack=204 Win=31872 Len=0 TSval=1640729593 TSecr=608409277"
"200","24.282084351","192.168.105.183","192.168.105.71","TCP","74","57162  >  8000 [SYN] Seq=0 Win=32120 Len=0 MSS=1460 SACK_PERM TSval=608411306 TSecr=0 WS=128"
"201","24.295110090","192.168.105.71","192.168.105.183","TCP","74","8000  >  57162 [SYN, ACK] Seq=0 Ack=1 Win=31856 Len=0 MSS=1460 SACK_PERM TSval=1640731629 TSecr=608411306 WS=128"
"202","24.295253111","192.168.105.183","192.168.105.71","TCP","66","57162  >  8000 [ACK] Seq=1 Ack=1 Win=32128 Len=0 TSval=608411319 TSecr=1640731629"
"203","24.295464517","192.168.105.183","192.168.105.71","TCP","262","57162  >  8000 [PSH, ACK] Seq=1 Ack=1 Win=32128 Len=196 TSval=608411319 TSecr=1640731629 [TCP segment of a reassembled PDU]"
"204","24.295617590","192.168.105.183","192.168.105.71","HTTP","72","POST / HTTP/1.1  (text/plain)"
"205","24.304194472","192.168.105.71","192.168.105.183","TCP","66","8000  >  57162 [ACK] Seq=1 Ack=203 Win=31872 Len=0 TSval=1640731638 TSecr=608411319"
"206","24.309237496","192.168.105.71","192.168.105.183","TCP","158","8000  >  57162 [PSH, ACK] Seq=1 Ack=203 Win=31872 Len=92 TSval=1640731643 TSecr=608411319 [TCP segment of a reassembled PDU]"
"207","24.309316090","192.168.105.183","192.168.105.71","TCP","66","57162  >  8000 [ACK] Seq=203 Ack=93 Win=32128 Len=0 TSval=608411333 TSecr=1640731643"
"208","24.310173382","192.168.105.71","192.168.105.183","HTTP","72","HTTP/1.0 200 OK "
"209","24.312029321","192.168.105.183","192.168.105.71","TCP","66","57162  >  8000 [FIN, ACK] Seq=203 Ack=100 Win=32128 Len=0 TSval=608411335 TSecr=1640731643"
"210","24.319167087","192.168.105.71","192.168.105.183","TCP","66","8000  >  57162 [ACK] Seq=100 Ack=204 Win=31872 Len=0 TSval=1640731652 TSecr=608411335"
"211","26.042053058","RaspberryPiF_7e:89:e6","Apple_ea:75:de","ARP","42","Who has 192.168.105.237? Tell 192.168.105.183"
"212","26.298043143","RaspberryPiF_7e:89:e6","a2:81:24:63:26:46","ARP","42","Who has 192.168.105.174? Tell 192.168.105.183"
"213","26.306407264","a2:81:24:63:26:46","RaspberryPiF_7e:89:e6","ARP","42","192.168.105.174 is at a2:81:24:63:26:46"
"214","26.450493985","a2:81:24:63:26:46","RaspberryPiF_7e:89:e6","ARP","42","Who has 192.168.105.183? Tell 192.168.105.174"
"215","26.450550964","RaspberryPiF_7e:89:e6","a2:81:24:63:26:46","ARP","42","192.168.105.183 is at b8:27:eb:7e:89:e6"
"216","26.708134435","192.168.105.183","192.168.105.71","TCP","74","57176  >  8000 [SYN] Seq=0 Win=32120 Len=0 MSS=1460 SACK_PERM TSval=608413732 TSecr=0 WS=128"
"217","27.066050115","RaspberryPiF_7e:89:e6","Apple_ea:75:de","ARP","42","Who has 192.168.105.237? Tell 192.168.105.183"
"218","27.738030867","192.168.105.183","192.168.105.71","TCP","74","[TCP Retransmission] 57176  >  8000 [SYN] Seq=0 Win=32120 Len=0 MSS=1460 SACK_PERM TSval=608414762 TSecr=0 WS=128"
"219","27.749867126","192.168.105.71","192.168.105.183","TCP","74","8000  >  57176 [SYN, ACK] Seq=0 Ack=1 Win=31856 Len=0 MSS=1460 SACK_PERM TSval=1640735080 TSecr=608413732 WS=128"
"220","27.749917386","192.168.105.183","192.168.105.71","TCP","66","57176  >  8000 [ACK] Seq=1 Ack=1 Win=32128 Len=0 TSval=608414773 TSecr=1640735080"
"221","27.749992907","192.168.105.71","192.168.105.183","TCP","74","[TCP Out-Of-Order] 8000  >  57176 [SYN, ACK] Seq=0 Ack=1 Win=31856 Len=0 MSS=1460 SACK_PERM TSval=1640735083 TSecr=608413732 WS=128"
"222","27.750023532","192.168.105.183","192.168.105.71","TCP","66","[TCP Dup ACK 220#1] 57176  >  8000 [ACK] Seq=1 Ack=1 Win=32128 Len=0 TSval=608414774 TSecr=1640735080"
"223","27.750086136","192.168.105.183","192.168.105.71","TCP","262","57176  >  8000 [PSH, ACK] Seq=1 Ack=1 Win=32128 Len=196 TSval=608414774 TSecr=1640735080 [TCP segment of a reassembled PDU]"
"224","27.750241084","192.168.105.183","192.168.105.71","HTTP","72","POST / HTTP/1.1  (text/plain)"
"225","27.756357026","192.168.105.71","192.168.105.183","TCP","66","8000  >  57176 [ACK] Seq=1 Ack=203 Win=31872 Len=0 TSval=1640735090 TSecr=608414774"
"226","27.758942966","192.168.105.71","192.168.105.183","TCP","158","8000  >  57176 [PSH, ACK] Seq=1 Ack=203 Win=31872 Len=92 TSval=1640735093 TSecr=608414774 [TCP segment of a reassembled PDU]"
"227","27.758970987","192.168.105.183","192.168.105.71","TCP","66","57176  >  8000 [ACK] Seq=203 Ack=93 Win=32128 Len=0 TSval=608414782 TSecr=1640735093"
"228","27.759042966","192.168.105.71","192.168.105.183","HTTP","72","HTTP/1.0 200 OK "
"229","27.760444946","192.168.105.183","192.168.105.71","TCP","66","57176  >  8000 [FIN, ACK] Seq=203 Ack=100 Win=32128 Len=0 TSval=608414784 TSecr=1640735093"
"230","27.770807141","192.168.105.71","192.168.105.183","TCP","66","8000  >  57176 [ACK] Seq=100 Ack=204 Win=31872 Len=0 TSval=1640735102 TSecr=608414784"
"231","28.090037479","RaspberryPiF_7e:89:e6","Apple_ea:75:de","ARP","42","Who has 192.168.105.237? Tell 192.168.105.183"
"232","28.765813750","192.168.105.183","192.168.105.71","TCP","74","36728  >  8000 [SYN] Seq=0 Win=32120 Len=0 MSS=1460 SACK_PERM TSval=608415789 TSecr=0 WS=128"
"233","29.786079643","192.168.105.183","192.168.105.71","TCP","74","[TCP Retransmission] 36728  >  8000 [SYN] Seq=0 Win=32120 Len=0 MSS=1460 SACK_PERM TSval=608416810 TSecr=0 WS=128"
"234","29.796891630","192.168.105.71","192.168.105.183","TCP","74","8000  >  36728 [SYN, ACK] Seq=0 Ack=1 Win=31856 Len=0 MSS=1460 SACK_PERM TSval=1640737128 TSecr=608415789 WS=128"
"235","29.797019078","192.168.105.183","192.168.105.71","TCP","66","36728  >  8000 [ACK] Seq=1 Ack=1 Win=32128 Len=0 TSval=608416820 TSecr=1640737128"
"236","29.797155380","192.168.105.71","192.168.105.183","TCP","74","[TCP Out-Of-Order] 8000  >  36728 [SYN, ACK] Seq=0 Ack=1 Win=31856 Len=0 MSS=1460 SACK_PERM TSval=1640737131 TSecr=608415789 WS=128"
"237","29.797235224","192.168.105.183","192.168.105.71","TCP","262","36728  >  8000 [PSH, ACK] Seq=1 Ack=1 Win=32128 Len=196 TSval=608416821 TSecr=1640737128 [TCP segment of a reassembled PDU]"
"238","29.797274495","192.168.105.183","192.168.105.71","TCP","66","[TCP Dup ACK 235#1] 36728  >  8000 [ACK] Seq=197 Ack=1 Win=32128 Len=0 TSval=608416821 TSecr=1640737128"
"239","29.797437880","192.168.105.183","192.168.105.71","HTTP","72","POST / HTTP/1.1  (text/plain)"
"240","29.804438719","192.168.105.71","192.168.105.183","TCP","66","8000  >  36728 [ACK] Seq=1 Ack=203 Win=31872 Len=0 TSval=1640737138 TSecr=608416821"
"241","29.808208826","192.168.105.71","192.168.105.183","TCP","158","8000  >  36728 [PSH, ACK] Seq=1 Ack=203 Win=31872 Len=92 TSval=1640737142 TSecr=608416821 [TCP segment of a reassembled PDU]"
"242","29.808277367","192.168.105.183","192.168.105.71","TCP","66","36728  >  8000 [ACK] Seq=203 Ack=93 Win=32128 Len=0 TSval=608416832 TSecr=1640737142"
"243","29.808405024","192.168.105.71","192.168.105.183","HTTP","72","HTTP/1.0 200 OK "
"244","30.032857060","192.168.105.71","192.168.105.183","TCP","72","[TCP Retransmission] 8000  >  36728 [FIN, PSH, ACK] Seq=93 Ack=203 Win=31872 Len=6 TSval=1640737360 TSecr=608416832 [TCP segment of a reassembled PDU]"
"245","30.032949196","192.168.105.183","192.168.105.71","TCP","78","[TCP Previous segment not captured] 36728  >  8000 [ACK] Seq=204 Ack=100 Win=32128 Len=0 TSval=608417056 TSecr=1640737360 SLE=93 SRE=100"
"246","30.820647780","192.168.105.183","192.168.105.71","TCP","74","36736  >  8000 [SYN] Seq=0 Win=32120 Len=0 MSS=1460 SACK_PERM TSval=608417844 TSecr=0 WS=128"
"247","30.830184193","192.168.105.71","192.168.105.183","TCP","74","8000  >  36736 [SYN, ACK] Seq=0 Ack=1 Win=31856 Len=0 MSS=1460 SACK_PERM TSval=1640738164 TSecr=608417844 WS=128"
"248","30.830312630","192.168.105.183","192.168.105.71","TCP","66","36736  >  8000 [ACK] Seq=1 Ack=1 Win=32128 Len=0 TSval=608417854 TSecr=1640738164"
"249","30.830564245","192.168.105.183","192.168.105.71","TCP","262","36736  >  8000 [PSH, ACK] Seq=1 Ack=1 Win=32128 Len=196 TSval=608417854 TSecr=1640738164 [TCP segment of a reassembled PDU]"
"250","30.830736901","192.168.105.183","192.168.105.71","HTTP","72","POST / HTTP/1.1  (text/plain)"
"251","30.837034354","192.168.105.71","192.168.105.183","TCP","66","8000  >  36736 [ACK] Seq=1 Ack=203 Win=31872 Len=0 TSval=1640738171 TSecr=608417854"
"252","30.842229045","192.168.105.71","192.168.105.183","TCP","158","8000  >  36736 [PSH, ACK] Seq=1 Ack=203 Win=31872 Len=92 TSval=1640738174 TSecr=608417854 [TCP segment of a reassembled PDU]"
"253","30.842287951","192.168.105.183","192.168.105.71","TCP","66","36736  >  8000 [ACK] Seq=203 Ack=93 Win=32128 Len=0 TSval=608417866 TSecr=1640738174"
"254","30.844589828","192.168.105.71","192.168.105.183","HTTP","72","HTTP/1.0 200 OK "
"255","30.859935568","192.168.105.71","192.168.105.183","TCP","72","[TCP Retransmission] 8000  >  36736 [FIN, PSH, ACK] Seq=93 Ack=203 Win=31872 Len=6 TSval=1640738192 TSecr=608417854 [TCP segment of a reassembled PDU]"
"256","30.860028537","192.168.105.183","192.168.105.71","TCP","78","[TCP Previous segment not captured] 36736  >  8000 [ACK] Seq=204 Ack=100 Win=32128 Len=0 TSval=608417883 TSecr=1640738192 SLE=93 SRE=100"
