"No.","Time","Source","Destination","Protocol","Length","Info"
"1","0.000000000","192.168.105.183","192.168.105.71","TCP","74","50672  >  8000 [SYN] Seq=0 Win=32120 Len=0 MSS=1460 SACK_PERM TSval=610689027 TSecr=0 WS=128"
"2","0.012055158","192.168.105.71","192.168.105.183","TCP","74","8000  >  50672 [SYN, ACK] Seq=0 Ack=1 Win=31856 Len=0 MSS=1460 SACK_PERM TSval=1643009339 TSecr=610689027 WS=128"
"3","0.012139794","192.168.105.183","192.168.105.71","TCP","66","50672  >  8000 [ACK] Seq=1 Ack=1 Win=32128 Len=0 TSval=610689039 TSecr=1643009339"
"4","0.012264950","192.168.105.183","192.168.105.71","TCP","262","50672  >  8000 [PSH, ACK] Seq=1 Ack=1 Win=32128 Len=196 TSval=610689039 TSecr=1643009339 [TCP segment of a reassembled PDU]"
"5","0.012346721","192.168.105.183","192.168.105.71","HTTP","71","POST / HTTP/1.1  (text/plain)"
"6","0.020582712","192.168.105.71","192.168.105.183","TCP","66","8000  >  50672 [ACK] Seq=1 Ack=202 Win=31872 Len=0 TSval=1643009345 TSecr=610689040"
"7","0.042454175","192.168.105.71","192.168.105.183","TCP","158","8000  >  50672 [PSH, ACK] Seq=1 Ack=202 Win=31872 Len=92 TSval=1643009349 TSecr=610689040 [TCP segment of a reassembled PDU]"
"8","0.042498966","192.168.105.183","192.168.105.71","TCP","66","50672  >  8000 [ACK] Seq=202 Ack=93 Win=32128 Len=0 TSval=610689070 TSecr=1643009349"
"9","0.042572456","192.168.105.71","192.168.105.183","HTTP","71","HTTP/1.0 200 OK "
"10","0.043854487","192.168.105.71","192.168.105.183","TCP","71","[TCP Retransmission] 8000  >  50672 [FIN, PSH, ACK] Seq=93 Ack=202 Win=31872 Len=5 TSval=1643009368 TSecr=610689040 [TCP segment of a reassembled PDU]"
"11","0.043922612","192.168.105.183","192.168.105.71","TCP","78","50672  >  8000 [ACK] Seq=202 Ack=99 Win=32128 Len=0 TSval=610689071 TSecr=1643009368 SLE=93 SRE=99"
"12","0.044665738","192.168.105.183","192.168.105.71","TCP","66","50672  >  8000 [FIN, ACK] Seq=202 Ack=99 Win=32128 Len=0 TSval=610689072 TSecr=1643009368"
"13","0.086198975","192.168.105.71","192.168.105.183","TCP","66","8000  >  50672 [ACK] Seq=99 Ack=203 Win=31872 Len=0 TSval=1643009399 TSecr=610689072"
"14","1.056081710","192.168.105.183","192.168.105.71","TCP","74","50684  >  8000 [SYN] Seq=0 Win=32120 Len=0 MSS=1460 SACK_PERM TSval=610690083 TSecr=0 WS=128"
"15","1.075596245","192.168.105.71","192.168.105.183","TCP","74","8000  >  50684 [SYN, ACK] Seq=0 Ack=1 Win=31856 Len=0 MSS=1460 SACK_PERM TSval=1643010402 TSecr=610690083 WS=128"
"16","1.075710620","192.168.105.183","192.168.105.71","TCP","66","50684  >  8000 [ACK] Seq=1 Ack=1 Win=32128 Len=0 TSval=610690103 TSecr=1643010402"
"17","1.075880932","192.168.105.183","192.168.105.71","TCP","262","50684  >  8000 [PSH, ACK] Seq=1 Ack=1 Win=32128 Len=196 TSval=610690103 TSecr=1643010402 [TCP segment of a reassembled PDU]"
"18","1.076024891","192.168.105.183","192.168.105.71","HTTP","71","POST / HTTP/1.1  (text/plain)"
"19","1.122374743","192.168.105.183","192.168.105.71","TCP","71","[TCP Retransmission] 50684  >  8000 [PSH, ACK] Seq=197 Ack=1 Win=32128 Len=5 TSval=610690150 TSecr=1643010402 [TCP segment of a reassembled PDU]"
"20","1.125854015","192.168.105.71","192.168.105.183","TCP","66","8000  >  50684 [ACK] Seq=1 Ack=202 Win=31872 Len=0 TSval=1643010438 TSecr=610690103"
"21","1.126029223","192.168.105.71","192.168.105.183","TCP","158","8000  >  50684 [PSH, ACK] Seq=1 Ack=202 Win=31872 Len=92 TSval=1643010441 TSecr=610690103 [TCP segment of a reassembled PDU]"
"22","1.126077140","192.168.105.183","192.168.105.71","TCP","66","50684  >  8000 [ACK] Seq=202 Ack=93 Win=32128 Len=0 TSval=610690153 TSecr=1643010441"
"23","1.126196619","192.168.105.71","192.168.105.183","HTTP","71","HTTP/1.0 200 OK "
"24","1.129286776","192.168.105.183","192.168.105.71","TCP","66","50684  >  8000 [FIN, ACK] Seq=202 Ack=99 Win=32128 Len=0 TSval=610690156 TSecr=1643010441"
"25","1.135716517","192.168.105.71","192.168.105.183","TCP","78","[TCP Dup ACK 20#1] 8000  >  50684 [ACK] Seq=99 Ack=202 Win=31872 Len=0 TSval=1643010458 TSecr=610690150 SLE=197 SRE=202"
"26","1.150904384","192.168.105.71","192.168.105.183","TCP","66","8000  >  50684 [ACK] Seq=99 Ack=203 Win=31872 Len=0 TSval=1643010476 TSecr=610690156"
"27","2.136418215","192.168.105.183","192.168.105.71","TCP","74","50692  >  8000 [SYN] Seq=0 Win=32120 Len=0 MSS=1460 SACK_PERM TSval=610691164 TSecr=0 WS=128"
"28","2.157359104","192.168.105.71","192.168.105.183","TCP","74","8000  >  50692 [SYN, ACK] Seq=0 Ack=1 Win=31856 Len=0 MSS=1460 SACK_PERM TSval=1643011484 TSecr=610691164 WS=128"
"29","2.157488739","192.168.105.183","192.168.105.71","TCP","66","50692  >  8000 [ACK] Seq=1 Ack=1 Win=32128 Len=0 TSval=610691185 TSecr=1643011484"
"30","2.157661292","192.168.105.183","192.168.105.71","TCP","262","50692  >  8000 [PSH, ACK] Seq=1 Ack=1 Win=32128 Len=196 TSval=610691185 TSecr=1643011484 [TCP segment of a reassembled PDU]"
"31","2.157797958","192.168.105.183","192.168.105.71","HTTP","71","POST / HTTP/1.1  (text/plain)"
"32","2.176540410","192.168.105.71","192.168.105.183","TCP","66","8000  >  50692 [ACK] Seq=1 Ack=202 Win=31872 Len=0 TSval=1643011503 TSecr=610691185"
"33","2.180408015","192.168.105.71","192.168.105.183","TCP","158","8000  >  50692 [PSH, ACK] Seq=1 Ack=202 Win=31872 Len=92 TSval=1643011505 TSecr=610691185 [TCP segment of a reassembled PDU]"
"34","2.180478587","192.168.105.183","192.168.105.71","TCP","66","50692  >  8000 [ACK] Seq=202 Ack=93 Win=32128 Len=0 TSval=610691208 TSecr=1643011505"
"35","2.202098175","192.168.105.71","192.168.105.183","HTTP","71","HTTP/1.0 200 OK "
"36","2.202711769","192.168.105.183","192.168.105.71","TCP","66","50692  >  8000 [FIN, ACK] Seq=202 Ack=99 Win=32128 Len=0 TSval=610691230 TSecr=1643011506"
"37","2.214276302","192.168.105.71","192.168.105.183","TCP","66","8000  >  50692 [ACK] Seq=99 Ack=203 Win=31872 Len=0 TSval=1643011536 TSecr=610691230"
"38","3.213609249","192.168.105.183","192.168.105.71","TCP","74","50708  >  8000 [SYN] Seq=0 Win=32120 Len=0 MSS=1460 SACK_PERM TSval=610692241 TSecr=0 WS=128"
"39","3.239474670","192.168.105.71","192.168.105.183","TCP","74","8000  >  50708 [SYN, ACK] Seq=0 Ack=1 Win=31856 Len=0 MSS=1460 SACK_PERM TSval=1643012567 TSecr=610692241 WS=128"
"40","3.239600087","192.168.105.183","192.168.105.71","TCP","66","50708  >  8000 [ACK] Seq=1 Ack=1 Win=32128 Len=0 TSval=610692267 TSecr=1643012567"
"41","3.239879514","192.168.105.183","192.168.105.71","TCP","262","50708  >  8000 [PSH, ACK] Seq=1 Ack=1 Win=32128 Len=196 TSval=610692267 TSecr=1643012567 [TCP segment of a reassembled PDU]"
"42","3.240099097","192.168.105.183","192.168.105.71","HTTP","71","POST / HTTP/1.1  (text/plain)"
"43","3.290561398","192.168.105.71","192.168.105.183","TCP","66","8000  >  50708 [ACK] Seq=1 Ack=202 Win=31872 Len=0 TSval=1643012613 TSecr=610692267"
"44","3.292011971","192.168.105.71","192.168.105.183","TCP","158","8000  >  50708 [PSH, ACK] Seq=1 Ack=202 Win=31872 Len=92 TSval=1643012618 TSecr=610692267 [TCP segment of a reassembled PDU]"
"45","3.292091242","192.168.105.183","192.168.105.71","TCP","66","50708  >  8000 [ACK] Seq=202 Ack=93 Win=32128 Len=0 TSval=610692319 TSecr=1643012618"
"46","3.296041139","192.168.105.71","192.168.105.183","HTTP","71","HTTP/1.0 200 OK "
"47","3.296526295","192.168.105.183","192.168.105.71","TCP","66","50708  >  8000 [FIN, ACK] Seq=202 Ack=99 Win=32128 Len=0 TSval=610692324 TSecr=1643012618"
"48","3.303504005","192.168.105.71","192.168.105.183","TCP","66","8000  >  50708 [ACK] Seq=99 Ack=203 Win=31872 Len=0 TSval=1643012630 TSecr=610692324"
"49","4.306931742","192.168.105.183","192.168.105.71","TCP","74","50720  >  8000 [SYN] Seq=0 Win=32120 Len=0 MSS=1460 SACK_PERM TSval=610693334 TSecr=0 WS=128"
"50","4.319590182","192.168.105.71","192.168.105.183","TCP","74","8000  >  50720 [SYN, ACK] Seq=0 Ack=1 Win=31856 Len=0 MSS=1460 SACK_PERM TSval=1643013646 TSecr=610693334 WS=128"
"51","4.319712630","192.168.105.183","192.168.105.71","TCP","66","50720  >  8000 [ACK] Seq=1 Ack=1 Win=32128 Len=0 TSval=610693347 TSecr=1643013646"
"52","4.319867213","192.168.105.183","192.168.105.71","TCP","262","50720  >  8000 [PSH, ACK] Seq=1 Ack=1 Win=32128 Len=196 TSval=610693347 TSecr=1643013646 [TCP segment of a reassembled PDU]"
"53","4.320003776","192.168.105.183","192.168.105.71","HTTP","71","POST / HTTP/1.1  (text/plain)"
"54","4.327556850","192.168.105.71","192.168.105.183","TCP","66","8000  >  50720 [ACK] Seq=1 Ack=197 Win=31872 Len=0 TSval=1643013655 TSecr=610693347"
"55","4.327721069","192.168.105.71","192.168.105.183","TCP","66","8000  >  50720 [ACK] Seq=1 Ack=202 Win=31872 Len=0 TSval=1643013655 TSecr=610693347"
"56","4.331053413","192.168.105.71","192.168.105.183","TCP","158","8000  >  50720 [PSH, ACK] Seq=1 Ack=202 Win=31872 Len=92 TSval=1643013658 TSecr=610693347 [TCP segment of a reassembled PDU]"
"57","4.331106122","192.168.105.183","192.168.105.71","TCP","66","50720  >  8000 [ACK] Seq=202 Ack=93 Win=32128 Len=0 TSval=610693358 TSecr=1643013658"
"58","4.331226330","192.168.105.71","192.168.105.183","HTTP","71","HTTP/1.0 200 OK "
"59","4.333891487","192.168.105.183","192.168.105.71","TCP","66","50720  >  8000 [FIN, ACK] Seq=202 Ack=99 Win=32128 Len=0 TSval=610693361 TSecr=1643013658"
"60","4.350662688","192.168.105.71","192.168.105.183","TCP","66","8000  >  50720 [ACK] Seq=99 Ack=203 Win=31872 Len=0 TSval=1643013668 TSecr=610693361"
"61","5.344181620","192.168.105.183","192.168.105.71","TCP","74","50732  >  8000 [SYN] Seq=0 Win=32120 Len=0 MSS=1460 SACK_PERM TSval=610694371 TSecr=0 WS=128"
"62","5.356853185","192.168.105.71","192.168.105.183","TCP","74","8000  >  50732 [SYN, ACK] Seq=0 Ack=1 Win=31856 Len=0 MSS=1460 SACK_PERM TSval=1643014683 TSecr=610694371 WS=128"
"63","5.356977820","192.168.105.183","192.168.105.71","TCP","66","50732  >  8000 [ACK] Seq=1 Ack=1 Win=32128 Len=0 TSval=610694384 TSecr=1643014683"
"64","5.357141258","192.168.105.183","192.168.105.71","TCP","262","50732  >  8000 [PSH, ACK] Seq=1 Ack=1 Win=32128 Len=196 TSval=610694384 TSecr=1643014683 [TCP segment of a reassembled PDU]"
"65","5.357287873","192.168.105.183","192.168.105.71","HTTP","71","POST / HTTP/1.1  (text/plain)"
"66","5.364932093","192.168.105.71","192.168.105.183","TCP","66","8000  >  50732 [ACK] Seq=1 Ack=202 Win=31872 Len=0 TSval=1643014692 TSecr=610694384"
"67","5.369887406","192.168.105.71","192.168.105.183","TCP","158","8000  >  50732 [PSH, ACK] Seq=1 Ack=202 Win=31872 Len=92 TSval=1643014696 TSecr=610694384 [TCP segment of a reassembled PDU]"
"68","5.369957250","192.168.105.183","192.168.105.71","TCP","66","50732  >  8000 [ACK] Seq=202 Ack=93 Win=32128 Len=0 TSval=610694397 TSecr=1643014696"
"69","5.372606521","192.168.105.71","192.168.105.183","HTTP","71","HTTP/1.0 200 OK "
"70","5.373211834","192.168.105.183","192.168.105.71","TCP","66","50732  >  8000 [FIN, ACK] Seq=202 Ack=99 Win=32128 Len=0 TSval=610694400 TSecr=1643014696"
"71","5.381506002","192.168.105.71","192.168.105.183","TCP","66","8000  >  50732 [ACK] Seq=99 Ack=203 Win=31872 Len=0 TSval=1643014705 TSecr=610694400"
"72","6.379814517","192.168.105.183","192.168.105.71","TCP","74","41432  >  8000 [SYN] Seq=0 Win=32120 Len=0 MSS=1460 SACK_PERM TSval=610695407 TSecr=0 WS=128"
"73","6.398555614","192.168.105.71","192.168.105.183","TCP","74","8000  >  41432 [SYN, ACK] Seq=0 Ack=1 Win=31856 Len=0 MSS=1460 SACK_PERM TSval=1643015725 TSecr=610695407 WS=128"
"74","6.398636291","192.168.105.183","192.168.105.71","TCP","66","41432  >  8000 [ACK] Seq=1 Ack=1 Win=32128 Len=0 TSval=610695426 TSecr=1643015725"
"75","6.398802646","192.168.105.183","192.168.105.71","TCP","262","41432  >  8000 [PSH, ACK] Seq=1 Ack=1 Win=32128 Len=196 TSval=610695426 TSecr=1643015725 [TCP segment of a reassembled PDU]"
"76","6.398901344","192.168.105.183","192.168.105.71","HTTP","71","POST / HTTP/1.1  (text/plain)"
"77","6.442355049","192.168.105.183","192.168.105.71","TCP","71","[TCP Retransmission] 41432  >  8000 [PSH, ACK] Seq=197 Ack=1 Win=32128 Len=5 TSval=610695470 TSecr=1643015725 [TCP segment of a reassembled PDU]"
"78","6.465184429","192.168.105.71","192.168.105.183","TCP","66","8000  >  41432 [ACK] Seq=1 Ack=197 Win=31872 Len=0 TSval=1643015738 TSecr=610695426"
"79","6.465375470","192.168.105.71","192.168.105.183","TCP","66","8000  >  41432 [ACK] Seq=1 Ack=202 Win=31872 Len=0 TSval=1643015738 TSecr=610695426"
"80","6.465535627","192.168.105.71","192.168.105.183","TCP","158","8000  >  41432 [PSH, ACK] Seq=1 Ack=202 Win=31872 Len=92 TSval=1643015742 TSecr=610695426 [TCP segment of a reassembled PDU]"
"81","6.465566460","192.168.105.183","192.168.105.71","TCP","66","41432  >  8000 [ACK] Seq=202 Ack=93 Win=32128 Len=0 TSval=610695493 TSecr=1643015742"
"82","6.466460783","192.168.105.71","192.168.105.183","HTTP","71","HTTP/1.0 200 OK "
"83","6.466592085","192.168.105.71","192.168.105.183","TCP","71","[TCP Retransmission] 8000  >  41432 [FIN, PSH, ACK] Seq=93 Ack=202 Win=31872 Len=5 TSval=1643015764 TSecr=610695426 [TCP segment of a reassembled PDU]"
"84","6.466631512","192.168.105.183","192.168.105.71","TCP","78","41432  >  8000 [ACK] Seq=202 Ack=99 Win=32128 Len=0 TSval=610695494 TSecr=1643015764 SLE=93 SRE=99"
"85","6.467380366","192.168.105.183","192.168.105.71","TCP","66","41432  >  8000 [FIN, ACK] Seq=202 Ack=99 Win=32128 Len=0 TSval=610695495 TSecr=1643015764"
"86","6.502714592","192.168.105.71","192.168.105.183","TCP","78","[TCP Dup ACK 79#1] 8000  >  41432 [ACK] Seq=99 Ack=202 Win=31872 Len=0 TSval=1643015813 TSecr=610695470 SLE=197 SRE=202"
"87","6.530719336","192.168.105.71","192.168.105.183","TCP","66","8000  >  41432 [ACK] Seq=99 Ack=203 Win=31872 Len=0 TSval=1643015857 TSecr=610695495"
"88","7.477314507","192.168.105.183","192.168.105.71","TCP","74","41436  >  8000 [SYN] Seq=0 Win=32120 Len=0 MSS=1460 SACK_PERM TSval=610696504 TSecr=0 WS=128"
"89","7.492604718","192.168.105.71","192.168.105.183","TCP","74","8000  >  41436 [SYN, ACK] Seq=0 Ack=1 Win=31856 Len=0 MSS=1460 SACK_PERM TSval=1643016820 TSecr=610696504 WS=128"
"90","7.492727479","192.168.105.183","192.168.105.71","TCP","66","41436  >  8000 [ACK] Seq=1 Ack=1 Win=32128 Len=0 TSval=610696520 TSecr=1643016820"
"91","7.492893677","192.168.105.183","192.168.105.71","TCP","262","41436  >  8000 [PSH, ACK] Seq=1 Ack=1 Win=32128 Len=196 TSval=610696520 TSecr=1643016820 [TCP segment of a reassembled PDU]"
"92","7.493030500","192.168.105.183","192.168.105.71","HTTP","71","POST / HTTP/1.1  (text/plain)"
"93","7.500465657","192.168.105.71","192.168.105.183","TCP","66","8000  >  41436 [ACK] Seq=1 Ack=202 Win=31872 Len=0 TSval=1643016827 TSecr=610696520"
"94","7.504709148","192.168.105.71","192.168.105.183","TCP","158","8000  >  41436 [PSH, ACK] Seq=1 Ack=202 Win=31872 Len=92 TSval=1643016831 TSecr=610696520 [TCP segment of a reassembled PDU]"
"95","7.504779617","192.168.105.183","192.168.105.71","TCP","66","41436  >  8000 [ACK] Seq=202 Ack=93 Win=32128 Len=0 TSval=610696532 TSecr=1643016831"
"96","7.506544565","192.168.105.71","192.168.105.183","HTTP","71","HTTP/1.0 200 OK "
"97","7.507831127","192.168.105.183","192.168.105.71","TCP","66","41436  >  8000 [FIN, ACK] Seq=202 Ack=99 Win=32128 Len=0 TSval=610696535 TSecr=1643016831"
"98","7.515394046","192.168.105.71","192.168.105.183","TCP","66","8000  >  41436 [ACK] Seq=99 Ack=203 Win=31872 Len=0 TSval=1643016840 TSecr=610696535"
"99","8.517440527","192.168.105.183","192.168.105.71","TCP","74","41446  >  8000 [SYN] Seq=0 Win=32120 Len=0 MSS=1460 SACK_PERM TSval=610697545 TSecr=0 WS=128"
"100","8.532580478","192.168.105.71","192.168.105.183","TCP","74","8000  >  41446 [SYN, ACK] Seq=0 Ack=1 Win=31856 Len=0 MSS=1460 SACK_PERM TSval=1643017857 TSecr=610697545 WS=128"
"101","8.532707874","192.168.105.183","192.168.105.71","TCP","66","41446  >  8000 [ACK] Seq=1 Ack=1 Win=32128 Len=0 TSval=610697560 TSecr=1643017857"
"102","8.532843291","192.168.105.183","192.168.105.71","TCP","262","41446  >  8000 [PSH, ACK] Seq=1 Ack=1 Win=32128 Len=196 TSval=610697560 TSecr=1643017857 [TCP segment of a reassembled PDU]"
"103","8.532968447","192.168.105.183","192.168.105.71","HTTP","71","POST / HTTP/1.1  (text/plain)"
"104","8.542811470","192.168.105.71","192.168.105.183","TCP","66","8000  >  41446 [ACK] Seq=1 Ack=202 Win=31872 Len=0 TSval=1643017870 TSecr=610697560"
"105","8.548137408","192.168.105.71","192.168.105.183","TCP","158","8000  >  41446 [PSH, ACK] Seq=1 Ack=202 Win=31872 Len=92 TSval=1643017873 TSecr=610697560 [TCP segment of a reassembled PDU]"
"106","8.548206575","192.168.105.183","192.168.105.71","TCP","66","41446  >  8000 [ACK] Seq=202 Ack=93 Win=32128 Len=0 TSval=610697575 TSecr=1643017873"
"107","8.550627877","192.168.105.71","192.168.105.183","HTTP","71","HTTP/1.0 200 OK "
"108","8.551065117","192.168.105.183","192.168.105.71","TCP","66","41446  >  8000 [FIN, ACK] Seq=202 Ack=99 Win=32128 Len=0 TSval=610697578 TSecr=1643017874"
"109","8.557498608","192.168.105.71","192.168.105.183","TCP","66","8000  >  41446 [ACK] Seq=99 Ack=203 Win=31872 Len=0 TSval=1643017883 TSecr=610697578"
"110","9.560651703","192.168.105.183","192.168.105.71","TCP","74","41462  >  8000 [SYN] Seq=0 Win=32120 Len=0 MSS=1460 SACK_PERM TSval=610698588 TSecr=0 WS=128"
"111","9.573136497","192.168.105.71","192.168.105.183","TCP","74","8000  >  41462 [SYN, ACK] Seq=0 Ack=1 Win=31856 Len=0 MSS=1460 SACK_PERM TSval=1643018900 TSecr=610698588 WS=128"
"112","9.573258632","192.168.105.183","192.168.105.71","TCP","66","41462  >  8000 [ACK] Seq=1 Ack=1 Win=32128 Len=0 TSval=610698600 TSecr=1643018900"
"113","9.573395299","192.168.105.183","192.168.105.71","TCP","262","41462  >  8000 [PSH, ACK] Seq=1 Ack=1 Win=32128 Len=196 TSval=610698601 TSecr=1643018900 [TCP segment of a reassembled PDU]"
"114","9.573531237","192.168.105.183","192.168.105.71","HTTP","71","POST / HTTP/1.1  (text/plain)"
"115","9.582487071","192.168.105.71","192.168.105.183","TCP","66","8000  >  41462 [ACK] Seq=1 Ack=202 Win=31872 Len=0 TSval=1643018910 TSecr=610698601"
"116","9.587109885","192.168.105.71","192.168.105.183","TCP","158","8000  >  41462 [PSH, ACK] Seq=1 Ack=202 Win=31872 Len=92 TSval=1643018911 TSecr=610698601 [TCP segment of a reassembled PDU]"
"117","9.587155926","192.168.105.183","192.168.105.71","TCP","66","41462  >  8000 [ACK] Seq=202 Ack=93 Win=32128 Len=0 TSval=610698614 TSecr=1643018911"
"118","9.587273374","192.168.105.71","192.168.105.183","HTTP","71","HTTP/1.0 200 OK "
"119","9.589636969","192.168.105.183","192.168.105.71","TCP","66","41462  >  8000 [FIN, ACK] Seq=202 Ack=99 Win=32128 Len=0 TSval=610698617 TSecr=1643018911"
"120","9.599754262","192.168.105.71","192.168.105.183","TCP","66","8000  >  41462 [ACK] Seq=99 Ack=203 Win=31872 Len=0 TSval=1643018922 TSecr=610698617"
"121","10.599853397","192.168.105.183","192.168.105.71","TCP","74","41470  >  8000 [SYN] Seq=0 Win=32120 Len=0 MSS=1460 SACK_PERM TSval=610699627 TSecr=0 WS=128"
"122","10.613504806","192.168.105.71","192.168.105.183","TCP","74","8000  >  41470 [SYN, ACK] Seq=0 Ack=1 Win=31856 Len=0 MSS=1460 SACK_PERM TSval=1643019939 TSecr=610699627 WS=128"
"123","10.613626212","192.168.105.183","192.168.105.71","TCP","66","41470  >  8000 [ACK] Seq=1 Ack=1 Win=32128 Len=0 TSval=610699641 TSecr=1643019939"
"124","10.613766264","192.168.105.183","192.168.105.71","TCP","262","41470  >  8000 [PSH, ACK] Seq=1 Ack=1 Win=32128 Len=196 TSval=610699641 TSecr=1643019939 [TCP segment of a reassembled PDU]"
"125","10.613911004","192.168.105.183","192.168.105.71","HTTP","72","POST / HTTP/1.1  (text/plain)"
"126","10.623715849","192.168.105.71","192.168.105.183","TCP","66","8000  >  41470 [ACK] Seq=1 Ack=197 Win=31872 Len=0 TSval=1643019949 TSecr=610699641"
"127","10.623875641","192.168.105.71","192.168.105.183","TCP","66","8000  >  41470 [ACK] Seq=1 Ack=203 Win=31872 Len=0 TSval=1643019949 TSecr=610699641"
"128","10.624385850","192.168.105.71","192.168.105.183","TCP","158","8000  >  41470 [PSH, ACK] Seq=1 Ack=203 Win=31872 Len=92 TSval=1643019952 TSecr=610699641 [TCP segment of a reassembled PDU]"
"129","10.624452412","192.168.105.183","192.168.105.71","TCP","66","41470  >  8000 [ACK] Seq=203 Ack=93 Win=32128 Len=0 TSval=610699652 TSecr=1643019952"
"130","10.626295017","192.168.105.71","192.168.105.183","HTTP","72","HTTP/1.0 200 OK "
"131","10.627064965","192.168.105.183","192.168.105.71","TCP","66","41470  >  8000 [FIN, ACK] Seq=203 Ack=100 Win=32128 Len=0 TSval=610699654 TSecr=1643019952"
"132","10.634869810","192.168.105.71","192.168.105.183","TCP","66","8000  >  41470 [ACK] Seq=100 Ack=204 Win=31872 Len=0 TSval=1643019959 TSecr=610699654"
"133","11.421967084","192.168.105.174","224.0.0.251","MDNS","82","Standard query 0x042f PTR _quickshare._tcp.local, ""QM"" question"
"134","11.422534323","fe80::a081:24ff:fe63:2646","ff02::fb","MDNS","102","Standard query 0x042f PTR _quickshare._tcp.local, ""QM"" question"
"135","11.633198579","192.168.105.183","192.168.105.71","TCP","74","41478  >  8000 [SYN] Seq=0 Win=32120 Len=0 MSS=1460 SACK_PERM TSval=610700660 TSecr=0 WS=128"
"136","11.641863841","192.168.105.71","192.168.105.183","TCP","74","8000  >  41478 [SYN, ACK] Seq=0 Ack=1 Win=31856 Len=0 MSS=1460 SACK_PERM TSval=1643020969 TSecr=610700660 WS=128"
"137","11.641940507","192.168.105.183","192.168.105.71","TCP","66","41478  >  8000 [ACK] Seq=1 Ack=1 Win=32128 Len=0 TSval=610700669 TSecr=1643020969"
"138","11.642019362","192.168.105.183","192.168.105.71","TCP","262","41478  >  8000 [PSH, ACK] Seq=1 Ack=1 Win=32128 Len=196 TSval=610700669 TSecr=1643020969 [TCP segment of a reassembled PDU]"
"139","11.642096341","192.168.105.183","192.168.105.71","HTTP","72","POST / HTTP/1.1  (text/plain)"
"140","11.647393321","192.168.105.71","192.168.105.183","TCP","66","8000  >  41478 [ACK] Seq=1 Ack=203 Win=31872 Len=0 TSval=1643020975 TSecr=610700669"
"141","11.650227696","192.168.105.71","192.168.105.183","TCP","158","8000  >  41478 [PSH, ACK] Seq=1 Ack=203 Win=31872 Len=92 TSval=1643020978 TSecr=610700669 [TCP segment of a reassembled PDU]"
"142","11.650254467","192.168.105.183","192.168.105.71","TCP","66","41478  >  8000 [ACK] Seq=203 Ack=93 Win=32128 Len=0 TSval=610700677 TSecr=1643020978"
"143","11.650329259","192.168.105.71","192.168.105.183","HTTP","72","HTTP/1.0 200 OK "
"144","11.651762697","192.168.105.183","192.168.105.71","TCP","66","41478  >  8000 [FIN, ACK] Seq=203 Ack=100 Win=32128 Len=0 TSval=610700679 TSecr=1643020978"
"145","11.656944104","192.168.105.71","192.168.105.183","TCP","66","8000  >  41478 [ACK] Seq=100 Ack=204 Win=31872 Len=0 TSval=1643020984 TSecr=610700679"
"146","12.657116987","192.168.105.183","192.168.105.71","TCP","74","41492  >  8000 [SYN] Seq=0 Win=32120 Len=0 MSS=1460 SACK_PERM TSval=610701684 TSecr=0 WS=128"
"147","12.669086624","192.168.105.71","192.168.105.183","TCP","74","8000  >  41492 [SYN, ACK] Seq=0 Ack=1 Win=31856 Len=0 MSS=1460 SACK_PERM TSval=1643021996 TSecr=610701684 WS=128"
"148","12.669165270","192.168.105.183","192.168.105.71","TCP","66","41492  >  8000 [ACK] Seq=1 Ack=1 Win=32128 Len=0 TSval=610701696 TSecr=1643021996"
"149","12.669250166","192.168.105.183","192.168.105.71","TCP","262","41492  >  8000 [PSH, ACK] Seq=1 Ack=1 Win=32128 Len=196 TSval=610701696 TSecr=1643021996 [TCP segment of a reassembled PDU]"
"150","12.669326364","192.168.105.183","192.168.105.71","HTTP","72","POST / HTTP/1.1  (text/plain)"
"151","12.677865219","192.168.105.71","192.168.105.183","TCP","66","8000  >  41492 [ACK] Seq=1 Ack=203 Win=31872 Len=0 TSval=1643022004 TSecr=610701696"
"152","12.680460116","192.168.105.71","192.168.105.183","TCP","158","8000  >  41492 [PSH, ACK] Seq=1 Ack=203 Win=31872 Len=92 TSval=1643022007 TSecr=610701696 [TCP segment of a reassembled PDU]"
"153","12.680500897","192.168.105.183","192.168.105.71","TCP","66","41492  >  8000 [ACK] Seq=203 Ack=93 Win=32128 Len=0 TSval=610701708 TSecr=1643022007"
"154","12.681904491","192.168.105.71","192.168.105.183","HTTP","72","HTTP/1.0 200 OK "
"155","12.682195272","192.168.105.183","192.168.105.71","TCP","66","41492  >  8000 [FIN, ACK] Seq=203 Ack=100 Win=32128 Len=0 TSval=610701709 TSecr=1643022007"
"156","12.700850796","192.168.105.71","192.168.105.183","TCP","72","[TCP Spurious Retransmission] 8000  >  41492 [FIN, PSH, ACK] Seq=93 Ack=203 Win=31872 Len=6 TSval=1643022024 TSecr=610701696 [TCP segment of a reassembled PDU]"
"157","12.700914598","192.168.105.183","192.168.105.71","TCP","78","[TCP Dup ACK 155#1] 41492  >  8000 [ACK] Seq=204 Ack=100 Win=32128 Len=0 TSval=610701728 TSecr=1643022024 SLE=93 SRE=100"
"158","12.709111891","192.168.105.71","192.168.105.183","TCP","66","8000  >  41492 [ACK] Seq=100 Ack=204 Win=31872 Len=0 TSval=1643022032 TSecr=610701709"
"159","13.691079874","192.168.105.183","192.168.105.71","TCP","74","41498  >  8000 [SYN] Seq=0 Win=32120 Len=0 MSS=1460 SACK_PERM TSval=610702718 TSecr=0 WS=128"
"160","13.703180397","192.168.105.71","192.168.105.183","TCP","74","8000  >  41498 [SYN, ACK] Seq=0 Ack=1 Win=31856 Len=0 MSS=1460 SACK_PERM TSval=1643023030 TSecr=610702718 WS=128"
"161","13.703298209","192.168.105.183","192.168.105.71","TCP","66","41498  >  8000 [ACK] Seq=1 Ack=1 Win=32128 Len=0 TSval=610702730 TSecr=1643023030"
"162","13.703437949","192.168.105.183","192.168.105.71","TCP","262","41498  >  8000 [PSH, ACK] Seq=1 Ack=1 Win=32128 Len=196 TSval=610702731 TSecr=1643023030 [TCP segment of a reassembled PDU]"
"163","13.703583938","192.168.105.183","192.168.105.71","HTTP","72","POST / HTTP/1.1  (text/plain)"
"164","13.712485919","192.168.105.71","192.168.105.183","TCP","66","8000  >  41498 [ACK] Seq=1 Ack=197 Win=31872 Len=0 TSval=1643023037 TSecr=610702731"
"165","13.712635971","192.168.105.71","192.168.105.183","TCP","66","8000  >  41498 [ACK] Seq=1 Ack=203 Win=31872 Len=0 TSval=1643023037 TSecr=610702731"
"166","13.715248888","192.168.105.71","192.168.105.183","TCP","158","8000  >  41498 [PSH, ACK] Seq=1 Ack=203 Win=31872 Len=92 TSval=1643023040 TSecr=610702731 [TCP segment of a reassembled PDU]"
"167","13.715314878","192.168.105.183","192.168.105.71","TCP","66","41498  >  8000 [ACK] Seq=203 Ack=93 Win=32128 Len=0 TSval=610702742 TSecr=1643023040"
"168","13.717630035","192.168.105.71","192.168.105.183","HTTP","72","HTTP/1.0 200 OK "
"169","13.718185399","192.168.105.183","192.168.105.71","TCP","66","41498  >  8000 [FIN, ACK] Seq=203 Ack=100 Win=32128 Len=0 TSval=610702745 TSecr=1643023041"
"170","13.724776650","192.168.105.71","192.168.105.183","TCP","66","8000  >  41498 [ACK] Seq=100 Ack=204 Win=31872 Len=0 TSval=1643023050 TSecr=610702745"
"171","14.727778333","192.168.105.183","192.168.105.71","TCP","74","41502  >  8000 [SYN] Seq=0 Win=32120 Len=0 MSS=1460 SACK_PERM TSval=610703755 TSecr=0 WS=128"
"172","14.741507971","192.168.105.71","192.168.105.183","TCP","74","8000  >  41502 [SYN, ACK] Seq=0 Ack=1 Win=31856 Len=0 MSS=1460 SACK_PERM TSval=1643024069 TSecr=610703755 WS=128"
"173","14.741630575","192.168.105.183","192.168.105.71","TCP","66","41502  >  8000 [ACK] Seq=1 Ack=1 Win=32128 Len=0 TSval=610703769 TSecr=1643024069"
"174","14.741775992","192.168.105.183","192.168.105.71","TCP","262","41502  >  8000 [PSH, ACK] Seq=1 Ack=1 Win=32128 Len=196 TSval=610703769 TSecr=1643024069 [TCP segment of a reassembled PDU]"
"175","14.741902034","192.168.105.183","192.168.105.71","HTTP","72","POST / HTTP/1.1  (text/plain)"
"176","14.748669274","192.168.105.71","192.168.105.183","TCP","66","8000  >  41502 [ACK] Seq=1 Ack=197 Win=31872 Len=0 TSval=1643024075 TSecr=610703769"
"177","14.753648077","192.168.105.71","192.168.105.183","TCP","66","8000  >  41502 [ACK] Seq=1 Ack=203 Win=31872 Len=0 TSval=1643024076 TSecr=610703769"
"178","14.753777348","192.168.105.71","192.168.105.183","TCP","158","8000  >  41502 [PSH, ACK] Seq=1 Ack=203 Win=31872 Len=92 TSval=1643024080 TSecr=610703769 [TCP segment of a reassembled PDU]"
"179","14.753839796","192.168.105.183","192.168.105.71","TCP","66","41502  >  8000 [ACK] Seq=203 Ack=93 Win=32128 Len=0 TSval=610703781 TSecr=1643024080"
"180","14.754824484","192.168.105.71","192.168.105.183","HTTP","72","HTTP/1.0 200 OK "
"181","14.756508703","192.168.105.183","192.168.105.71","TCP","66","41502  >  8000 [FIN, ACK] Seq=203 Ack=100 Win=32128 Len=0 TSval=610703784 TSecr=1643024081"
"182","14.760918078","192.168.105.71","192.168.105.183","TCP","66","8000  >  41502 [ACK] Seq=100 Ack=204 Win=31872 Len=0 TSval=1643024088 TSecr=610703784"
"183","15.765947104","192.168.105.183","192.168.105.71","TCP","74","41514  >  8000 [SYN] Seq=0 Win=32120 Len=0 MSS=1460 SACK_PERM TSval=610704793 TSecr=0 WS=128"
"184","15.786219712","192.168.105.71","192.168.105.183","TCP","74","8000  >  41514 [SYN, ACK] Seq=0 Ack=1 Win=31856 Len=0 MSS=1460 SACK_PERM TSval=1643025112 TSecr=610704793 WS=128"
"185","15.786365701","192.168.105.183","192.168.105.71","TCP","66","41514  >  8000 [ACK] Seq=1 Ack=1 Win=32128 Len=0 TSval=610704813 TSecr=1643025112"
"186","15.786510545","192.168.105.183","192.168.105.71","TCP","262","41514  >  8000 [PSH, ACK] Seq=1 Ack=1 Win=32128 Len=196 TSval=610704814 TSecr=1643025112 [TCP segment of a reassembled PDU]"
"187","15.786650024","192.168.105.183","192.168.105.71","HTTP","72","POST / HTTP/1.1  (text/plain)"
"188","15.792738775","192.168.105.71","192.168.105.183","TCP","66","8000  >  41514 [ACK] Seq=1 Ack=203 Win=31872 Len=0 TSval=1643025120 TSecr=610704814"
"189","15.799047995","192.168.105.71","192.168.105.183","TCP","158","8000  >  41514 [PSH, ACK] Seq=1 Ack=203 Win=31872 Len=92 TSval=1643025123 TSecr=610704814 [TCP segment of a reassembled PDU]"
"190","15.799095599","192.168.105.183","192.168.105.71","TCP","66","41514  >  8000 [ACK] Seq=203 Ack=93 Win=32128 Len=0 TSval=610704826 TSecr=1643025123"
"191","15.799214714","192.168.105.71","192.168.105.183","HTTP","72","HTTP/1.0 200 OK "
"192","15.801496745","192.168.105.183","192.168.105.71","TCP","66","41514  >  8000 [FIN, ACK] Seq=203 Ack=100 Win=32128 Len=0 TSval=610704829 TSecr=1643025123"
"193","15.808070757","192.168.105.71","192.168.105.183","TCP","66","8000  >  41514 [ACK] Seq=100 Ack=204 Win=31872 Len=0 TSval=1643025134 TSecr=610704829"
"194","16.811697698","192.168.105.183","192.168.105.71","TCP","74","56262  >  8000 [SYN] Seq=0 Win=32120 Len=0 MSS=1460 SACK_PERM TSval=610705839 TSecr=0 WS=128"
"195","16.823842023","192.168.105.71","192.168.105.183","TCP","74","8000  >  56262 [SYN, ACK] Seq=0 Ack=1 Win=31856 Len=0 MSS=1460 SACK_PERM TSval=1643026151 TSecr=610705839 WS=128"
"196","16.823964679","192.168.105.183","192.168.105.71","TCP","66","56262  >  8000 [ACK] Seq=1 Ack=1 Win=32128 Len=0 TSval=610705851 TSecr=1643026151"
"197","16.824111294","192.168.105.183","192.168.105.71","TCP","262","56262  >  8000 [PSH, ACK] Seq=1 Ack=1 Win=32128 Len=196 TSval=610705851 TSecr=1643026151 [TCP segment of a reassembled PDU]"
"198","16.824249783","192.168.105.183","192.168.105.71","HTTP","72","POST / HTTP/1.1  (text/plain)"
"199","16.830783743","192.168.105.71","192.168.105.183","TCP","66","8000  >  56262 [ACK] Seq=1 Ack=203 Win=31872 Len=0 TSval=1643026157 TSecr=610705851"
"200","16.837656087","192.168.105.71","192.168.105.183","TCP","158","8000  >  56262 [PSH, ACK] Seq=1 Ack=203 Win=31872 Len=92 TSval=1643026160 TSecr=610705851 [TCP segment of a reassembled PDU]"
"201","16.837722337","192.168.105.183","192.168.105.71","TCP","66","56262  >  8000 [ACK] Seq=203 Ack=93 Win=32128 Len=0 TSval=610705865 TSecr=1643026160"
"202","16.838503952","192.168.105.71","192.168.105.183","HTTP","72","HTTP/1.0 200 OK "
"203","16.840325202","192.168.105.183","192.168.105.71","TCP","66","56262  >  8000 [FIN, ACK] Seq=203 Ack=100 Win=32128 Len=0 TSval=610705867 TSecr=1643026161"
"204","16.862355727","192.168.105.71","192.168.105.183","TCP","66","8000  >  56262 [ACK] Seq=100 Ack=204 Win=31872 Len=0 TSval=1643026190 TSecr=610705867"
"205","17.846381257","192.168.105.183","192.168.105.71","TCP","74","56270  >  8000 [SYN] Seq=0 Win=32120 Len=0 MSS=1460 SACK_PERM TSval=610706873 TSecr=0 WS=128"
"206","17.860946051","192.168.105.71","192.168.105.183","TCP","74","8000  >  56270 [SYN, ACK] Seq=0 Ack=1 Win=31856 Len=0 MSS=1460 SACK_PERM TSval=1643027188 TSecr=610706873 WS=128"
"207","17.861028186","192.168.105.183","192.168.105.71","TCP","66","56270  >  8000 [ACK] Seq=1 Ack=1 Win=32128 Len=0 TSval=610706888 TSecr=1643027188"
"208","17.861115270","192.168.105.183","192.168.105.71","TCP","262","56270  >  8000 [PSH, ACK] Seq=1 Ack=1 Win=32128 Len=196 TSval=610706888 TSecr=1643027188 [TCP segment of a reassembled PDU]"
"209","17.861191364","192.168.105.183","192.168.105.71","HTTP","72","POST / HTTP/1.1  (text/plain)"
"210","17.870453084","192.168.105.71","192.168.105.183","TCP","66","8000  >  56270 [ACK] Seq=1 Ack=203 Win=31872 Len=0 TSval=1643027198 TSecr=610706888"
"211","17.874356678","192.168.105.71","192.168.105.183","TCP","158","8000  >  56270 [PSH, ACK] Seq=1 Ack=203 Win=31872 Len=92 TSval=1643027200 TSecr=610706888 [TCP segment of a reassembled PDU]"
"212","17.874397668","192.168.105.183","192.168.105.71","TCP","66","56270  >  8000 [ACK] Seq=203 Ack=93 Win=32128 Len=0 TSval=610706902 TSecr=1643027200"
"213","17.875836470","192.168.105.71","192.168.105.183","HTTP","72","HTTP/1.0 200 OK "
"214","17.876179283","192.168.105.183","192.168.105.71","TCP","66","56270  >  8000 [FIN, ACK] Seq=203 Ack=100 Win=32128 Len=0 TSval=610706903 TSecr=1643027201"
"215","17.883676784","192.168.105.71","192.168.105.183","TCP","66","8000  >  56270 [ACK] Seq=100 Ack=204 Win=31872 Len=0 TSval=1643027208 TSecr=610706903"
"216","18.881995336","192.168.105.183","192.168.105.71","TCP","74","56280  >  8000 [SYN] Seq=0 Win=32120 Len=0 MSS=1460 SACK_PERM TSval=610707909 TSecr=0 WS=128"
"217","18.895208984","192.168.105.71","192.168.105.183","TCP","74","8000  >  56280 [SYN, ACK] Seq=0 Ack=1 Win=31856 Len=0 MSS=1460 SACK_PERM TSval=1643028221 TSecr=610707909 WS=128"
"218","18.895288671","192.168.105.183","192.168.105.71","TCP","66","56280  >  8000 [ACK] Seq=1 Ack=1 Win=32128 Len=0 TSval=610707922 TSecr=1643028221"
"219","18.895381380","192.168.105.183","192.168.105.71","TCP","262","56280  >  8000 [PSH, ACK] Seq=1 Ack=1 Win=32128 Len=196 TSval=610707923 TSecr=1643028221 [TCP segment of a reassembled PDU]"
"220","18.895467682","192.168.105.183","192.168.105.71","HTTP","72","POST / HTTP/1.1  (text/plain)"
"221","18.901377422","192.168.105.71","192.168.105.183","TCP","66","8000  >  56280 [ACK] Seq=1 Ack=203 Win=31872 Len=0 TSval=1643028229 TSecr=610707923"
"222","18.905635965","192.168.105.71","192.168.105.183","TCP","158","8000  >  56280 [PSH, ACK] Seq=1 Ack=203 Win=31872 Len=92 TSval=1643028231 TSecr=610707923 [TCP segment of a reassembled PDU]"
"223","18.905673517","192.168.105.183","192.168.105.71","TCP","66","56280  >  8000 [ACK] Seq=203 Ack=93 Win=32128 Len=0 TSval=610707933 TSecr=1643028231"
"224","18.906464975","192.168.105.71","192.168.105.183","HTTP","72","HTTP/1.0 200 OK "
"225","18.907271694","192.168.105.183","192.168.105.71","TCP","66","56280  >  8000 [FIN, ACK] Seq=203 Ack=100 Win=32128 Len=0 TSval=610707934 TSecr=1643028231"
"226","18.915275029","192.168.105.71","192.168.105.183","TCP","66","8000  >  56280 [ACK] Seq=100 Ack=204 Win=31872 Len=0 TSval=1643028240 TSecr=610707934"
"227","19.916096184","192.168.105.183","192.168.105.71","TCP","74","56286  >  8000 [SYN] Seq=0 Win=32120 Len=0 MSS=1460 SACK_PERM TSval=610708943 TSecr=0 WS=128"
"228","19.930703061","192.168.105.71","192.168.105.183","TCP","74","8000  >  56286 [SYN, ACK] Seq=0 Ack=1 Win=31856 Len=0 MSS=1460 SACK_PERM TSval=1643029256 TSecr=610708943 WS=128"
"229","19.930820718","192.168.105.183","192.168.105.71","TCP","66","56286  >  8000 [ACK] Seq=1 Ack=1 Win=32128 Len=0 TSval=610708958 TSecr=1643029256"
"230","19.930961447","192.168.105.183","192.168.105.71","TCP","262","56286  >  8000 [PSH, ACK] Seq=1 Ack=1 Win=32128 Len=196 TSval=610708958 TSecr=1643029256 [TCP segment of a reassembled PDU]"
"231","19.931106134","192.168.105.183","192.168.105.71","HTTP","72","POST / HTTP/1.1  (text/plain)"
"232","19.940196292","192.168.105.71","192.168.105.183","TCP","66","8000  >  56286 [ACK] Seq=1 Ack=203 Win=31872 Len=0 TSval=1643029267 TSecr=610708958"
"233","19.946309835","192.168.105.71","192.168.105.183","TCP","158","8000  >  56286 [PSH, ACK] Seq=1 Ack=203 Win=31872 Len=92 TSval=1643029271 TSecr=610708958 [TCP segment of a reassembled PDU]"
"234","19.946411554","192.168.105.183","192.168.105.71","TCP","66","56286  >  8000 [ACK] Seq=203 Ack=93 Win=32128 Len=0 TSval=610708973 TSecr=1643029271"
"235","19.946558116","192.168.105.71","192.168.105.183","HTTP","72","HTTP/1.0 200 OK "
"236","19.949074158","192.168.105.183","192.168.105.71","TCP","66","56286  >  8000 [FIN, ACK] Seq=203 Ack=100 Win=32128 Len=0 TSval=610708976 TSecr=1643029271"
"237","19.957895410","192.168.105.71","192.168.105.183","TCP","66","8000  >  56286 [ACK] Seq=100 Ack=204 Win=31872 Len=0 TSval=1643029282 TSecr=610708976"
"238","20.955690834","192.168.105.183","192.168.105.71","TCP","74","56298  >  8000 [SYN] Seq=0 Win=32120 Len=0 MSS=1460 SACK_PERM TSval=610709983 TSecr=0 WS=128"
"239","20.973044795","192.168.105.71","192.168.105.183","TCP","74","8000  >  56298 [SYN, ACK] Seq=0 Ack=1 Win=31856 Len=0 MSS=1460 SACK_PERM TSval=1643030298 TSecr=610709983 WS=128"
"240","20.973127712","192.168.105.183","192.168.105.71","TCP","66","56298  >  8000 [ACK] Seq=1 Ack=1 Win=32128 Len=0 TSval=610710000 TSecr=1643030298"
"241","20.973215212","192.168.105.183","192.168.105.71","TCP","262","56298  >  8000 [PSH, ACK] Seq=1 Ack=1 Win=32128 Len=196 TSval=610710000 TSecr=1643030298 [TCP segment of a reassembled PDU]"
"242","20.973299951","192.168.105.183","192.168.105.71","HTTP","72","POST / HTTP/1.1  (text/plain)"
"243","20.979688181","192.168.105.71","192.168.105.183","TCP","66","8000  >  56298 [ACK] Seq=1 Ack=203 Win=31872 Len=0 TSval=1643030306 TSecr=610710000"
"244","20.981491359","192.168.105.71","192.168.105.183","TCP","158","8000  >  56298 [PSH, ACK] Seq=1 Ack=203 Win=31872 Len=92 TSval=1643030309 TSecr=610710000 [TCP segment of a reassembled PDU]"
"245","20.981531619","192.168.105.183","192.168.105.71","TCP","66","56298  >  8000 [ACK] Seq=203 Ack=93 Win=32128 Len=0 TSval=610710009 TSecr=1643030309"
"246","20.983165630","192.168.105.71","192.168.105.183","HTTP","72","HTTP/1.0 200 OK "
"247","20.983432245","192.168.105.183","192.168.105.71","TCP","66","56298  >  8000 [FIN, ACK] Seq=203 Ack=100 Win=32128 Len=0 TSval=610710011 TSecr=1643030309"
"248","20.992266048","192.168.105.71","192.168.105.183","TCP","66","8000  >  56298 [ACK] Seq=100 Ack=204 Win=31872 Len=0 TSval=1643030318 TSecr=610710011"
"249","21.988794908","192.168.105.183","192.168.105.71","TCP","74","56302  >  8000 [SYN] Seq=0 Win=32120 Len=0 MSS=1460 SACK_PERM TSval=610711016 TSecr=0 WS=128"
"250","22.000108504","192.168.105.71","192.168.105.183","TCP","74","8000  >  56302 [SYN, ACK] Seq=0 Ack=1 Win=31856 Len=0 MSS=1460 SACK_PERM TSval=1643031327 TSecr=610711016 WS=128"
"251","22.000189494","192.168.105.183","192.168.105.71","TCP","66","56302  >  8000 [ACK] Seq=1 Ack=1 Win=32128 Len=0 TSval=610711027 TSecr=1643031327"
"252","22.000274546","192.168.105.183","192.168.105.71","TCP","262","56302  >  8000 [PSH, ACK] Seq=1 Ack=1 Win=32128 Len=196 TSval=610711027 TSecr=1643031327 [TCP segment of a reassembled PDU]"
"253","22.000352410","192.168.105.183","192.168.105.71","HTTP","72","POST / HTTP/1.1  (text/plain)"
"254","22.010200745","192.168.105.71","192.168.105.183","TCP","66","8000  >  56302 [ACK] Seq=1 Ack=197 Win=31872 Len=0 TSval=1643031338 TSecr=610711027"
"255","22.010292516","192.168.105.71","192.168.105.183","TCP","66","8000  >  56302 [ACK] Seq=1 Ack=203 Win=31872 Len=0 TSval=1643031338 TSecr=610711028"
"256","22.015980538","192.168.105.71","192.168.105.183","TCP","158","8000  >  56302 [PSH, ACK] Seq=1 Ack=203 Win=31872 Len=92 TSval=1643031341 TSecr=610711028 [TCP segment of a reassembled PDU]"
"257","22.016005225","192.168.105.183","192.168.105.71","TCP","66","56302  >  8000 [ACK] Seq=203 Ack=93 Win=32128 Len=0 TSval=610711043 TSecr=1643031341"
"258","22.016076475","192.168.105.71","192.168.105.183","HTTP","72","HTTP/1.0 200 OK "
