"No.","Time","Source","Destination","Protocol","Length","Info"
"1","0.000000000","192.168.110.183","192.168.110.71","TCP","74","43744  >  8000 [SYN] Seq=0 Win=32120 Len=0 MSS=1460 SACK_PERM TSval=559222648 TSecr=0 WS=128"
"2","0.014269413","192.168.110.71","192.168.110.183","TCP","74","8000  >  43744 [SYN, ACK] Seq=0 Ack=1 Win=31856 Len=0 MSS=1460 SACK_PERM TSval=4161925729 TSecr=559222648 WS=128"
"3","0.014424965","192.168.110.183","192.168.110.71","TCP","66","43744  >  8000 [ACK] Seq=1 Ack=1 Win=32128 Len=0 TSval=559222662 TSecr=4161925729"
"4","0.014696544","192.168.110.183","192.168.110.71","TCP","264","43744  >  8000 [PSH, ACK] Seq=1 Ack=1 Win=32128 Len=198 TSval=559222663 TSecr=4161925729 [TCP segment of a reassembled PDU]"
"5","0.014814393","192.168.110.183","192.168.110.71","HTTP","1033","POST / HTTP/1.1  (text/plain)"
"6","0.029622223","192.168.110.71","192.168.110.183","TCP","66","8000  >  43744 [ACK] Seq=1 Ack=1166 Win=31872 Len=0 TSval=4161925739 TSecr=559222663"
"7","0.029859588","192.168.110.71","192.168.110.183","TCP","158","8000  >  43744 [PSH, ACK] Seq=1 Ack=1166 Win=31872 Len=92 TSval=4161925742 TSecr=559222663 [TCP segment of a reassembled PDU]"
"8","0.029910154","192.168.110.183","192.168.110.71","TCP","66","43744  >  8000 [ACK] Seq=1166 Ack=93 Win=32128 Len=0 TSval=559222678 TSecr=4161925742"
"9","0.030025035","192.168.110.71","192.168.110.183","HTTP","68","HTTP/1.0 200 OK "
"10","0.033443957","192.168.110.183","192.168.110.71","TCP","66","43744  >  8000 [FIN, ACK] Seq=1166 Ack=96 Win=32128 Len=0 TSval=559222681 TSecr=4161925742"
"11","0.043143818","192.168.110.71","192.168.110.183","TCP","66","8000  >  43744 [ACK] Seq=96 Ack=1167 Win=31872 Len=0 TSval=4161925758 TSecr=559222681"
"12","1.046186783","192.168.110.183","192.168.110.71","TCP","74","43746  >  8000 [SYN] Seq=0 Win=32120 Len=0 MSS=1460 SACK_PERM TSval=559223694 TSecr=0 WS=128"
"13","1.060110975","192.168.110.71","192.168.110.183","TCP","74","8000  >  43746 [SYN, ACK] Seq=0 Ack=1 Win=31856 Len=0 MSS=1460 SACK_PERM TSval=4161926775 TSecr=559223694 WS=128"
"14","1.060228928","192.168.110.183","192.168.110.71","TCP","66","43746  >  8000 [ACK] Seq=1 Ack=1 Win=32128 Len=0 TSval=559223708 TSecr=4161926775"
"15","1.060393698","192.168.110.183","192.168.110.71","TCP","264","43746  >  8000 [PSH, ACK] Seq=1 Ack=1 Win=32128 Len=198 TSval=559223708 TSecr=4161926775 [TCP segment of a reassembled PDU]"
"16","1.060508682","192.168.110.183","192.168.110.71","HTTP","1033","POST / HTTP/1.1  (text/plain)"
"17","1.070237182","192.168.110.71","192.168.110.183","TCP","66","8000  >  43746 [ACK] Seq=1 Ack=199 Win=31872 Len=0 TSval=4161926781 TSecr=559223708"
"18","1.070482462","192.168.110.71","192.168.110.183","TCP","66","8000  >  43746 [ACK] Seq=1 Ack=1166 Win=31872 Len=0 TSval=4161926784 TSecr=559223708"
"19","1.070613070","192.168.110.71","192.168.110.183","TCP","158","8000  >  43746 [PSH, ACK] Seq=1 Ack=1166 Win=31872 Len=92 TSval=4161926785 TSecr=559223708 [TCP segment of a reassembled PDU]"
"20","1.070659053","192.168.110.183","192.168.110.71","TCP","66","43746  >  8000 [ACK] Seq=1166 Ack=93 Win=32128 Len=0 TSval=559223719 TSecr=4161926785"
"21","1.070780912","192.168.110.71","192.168.110.183","HTTP","68","HTTP/1.0 200 OK "
"22","1.073888676","192.168.110.183","192.168.110.71","TCP","66","43746  >  8000 [FIN, ACK] Seq=1166 Ack=96 Win=32128 Len=0 TSval=559223722 TSecr=4161926786"
"23","1.084685419","192.168.110.71","192.168.110.183","TCP","66","8000  >  43746 [ACK] Seq=96 Ack=1167 Win=31872 Len=0 TSval=4161926794 TSecr=559223722"
"24","2.086265006","192.168.110.183","192.168.110.71","TCP","74","43762  >  8000 [SYN] Seq=0 Win=32120 Len=0 MSS=1460 SACK_PERM TSval=559224734 TSecr=0 WS=128"
"25","2.099723422","192.168.110.71","192.168.110.183","TCP","74","8000  >  43762 [SYN, ACK] Seq=0 Ack=1 Win=31856 Len=0 MSS=1460 SACK_PERM TSval=4161927815 TSecr=559224734 WS=128"
"26","2.099849343","192.168.110.183","192.168.110.71","TCP","66","43762  >  8000 [ACK] Seq=1 Ack=1 Win=32128 Len=0 TSval=559224748 TSecr=4161927815"
"27","2.099999219","192.168.110.183","192.168.110.71","TCP","264","43762  >  8000 [PSH, ACK] Seq=1 Ack=1 Win=32128 Len=198 TSval=559224748 TSecr=4161927815 [TCP segment of a reassembled PDU]"
"28","2.100099726","192.168.110.183","192.168.110.71","HTTP","1033","POST / HTTP/1.1  (text/plain)"
"29","2.115259217","192.168.110.71","192.168.110.183","TCP","66","8000  >  43762 [ACK] Seq=1 Ack=1166 Win=31872 Len=0 TSval=4161927828 TSecr=559224748"
"30","2.116643877","192.168.110.71","192.168.110.183","TCP","158","8000  >  43762 [PSH, ACK] Seq=1 Ack=1166 Win=31872 Len=92 TSval=4161927832 TSecr=559224748 [TCP segment of a reassembled PDU]"
"31","2.116714909","192.168.110.183","192.168.110.71","TCP","66","43762  >  8000 [ACK] Seq=1166 Ack=93 Win=32128 Len=0 TSval=559224765 TSecr=4161927832"
"32","2.119626500","192.168.110.71","192.168.110.183","HTTP","68","HTTP/1.0 200 OK "
"33","2.120259333","192.168.110.183","192.168.110.71","TCP","66","43762  >  8000 [FIN, ACK] Seq=1166 Ack=96 Win=32128 Len=0 TSval=559224768 TSecr=4161927832"
"34","2.127883838","192.168.110.71","192.168.110.183","TCP","66","8000  >  43762 [ACK] Seq=96 Ack=1167 Win=31872 Len=0 TSval=4161927840 TSecr=559224768"
"35","3.133459117","192.168.110.183","192.168.110.71","TCP","74","33194  >  8000 [SYN] Seq=0 Win=32120 Len=0 MSS=1460 SACK_PERM TSval=559225781 TSecr=0 WS=128"
"36","3.145188227","192.168.110.71","192.168.110.183","TCP","74","8000  >  33194 [SYN, ACK] Seq=0 Ack=1 Win=31856 Len=0 MSS=1460 SACK_PERM TSval=4161928860 TSecr=559225781 WS=128"
"37","3.145301545","192.168.110.183","192.168.110.71","TCP","66","33194  >  8000 [ACK] Seq=1 Ack=1 Win=32128 Len=0 TSval=559225793 TSecr=4161928860"
"38","3.145469596","192.168.110.183","192.168.110.71","TCP","264","33194  >  8000 [PSH, ACK] Seq=1 Ack=1 Win=32128 Len=198 TSval=559225793 TSecr=4161928860 [TCP segment of a reassembled PDU]"
"39","3.145590257","192.168.110.183","192.168.110.71","HTTP","1033","POST / HTTP/1.1  (text/plain)"
"40","3.151532380","192.168.110.71","192.168.110.183","TCP","66","8000  >  33194 [ACK] Seq=1 Ack=199 Win=31872 Len=0 TSval=4161928866 TSecr=559225793"
"41","3.151695223","192.168.110.71","192.168.110.183","TCP","66","8000  >  33194 [ACK] Seq=1 Ack=1166 Win=31872 Len=0 TSval=4161928867 TSecr=559225794"
"42","3.155579079","192.168.110.71","192.168.110.183","TCP","158","8000  >  33194 [PSH, ACK] Seq=1 Ack=1166 Win=31872 Len=92 TSval=4161928871 TSecr=559225794 [TCP segment of a reassembled PDU]"
"43","3.155645841","192.168.110.183","192.168.110.71","TCP","66","33194  >  8000 [ACK] Seq=1166 Ack=93 Win=32128 Len=0 TSval=559225804 TSecr=4161928871"
"44","3.156768972","192.168.110.71","192.168.110.183","HTTP","68","HTTP/1.0 200 OK "
"45","3.158858797","192.168.110.183","192.168.110.71","TCP","66","33194  >  8000 [FIN, ACK] Seq=1166 Ack=96 Win=32128 Len=0 TSval=559225807 TSecr=4161928872"
"46","3.167328759","192.168.110.71","192.168.110.183","TCP","66","8000  >  33194 [ACK] Seq=96 Ack=1167 Win=31872 Len=0 TSval=4161928880 TSecr=559225807"
"47","4.171490876","192.168.110.183","192.168.110.71","TCP","74","33208  >  8000 [SYN] Seq=0 Win=32120 Len=0 MSS=1460 SACK_PERM TSval=559226819 TSecr=0 WS=128"
"48","4.185466504","192.168.110.71","192.168.110.183","TCP","74","8000  >  33208 [SYN, ACK] Seq=0 Ack=1 Win=31856 Len=0 MSS=1460 SACK_PERM TSval=4161929898 TSecr=559226819 WS=128"
"49","4.185583728","192.168.110.183","192.168.110.71","TCP","66","33208  >  8000 [ACK] Seq=1 Ack=1 Win=32128 Len=0 TSval=559226833 TSecr=4161929898"
"50","4.185735218","192.168.110.183","192.168.110.71","TCP","264","33208  >  8000 [PSH, ACK] Seq=1 Ack=1 Win=32128 Len=198 TSval=559226834 TSecr=4161929898 [TCP segment of a reassembled PDU]"
"51","4.185841141","192.168.110.183","192.168.110.71","HTTP","1033","POST / HTTP/1.1  (text/plain)"
"52","4.192355998","192.168.110.71","192.168.110.183","TCP","66","8000  >  33208 [ACK] Seq=1 Ack=1166 Win=31872 Len=0 TSval=4161929908 TSecr=559226834"
"53","4.195377833","192.168.110.71","192.168.110.183","TCP","158","8000  >  33208 [PSH, ACK] Seq=1 Ack=1166 Win=31872 Len=92 TSval=4161929911 TSecr=559226834 [TCP segment of a reassembled PDU]"
"54","4.195448188","192.168.110.183","192.168.110.71","TCP","66","33208  >  8000 [ACK] Seq=1166 Ack=93 Win=32128 Len=0 TSval=559226843 TSecr=4161929911"
"55","4.195582858","192.168.110.71","192.168.110.183","HTTP","68","HTTP/1.0 200 OK "
"56","4.198500019","192.168.110.183","192.168.110.71","TCP","66","33208  >  8000 [FIN, ACK] Seq=1166 Ack=96 Win=32128 Len=0 TSval=559226846 TSecr=4161929911"
"57","4.205539649","192.168.110.71","192.168.110.183","TCP","66","8000  >  33208 [ACK] Seq=96 Ack=1167 Win=31872 Len=0 TSval=4161929919 TSecr=559226846"
"58","4.578356796","192.168.110.164","224.0.0.251","MDNS","119","Standard query 0x0001 PTR _674A0243._sub._googlecast._tcp.local, ""QU"" question PTR _8E6C866D._sub._googlecast._tcp.local, ""QU"" question PTR _googlecast._tcp.local, ""QU"" question"
"59","5.210945858","192.168.110.183","192.168.110.71","TCP","74","33210  >  8000 [SYN] Seq=0 Win=32120 Len=0 MSS=1460 SACK_PERM TSval=559227859 TSecr=0 WS=128"
"60","5.218740749","192.168.110.71","192.168.110.183","TCP","74","8000  >  33210 [SYN, ACK] Seq=0 Ack=1 Win=31856 Len=0 MSS=1460 SACK_PERM TSval=4161930935 TSecr=559227859 WS=128"
"61","5.218868909","192.168.110.183","192.168.110.71","TCP","66","33210  >  8000 [ACK] Seq=1 Ack=1 Win=32128 Len=0 TSval=559227867 TSecr=4161930935"
"62","5.219137102","192.168.110.183","192.168.110.71","TCP","264","33210  >  8000 [PSH, ACK] Seq=1 Ack=1 Win=32128 Len=198 TSval=559227867 TSecr=4161930935 [TCP segment of a reassembled PDU]"
"63","5.219327493","192.168.110.183","192.168.110.71","HTTP","1033","POST / HTTP/1.1  (text/plain)"
"64","5.225945458","192.168.110.71","192.168.110.183","TCP","66","8000  >  33210 [ACK] Seq=1 Ack=199 Win=31872 Len=0 TSval=4161930940 TSecr=559227867"
"65","5.226090803","192.168.110.71","192.168.110.183","TCP","66","8000  >  33210 [ACK] Seq=1 Ack=1166 Win=31872 Len=0 TSval=4161930941 TSecr=559227867"
"66","5.229664855","192.168.110.71","192.168.110.183","TCP","158","8000  >  33210 [PSH, ACK] Seq=1 Ack=1166 Win=31872 Len=92 TSval=4161930944 TSecr=559227867 [TCP segment of a reassembled PDU]"
"67","5.229717087","192.168.110.183","192.168.110.71","TCP","66","33210  >  8000 [ACK] Seq=1166 Ack=93 Win=32128 Len=0 TSval=559227878 TSecr=4161930944"
"68","5.232347307","192.168.110.71","192.168.110.183","HTTP","68","HTTP/1.0 200 OK "
"69","5.233015863","192.168.110.183","192.168.110.71","TCP","66","33210  >  8000 [FIN, ACK] Seq=1166 Ack=96 Win=32128 Len=0 TSval=559227881 TSecr=4161930945"
"70","5.236727396","192.168.110.71","192.168.110.183","TCP","66","8000  >  33210 [ACK] Seq=96 Ack=1167 Win=31872 Len=0 TSval=4161930953 TSecr=559227881"
"71","5.610230765","192.168.110.164","224.0.0.251","MDNS","119","Standard query 0x0002 PTR _674A0243._sub._googlecast._tcp.local, ""QM"" question PTR _8E6C866D._sub._googlecast._tcp.local, ""QM"" question PTR _googlecast._tcp.local, ""QM"" question"
"72","6.245385195","192.168.110.183","192.168.110.71","TCP","74","33226  >  8000 [SYN] Seq=0 Win=32120 Len=0 MSS=1460 SACK_PERM TSval=559228893 TSecr=0 WS=128"
"73","6.339585637","192.168.110.71","192.168.110.183","TCP","74","8000  >  33226 [SYN, ACK] Seq=0 Ack=1 Win=31856 Len=0 MSS=1460 SACK_PERM TSval=4161932055 TSecr=559228893 WS=128"
"74","6.339677291","192.168.110.183","192.168.110.71","TCP","66","33226  >  8000 [ACK] Seq=1 Ack=1 Win=32128 Len=0 TSval=559228988 TSecr=4161932055"
"75","6.339964596","192.168.110.183","192.168.110.71","TCP","264","33226  >  8000 [PSH, ACK] Seq=1 Ack=1 Win=32128 Len=198 TSval=559228988 TSecr=4161932055 [TCP segment of a reassembled PDU]"
"76","6.340151602","192.168.110.183","192.168.110.71","HTTP","1033","POST / HTTP/1.1  (text/plain)"
"77","6.346346706","192.168.110.71","192.168.110.183","TCP","66","8000  >  33226 [ACK] Seq=1 Ack=1166 Win=31872 Len=0 TSval=4161932062 TSecr=559228988"
"78","6.350722263","192.168.110.71","192.168.110.183","TCP","158","8000  >  33226 [PSH, ACK] Seq=1 Ack=1166 Win=31872 Len=92 TSval=4161932065 TSecr=559228988 [TCP segment of a reassembled PDU]"
"79","6.350785014","192.168.110.183","192.168.110.71","TCP","66","33226  >  8000 [ACK] Seq=1166 Ack=93 Win=32128 Len=0 TSval=559228999 TSecr=4161932065"
"80","6.352786724","192.168.110.71","192.168.110.183","HTTP","68","HTTP/1.0 200 OK "
"81","6.353732951","192.168.110.183","192.168.110.71","TCP","66","33226  >  8000 [FIN, ACK] Seq=1166 Ack=96 Win=32128 Len=0 TSval=559229002 TSecr=4161932066"
"82","6.359140244","192.168.110.71","192.168.110.183","TCP","66","8000  >  33226 [ACK] Seq=96 Ack=1167 Win=31872 Len=0 TSval=4161932074 TSecr=559229002"
"83","6.580722019","192.168.110.164","224.0.0.251","MDNS","119","Standard query 0x0003 PTR _674A0243._sub._googlecast._tcp.local, ""QM"" question PTR _8E6C866D._sub._googlecast._tcp.local, ""QM"" question PTR _googlecast._tcp.local, ""QM"" question"
"84","7.366303944","192.168.110.183","192.168.110.71","TCP","74","33234  >  8000 [SYN] Seq=0 Win=32120 Len=0 MSS=1460 SACK_PERM TSval=559230014 TSecr=0 WS=128"
"85","7.379319166","192.168.110.71","192.168.110.183","TCP","74","8000  >  33234 [SYN, ACK] Seq=0 Ack=1 Win=31856 Len=0 MSS=1460 SACK_PERM TSval=4161933094 TSecr=559230014 WS=128"
"86","7.379438890","192.168.110.183","192.168.110.71","TCP","66","33234  >  8000 [ACK] Seq=1 Ack=1 Win=32128 Len=0 TSval=559230027 TSecr=4161933094"
"87","7.379585276","192.168.110.183","192.168.110.71","TCP","264","33234  >  8000 [PSH, ACK] Seq=1 Ack=1 Win=32128 Len=198 TSval=559230027 TSecr=4161933094 [TCP segment of a reassembled PDU]"
"88","7.379689481","192.168.110.183","192.168.110.71","HTTP","1033","POST / HTTP/1.1  (text/plain)"
"89","7.389655688","192.168.110.71","192.168.110.183","TCP","66","8000  >  33234 [ACK] Seq=1 Ack=1166 Win=31872 Len=0 TSval=4161933102 TSecr=559230028"
"90","7.389902946","192.168.110.71","192.168.110.183","TCP","158","8000  >  33234 [PSH, ACK] Seq=1 Ack=1166 Win=31872 Len=92 TSval=4161933105 TSecr=559230028 [TCP segment of a reassembled PDU]"
"91","7.389950335","192.168.110.183","192.168.110.71","TCP","66","33234  >  8000 [ACK] Seq=1166 Ack=93 Win=32128 Len=0 TSval=559230038 TSecr=4161933105"
"92","7.390068913","192.168.110.71","192.168.110.183","HTTP","68","HTTP/1.0 200 OK "
"93","7.392905770","192.168.110.183","192.168.110.71","TCP","66","33234  >  8000 [FIN, ACK] Seq=1166 Ack=96 Win=32128 Len=0 TSval=559230041 TSecr=4161933105"
"94","7.398888816","192.168.110.71","192.168.110.183","TCP","66","8000  >  33234 [ACK] Seq=96 Ack=1167 Win=31872 Len=0 TSval=4161933114 TSecr=559230041"
"95","8.404486431","192.168.110.183","192.168.110.71","TCP","74","33238  >  8000 [SYN] Seq=0 Win=32120 Len=0 MSS=1460 SACK_PERM TSval=559231052 TSecr=0 WS=128"
"96","8.417696047","192.168.110.71","192.168.110.183","TCP","74","8000  >  33238 [SYN, ACK] Seq=0 Ack=1 Win=31856 Len=0 MSS=1460 SACK_PERM TSval=4161934132 TSecr=559231052 WS=128"
"97","8.417813063","192.168.110.183","192.168.110.71","TCP","66","33238  >  8000 [ACK] Seq=1 Ack=1 Win=32128 Len=0 TSval=559231066 TSecr=4161934132"
"98","8.417948253","192.168.110.183","192.168.110.71","TCP","264","33238  >  8000 [PSH, ACK] Seq=1 Ack=1 Win=32128 Len=198 TSval=559231066 TSecr=4161934132 [TCP segment of a reassembled PDU]"
"99","8.418031106","192.168.110.183","192.168.110.71","HTTP","1033","POST / HTTP/1.1  (text/plain)"
"100","8.425570969","192.168.110.71","192.168.110.183","TCP","66","8000  >  33238 [ACK] Seq=1 Ack=1166 Win=31872 Len=0 TSval=4161934140 TSecr=559231066"
"101","8.431232544","192.168.110.71","192.168.110.183","TCP","158","8000  >  33238 [PSH, ACK] Seq=1 Ack=1166 Win=31872 Len=92 TSval=4161934145 TSecr=559231066 [TCP segment of a reassembled PDU]"
"102","8.431278424","192.168.110.183","192.168.110.71","TCP","66","33238  >  8000 [ACK] Seq=1166 Ack=93 Win=32128 Len=0 TSval=559231079 TSecr=4161934145"
"103","8.431398511","192.168.110.71","192.168.110.183","HTTP","68","HTTP/1.0 200 OK "
"104","8.433882601","192.168.110.183","192.168.110.71","TCP","66","33238  >  8000 [FIN, ACK] Seq=1166 Ack=96 Win=32128 Len=0 TSval=559231082 TSecr=4161934146"
"105","8.440740838","192.168.110.71","192.168.110.183","TCP","66","8000  >  33238 [ACK] Seq=96 Ack=1167 Win=31872 Len=0 TSval=4161934156 TSecr=559231082"
"106","9.445174297","192.168.110.183","192.168.110.71","TCP","74","33252  >  8000 [SYN] Seq=0 Win=32120 Len=0 MSS=1460 SACK_PERM TSval=559232093 TSecr=0 WS=128"
"107","9.458539146","192.168.110.71","192.168.110.183","TCP","74","8000  >  33252 [SYN, ACK] Seq=0 Ack=1 Win=31856 Len=0 MSS=1460 SACK_PERM TSval=4161935175 TSecr=559232093 WS=128"
"108","9.458657307","192.168.110.183","192.168.110.71","TCP","66","33252  >  8000 [ACK] Seq=1 Ack=1 Win=32128 Len=0 TSval=559232107 TSecr=4161935175"
"109","9.458797184","192.168.110.183","192.168.110.71","TCP","264","33252  >  8000 [PSH, ACK] Seq=1 Ack=1 Win=32128 Len=198 TSval=559232107 TSecr=4161935175 [TCP segment of a reassembled PDU]"
"110","9.458890557","192.168.110.183","192.168.110.71","HTTP","1033","POST / HTTP/1.1  (text/plain)"
"111","9.464706172","192.168.110.71","192.168.110.183","TCP","66","8000  >  33252 [ACK] Seq=1 Ack=1166 Win=31872 Len=0 TSval=4161935181 TSecr=559232107"
"112","9.467370706","192.168.110.71","192.168.110.183","TCP","158","8000  >  33252 [PSH, ACK] Seq=1 Ack=1166 Win=31872 Len=92 TSval=4161935184 TSecr=559232107 [TCP segment of a reassembled PDU]"
"113","9.467439290","192.168.110.183","192.168.110.71","TCP","66","33252  >  8000 [ACK] Seq=1166 Ack=93 Win=32128 Len=0 TSval=559232115 TSecr=4161935184"
"114","9.468159765","192.168.110.71","192.168.110.183","HTTP","68","HTTP/1.0 200 OK "
"115","9.470440444","192.168.110.183","192.168.110.71","TCP","66","33252  >  8000 [FIN, ACK] Seq=1166 Ack=96 Win=32128 Len=0 TSval=559232118 TSecr=4161935184"
"116","9.482378664","192.168.110.71","192.168.110.183","TCP","66","8000  >  33252 [ACK] Seq=96 Ack=1167 Win=31872 Len=0 TSval=4161935192 TSecr=559232118"
"117","10.482658489","192.168.110.183","192.168.110.71","TCP","74","33258  >  8000 [SYN] Seq=0 Win=32120 Len=0 MSS=1460 SACK_PERM TSval=559233131 TSecr=0 WS=128"
"118","10.493953876","192.168.110.71","192.168.110.183","TCP","74","8000  >  33258 [SYN, ACK] Seq=0 Ack=1 Win=31856 Len=0 MSS=1460 SACK_PERM TSval=4161936210 TSecr=559233131 WS=128"
"119","10.494075162","192.168.110.183","192.168.110.71","TCP","66","33258  >  8000 [ACK] Seq=1 Ack=1 Win=32128 Len=0 TSval=559233142 TSecr=4161936210"
"120","10.494315233","192.168.110.183","192.168.110.71","TCP","264","33258  >  8000 [PSH, ACK] Seq=1 Ack=1 Win=32128 Len=198 TSval=559233142 TSecr=4161936210 [TCP segment of a reassembled PDU]"
"121","10.494486772","192.168.110.183","192.168.110.71","HTTP","1033","POST / HTTP/1.1  (text/plain)"
"122","10.508261822","192.168.110.71","192.168.110.183","TCP","66","8000  >  33258 [ACK] Seq=1 Ack=1166 Win=31872 Len=0 TSval=4161936224 TSecr=559233142"
"123","10.514550391","192.168.110.71","192.168.110.183","TCP","158","8000  >  33258 [PSH, ACK] Seq=1 Ack=1166 Win=31872 Len=92 TSval=4161936227 TSecr=559233142 [TCP segment of a reassembled PDU]"
"124","10.514633818","192.168.110.183","192.168.110.71","TCP","66","33258  >  8000 [ACK] Seq=1166 Ack=93 Win=32128 Len=0 TSval=559233163 TSecr=4161936227"
"125","10.516781806","192.168.110.71","192.168.110.183","HTTP","68","HTTP/1.0 200 OK "
"126","10.517256533","192.168.110.183","192.168.110.71","TCP","66","33258  >  8000 [FIN, ACK] Seq=1166 Ack=96 Win=32128 Len=0 TSval=559233165 TSecr=4161936228"
"127","10.523549373","192.168.110.71","192.168.110.183","TCP","66","8000  >  33258 [ACK] Seq=96 Ack=1167 Win=31872 Len=0 TSval=4161936238 TSecr=559233165"
"128","11.528670905","192.168.110.183","192.168.110.71","TCP","74","33274  >  8000 [SYN] Seq=0 Win=32120 Len=0 MSS=1460 SACK_PERM TSval=559234176 TSecr=0 WS=128"
"129","11.540059140","192.168.110.71","192.168.110.183","TCP","74","8000  >  33274 [SYN, ACK] Seq=0 Ack=1 Win=31856 Len=0 MSS=1460 SACK_PERM TSval=4161937257 TSecr=559234176 WS=128"
"130","11.540182613","192.168.110.183","192.168.110.71","TCP","66","33274  >  8000 [ACK] Seq=1 Ack=1 Win=32128 Len=0 TSval=559234188 TSecr=4161937257"
"131","11.540331499","192.168.110.183","192.168.110.71","TCP","264","33274  >  8000 [PSH, ACK] Seq=1 Ack=1 Win=32128 Len=198 TSval=559234188 TSecr=4161937257 [TCP segment of a reassembled PDU]"
"132","11.540425913","192.168.110.183","192.168.110.71","HTTP","1033","POST / HTTP/1.1  (text/plain)"
"133","11.546853212","192.168.110.71","192.168.110.183","TCP","66","8000  >  33274 [ACK] Seq=1 Ack=1166 Win=31872 Len=0 TSval=4161937263 TSecr=559234188"
"134","11.549097384","192.168.110.71","192.168.110.183","TCP","158","8000  >  33274 [PSH, ACK] Seq=1 Ack=1166 Win=31872 Len=92 TSval=4161937266 TSecr=559234188 [TCP segment of a reassembled PDU]"
"135","11.549172582","192.168.110.183","192.168.110.71","TCP","66","33274  >  8000 [ACK] Seq=1166 Ack=93 Win=32128 Len=0 TSval=559234197 TSecr=4161937266"
"136","11.551572463","192.168.110.71","192.168.110.183","HTTP","68","HTTP/1.0 200 OK "
"137","11.552148582","192.168.110.183","192.168.110.71","TCP","66","33274  >  8000 [FIN, ACK] Seq=1166 Ack=96 Win=32128 Len=0 TSval=559234200 TSecr=4161937266"
"138","11.591289483","192.168.110.71","192.168.110.183","TCP","66","8000  >  33274 [ACK] Seq=96 Ack=1167 Win=31872 Len=0 TSval=4161937279 TSecr=559234200"
"139","12.563580480","192.168.110.183","192.168.110.71","TCP","74","33286  >  8000 [SYN] Seq=0 Win=32120 Len=0 MSS=1460 SACK_PERM TSval=559235211 TSecr=0 WS=128"
"140","12.575279347","192.168.110.71","192.168.110.183","TCP","74","8000  >  33286 [SYN, ACK] Seq=0 Ack=1 Win=31856 Len=0 MSS=1460 SACK_PERM TSval=4161938292 TSecr=559235211 WS=128"
"141","12.575406933","192.168.110.183","192.168.110.71","TCP","66","33286  >  8000 [ACK] Seq=1 Ack=1 Win=32128 Len=0 TSval=559235223 TSecr=4161938292"
"142","12.575658982","192.168.110.183","192.168.110.71","TCP","264","33286  >  8000 [PSH, ACK] Seq=1 Ack=1 Win=32128 Len=198 TSval=559235224 TSecr=4161938292 [TCP segment of a reassembled PDU]"
"143","12.575832500","192.168.110.183","192.168.110.71","HTTP","1033","POST / HTTP/1.1  (text/plain)"
"144","12.586608576","192.168.110.71","192.168.110.183","TCP","66","8000  >  33286 [ACK] Seq=1 Ack=1166 Win=31872 Len=0 TSval=4161938302 TSecr=559235224"
"145","12.587547823","192.168.110.71","192.168.110.183","TCP","158","8000  >  33286 [PSH, ACK] Seq=1 Ack=1166 Win=31872 Len=92 TSval=4161938304 TSecr=559235224 [TCP segment of a reassembled PDU]"
"146","12.587604534","192.168.110.183","192.168.110.71","TCP","66","33286  >  8000 [ACK] Seq=1166 Ack=93 Win=32128 Len=0 TSval=559235236 TSecr=4161938304"
"147","12.588731723","192.168.110.71","192.168.110.183","HTTP","68","HTTP/1.0 200 OK "
"148","12.590203084","192.168.110.183","192.168.110.71","TCP","66","33286  >  8000 [FIN, ACK] Seq=1166 Ack=96 Win=32128 Len=0 TSval=559235238 TSecr=4161938305"
"149","12.601887890","192.168.110.71","192.168.110.183","TCP","66","8000  >  33286 [ACK] Seq=96 Ack=1167 Win=31872 Len=0 TSval=4161938318 TSecr=559235238"
"150","13.601654232","192.168.110.183","192.168.110.71","TCP","74","59318  >  8000 [SYN] Seq=0 Win=32120 Len=0 MSS=1460 SACK_PERM TSval=559236250 TSecr=0 WS=128"
"151","13.613307215","192.168.110.71","192.168.110.183","TCP","74","8000  >  59318 [SYN, ACK] Seq=0 Ack=1 Win=31856 Len=0 MSS=1460 SACK_PERM TSval=4161939330 TSecr=559236250 WS=128"
"152","13.613432510","192.168.110.183","192.168.110.71","TCP","66","59318  >  8000 [ACK] Seq=1 Ack=1 Win=32128 Len=0 TSval=559236261 TSecr=4161939330"
"153","13.613573845","192.168.110.183","192.168.110.71","TCP","264","59318  >  8000 [PSH, ACK] Seq=1 Ack=1 Win=32128 Len=198 TSval=559236261 TSecr=4161939330 [TCP segment of a reassembled PDU]"
"154","13.613658938","192.168.110.183","192.168.110.71","HTTP","1033","POST / HTTP/1.1  (text/plain)"
"155","13.621840002","192.168.110.71","192.168.110.183","TCP","66","8000  >  59318 [ACK] Seq=1 Ack=1166 Win=31872 Len=0 TSval=4161939337 TSecr=559236262"
"156","13.624957595","192.168.110.71","192.168.110.183","TCP","158","8000  >  59318 [PSH, ACK] Seq=1 Ack=1166 Win=31872 Len=92 TSval=4161939341 TSecr=559236262 [TCP segment of a reassembled PDU]"
"157","13.625029408","192.168.110.183","192.168.110.71","TCP","66","59318  >  8000 [ACK] Seq=1166 Ack=93 Win=32128 Len=0 TSval=559236273 TSecr=4161939341"
"158","13.627430068","192.168.110.71","192.168.110.183","HTTP","68","HTTP/1.0 200 OK "
"159","13.628031913","192.168.110.183","192.168.110.71","TCP","66","59318  >  8000 [FIN, ACK] Seq=1166 Ack=96 Win=32128 Len=0 TSval=559236276 TSecr=4161939341"
"160","13.635021422","192.168.110.71","192.168.110.183","TCP","66","8000  >  59318 [ACK] Seq=96 Ack=1167 Win=31872 Len=0 TSval=4161939349 TSecr=559236276"
"161","14.639543561","192.168.110.183","192.168.110.71","TCP","74","59328  >  8000 [SYN] Seq=0 Win=32120 Len=0 MSS=1460 SACK_PERM TSval=559237287 TSecr=0 WS=128"
"162","14.654108275","192.168.110.71","192.168.110.183","TCP","74","8000  >  59328 [SYN, ACK] Seq=0 Ack=1 Win=31856 Len=0 MSS=1460 SACK_PERM TSval=4161940371 TSecr=559237287 WS=128"
"163","14.654235810","192.168.110.183","192.168.110.71","TCP","66","59328  >  8000 [ACK] Seq=1 Ack=1 Win=32128 Len=0 TSval=559237302 TSecr=4161940371"
"164","14.654418754","192.168.110.183","192.168.110.71","TCP","264","59328  >  8000 [PSH, ACK] Seq=1 Ack=1 Win=32128 Len=198 TSval=559237302 TSecr=4161940371 [TCP segment of a reassembled PDU]"
"165","14.654492546","192.168.110.183","192.168.110.71","HTTP","1033","POST / HTTP/1.1  (text/plain)"
"166","14.662301523","192.168.110.71","192.168.110.183","TCP","66","8000  >  59328 [ACK] Seq=1 Ack=1166 Win=31872 Len=0 TSval=4161940379 TSecr=559237302"
"167","14.665535662","192.168.110.71","192.168.110.183","TCP","158","8000  >  59328 [PSH, ACK] Seq=1 Ack=1166 Win=31872 Len=92 TSval=4161940382 TSecr=559237302 [TCP segment of a reassembled PDU]"
"168","14.665604142","192.168.110.183","192.168.110.71","TCP","66","59328  >  8000 [ACK] Seq=1166 Ack=93 Win=32128 Len=0 TSval=559237313 TSecr=4161940382"
"169","14.665711887","192.168.110.71","192.168.110.183","HTTP","68","HTTP/1.0 200 OK "
"170","14.668413130","192.168.110.183","192.168.110.71","TCP","66","59328  >  8000 [FIN, ACK] Seq=1166 Ack=96 Win=32128 Len=0 TSval=559237316 TSecr=4161940382"
"171","14.676033228","192.168.110.71","192.168.110.183","TCP","66","8000  >  59328 [ACK] Seq=96 Ack=1167 Win=31872 Len=0 TSval=4161940391 TSecr=559237316"
"172","15.679867434","192.168.110.183","192.168.110.71","TCP","74","59344  >  8000 [SYN] Seq=0 Win=32120 Len=0 MSS=1460 SACK_PERM TSval=559238328 TSecr=0 WS=128"
"173","15.693435511","192.168.110.71","192.168.110.183","TCP","74","8000  >  59344 [SYN, ACK] Seq=0 Ack=1 Win=31856 Len=0 MSS=1460 SACK_PERM TSval=4161941409 TSecr=559238328 WS=128"
"174","15.693557837","192.168.110.183","192.168.110.71","TCP","66","59344  >  8000 [ACK] Seq=1 Ack=1 Win=32128 Len=0 TSval=559238341 TSecr=4161941409"
"175","15.693821187","192.168.110.183","192.168.110.71","TCP","264","59344  >  8000 [PSH, ACK] Seq=1 Ack=1 Win=32128 Len=198 TSval=559238342 TSecr=4161941409 [TCP segment of a reassembled PDU]"
"176","15.693997256","192.168.110.183","192.168.110.71","HTTP","1033","POST / HTTP/1.1  (text/plain)"
"177","15.705813752","192.168.110.71","192.168.110.183","TCP","66","8000  >  59344 [ACK] Seq=1 Ack=1166 Win=31872 Len=0 TSval=4161941420 TSecr=559238342"
"178","15.706017630","192.168.110.71","192.168.110.183","TCP","158","8000  >  59344 [PSH, ACK] Seq=1 Ack=1166 Win=31872 Len=92 TSval=4161941422 TSecr=559238342 [TCP segment of a reassembled PDU]"
"179","15.706073456","192.168.110.183","192.168.110.71","TCP","66","59344  >  8000 [ACK] Seq=1166 Ack=93 Win=32128 Len=0 TSval=559238354 TSecr=4161941422"
"180","15.708442087","192.168.110.71","192.168.110.183","HTTP","68","HTTP/1.0 200 OK "
"181","15.709290772","192.168.110.183","192.168.110.71","TCP","66","59344  >  8000 [FIN, ACK] Seq=1166 Ack=96 Win=32128 Len=0 TSval=559238357 TSecr=4161941423"
"182","15.713203254","192.168.110.71","192.168.110.183","TCP","66","8000  >  59344 [ACK] Seq=96 Ack=1167 Win=31872 Len=0 TSval=4161941430 TSecr=559238357"
"183","16.720680706","192.168.110.183","192.168.110.71","TCP","74","59348  >  8000 [SYN] Seq=0 Win=32120 Len=0 MSS=1460 SACK_PERM TSval=559239368 TSecr=0 WS=128"
"184","16.731818177","192.168.110.71","192.168.110.183","TCP","74","8000  >  59348 [SYN, ACK] Seq=0 Ack=1 Win=31856 Len=0 MSS=1460 SACK_PERM TSval=4161942449 TSecr=559239368 WS=128"
"185","16.731945764","192.168.110.183","192.168.110.71","TCP","66","59348  >  8000 [ACK] Seq=1 Ack=1 Win=32128 Len=0 TSval=559239380 TSecr=4161942449"
"186","16.732090171","192.168.110.183","192.168.110.71","TCP","264","59348  >  8000 [PSH, ACK] Seq=1 Ack=1 Win=32128 Len=198 TSval=559239380 TSecr=4161942449 [TCP segment of a reassembled PDU]"
"187","16.732166358","192.168.110.183","192.168.110.71","HTTP","1033","POST / HTTP/1.1  (text/plain)"
"188","16.739247984","192.168.110.71","192.168.110.183","TCP","66","8000  >  59348 [ACK] Seq=1 Ack=1166 Win=31872 Len=0 TSval=4161942456 TSecr=559239380"
"189","16.747469556","192.168.110.71","192.168.110.183","TCP","158","8000  >  59348 [PSH, ACK] Seq=1 Ack=1166 Win=31872 Len=92 TSval=4161942459 TSecr=559239380 [TCP segment of a reassembled PDU]"
"190","16.747540848","192.168.110.183","192.168.110.71","TCP","66","59348  >  8000 [ACK] Seq=1166 Ack=93 Win=32128 Len=0 TSval=559239395 TSecr=4161942459"
"191","16.748730528","192.168.110.71","192.168.110.183","HTTP","68","HTTP/1.0 200 OK "
"192","16.750178557","192.168.110.183","192.168.110.71","TCP","66","59348  >  8000 [FIN, ACK] Seq=1166 Ack=96 Win=32128 Len=0 TSval=559239398 TSecr=4161942460"
"193","16.754566961","192.168.110.71","192.168.110.183","TCP","66","8000  >  59348 [ACK] Seq=96 Ack=1167 Win=31872 Len=0 TSval=4161942472 TSecr=559239398"
"194","17.761523133","192.168.110.183","192.168.110.71","TCP","74","59350  >  8000 [SYN] Seq=0 Win=32120 Len=0 MSS=1460 SACK_PERM TSval=559240409 TSecr=0 WS=128"
"195","17.776111113","192.168.110.71","192.168.110.183","TCP","74","8000  >  59350 [SYN, ACK] Seq=0 Ack=1 Win=31856 Len=0 MSS=1460 SACK_PERM TSval=4161943493 TSecr=559240409 WS=128"
"196","17.776239480","192.168.110.183","192.168.110.71","TCP","66","59350  >  8000 [ACK] Seq=1 Ack=1 Win=32128 Len=0 TSval=559240424 TSecr=4161943493"
"197","17.776411905","192.168.110.183","192.168.110.71","TCP","264","59350  >  8000 [PSH, ACK] Seq=1 Ack=1 Win=32128 Len=198 TSval=559240424 TSecr=4161943493 [TCP segment of a reassembled PDU]"
"198","17.776504652","192.168.110.183","192.168.110.71","HTTP","1033","POST / HTTP/1.1  (text/plain)"
"199","17.782573291","192.168.110.71","192.168.110.183","TCP","66","8000  >  59350 [ACK] Seq=1 Ack=199 Win=31872 Len=0 TSval=4161943500 TSecr=559240424"
"200","17.783298243","192.168.110.71","192.168.110.183","TCP","66","8000  >  59350 [ACK] Seq=1 Ack=1166 Win=31872 Len=0 TSval=4161943501 TSecr=559240424"
"201","17.785203656","192.168.110.71","192.168.110.183","TCP","158","8000  >  59350 [PSH, ACK] Seq=1 Ack=1166 Win=31872 Len=92 TSval=4161943502 TSecr=559240424 [TCP segment of a reassembled PDU]"
"202","17.785275000","192.168.110.183","192.168.110.71","TCP","66","59350  >  8000 [ACK] Seq=1166 Ack=93 Win=32128 Len=0 TSval=559240433 TSecr=4161943502"
"203","17.787990666","192.168.110.71","192.168.110.183","HTTP","68","HTTP/1.0 200 OK "
"204","17.788459767","192.168.110.183","192.168.110.71","TCP","66","59350  >  8000 [FIN, ACK] Seq=1166 Ack=96 Win=32128 Len=0 TSval=559240436 TSecr=4161943503"
"205","17.797937413","192.168.110.71","192.168.110.183","TCP","66","8000  >  59350 [ACK] Seq=96 Ack=1167 Win=31872 Len=0 TSval=4161943515 TSecr=559240436"
"206","18.799897098","192.168.110.183","192.168.110.71","TCP","74","59356  >  8000 [SYN] Seq=0 Win=32120 Len=0 MSS=1460 SACK_PERM TSval=559241448 TSecr=0 WS=128"
"207","18.811057998","192.168.110.71","192.168.110.183","TCP","74","8000  >  59356 [SYN, ACK] Seq=0 Ack=1 Win=31856 Len=0 MSS=1460 SACK_PERM TSval=4161944528 TSecr=559241448 WS=128"
"208","18.811172200","192.168.110.183","192.168.110.71","TCP","66","59356  >  8000 [ACK] Seq=1 Ack=1 Win=32128 Len=0 TSval=559241459 TSecr=4161944528"
"209","18.811318899","192.168.110.183","192.168.110.71","TCP","264","59356  >  8000 [PSH, ACK] Seq=1 Ack=1 Win=32128 Len=198 TSval=559241459 TSecr=4161944528 [TCP segment of a reassembled PDU]"
"210","18.811405866","192.168.110.183","192.168.110.71","HTTP","1033","POST / HTTP/1.1  (text/plain)"
"211","18.819466727","192.168.110.71","192.168.110.183","TCP","66","8000  >  59356 [ACK] Seq=1 Ack=1166 Win=31872 Len=0 TSval=4161944535 TSecr=559241459"
"212","18.822452614","192.168.110.71","192.168.110.183","TCP","158","8000  >  59356 [PSH, ACK] Seq=1 Ack=1166 Win=31872 Len=92 TSval=4161944539 TSecr=559241459 [TCP segment of a reassembled PDU]"
"213","18.822500108","192.168.110.183","192.168.110.71","TCP","66","59356  >  8000 [ACK] Seq=1166 Ack=93 Win=32128 Len=0 TSval=559241470 TSecr=4161944539"
"214","18.822622747","192.168.110.71","192.168.110.183","HTTP","68","HTTP/1.0 200 OK "
"215","18.825085895","192.168.110.183","192.168.110.71","TCP","66","59356  >  8000 [FIN, ACK] Seq=1166 Ack=96 Win=32128 Len=0 TSval=559241473 TSecr=4161944539"
"216","18.832516426","192.168.110.71","192.168.110.183","TCP","66","8000  >  59356 [ACK] Seq=96 Ack=1167 Win=31872 Len=0 TSval=4161944549 TSecr=559241473"
"217","19.836462413","192.168.110.183","192.168.110.71","TCP","74","59370  >  8000 [SYN] Seq=0 Win=32120 Len=0 MSS=1460 SACK_PERM TSval=559242484 TSecr=0 WS=128"
"218","19.850852340","192.168.110.71","192.168.110.183","TCP","74","8000  >  59370 [SYN, ACK] Seq=0 Ack=1 Win=31856 Len=0 MSS=1460 SACK_PERM TSval=4161945565 TSecr=559242484 WS=128"
"219","19.850970188","192.168.110.183","192.168.110.71","TCP","66","59370  >  8000 [ACK] Seq=1 Ack=1 Win=32128 Len=0 TSval=559242499 TSecr=4161945565"
"220","19.851116938","192.168.110.183","192.168.110.71","TCP","264","59370  >  8000 [PSH, ACK] Seq=1 Ack=1 Win=32128 Len=198 TSval=559242499 TSecr=4161945565 [TCP segment of a reassembled PDU]"
"221","19.851205780","192.168.110.183","192.168.110.71","HTTP","1033","POST / HTTP/1.1  (text/plain)"
"222","19.856402505","192.168.110.71","192.168.110.183","TCP","66","8000  >  59370 [ACK] Seq=1 Ack=1166 Win=31872 Len=0 TSval=4161945574 TSecr=559242499"
"223","19.858604960","192.168.110.71","192.168.110.183","TCP","158","8000  >  59370 [PSH, ACK] Seq=1 Ack=1166 Win=31872 Len=92 TSval=4161945576 TSecr=559242499 [TCP segment of a reassembled PDU]"
"224","19.858675991","192.168.110.183","192.168.110.71","TCP","66","59370  >  8000 [ACK] Seq=1166 Ack=93 Win=32128 Len=0 TSval=559242507 TSecr=4161945576"
"225","19.858816597","192.168.110.71","192.168.110.183","HTTP","68","HTTP/1.0 200 OK "
"226","19.861471071","192.168.110.183","192.168.110.71","TCP","66","59370  >  8000 [FIN, ACK] Seq=1166 Ack=96 Win=32128 Len=0 TSval=559242509 TSecr=4161945577"
"227","19.869421476","192.168.110.71","192.168.110.183","TCP","66","8000  >  59370 [ACK] Seq=96 Ack=1167 Win=31872 Len=0 TSval=4161945584 TSecr=559242509"
"228","20.873004773","192.168.110.183","192.168.110.71","TCP","74","59380  >  8000 [SYN] Seq=0 Win=32120 Len=0 MSS=1460 SACK_PERM TSval=559243521 TSecr=0 WS=128"
"229","20.884701373","192.168.110.71","192.168.110.183","TCP","74","8000  >  59380 [SYN, ACK] Seq=0 Ack=1 Win=31856 Len=0 MSS=1460 SACK_PERM TSval=4161946602 TSecr=559243521 WS=128"
"230","20.884821668","192.168.110.183","192.168.110.71","TCP","66","59380  >  8000 [ACK] Seq=1 Ack=1 Win=32128 Len=0 TSval=559243533 TSecr=4161946602"
"231","20.885090745","192.168.110.183","192.168.110.71","TCP","264","59380  >  8000 [PSH, ACK] Seq=1 Ack=1 Win=32128 Len=198 TSval=559243533 TSecr=4161946602 [TCP segment of a reassembled PDU]"
"232","20.885254577","192.168.110.183","192.168.110.71","HTTP","1033","POST / HTTP/1.1  (text/plain)"
"233","20.892801338","192.168.110.71","192.168.110.183","TCP","66","8000  >  59380 [ACK] Seq=1 Ack=1166 Win=31872 Len=0 TSval=4161946609 TSecr=559243533"
"234","20.893334232","192.168.110.71","192.168.110.183","TCP","158","8000  >  59380 [PSH, ACK] Seq=1 Ack=1166 Win=31872 Len=92 TSval=4161946612 TSecr=559243533 [TCP segment of a reassembled PDU]"
"235","20.893389381","192.168.110.183","192.168.110.71","TCP","66","59380  >  8000 [ACK] Seq=1166 Ack=93 Win=32128 Len=0 TSval=559243541 TSecr=4161946612"
"236","20.894492144","192.168.110.71","192.168.110.183","HTTP","68","HTTP/1.0 200 OK "
"237","20.895962304","192.168.110.183","192.168.110.71","TCP","66","59380  >  8000 [FIN, ACK] Seq=1166 Ack=96 Win=32128 Len=0 TSval=559243544 TSecr=4161946612"
"238","20.901686194","192.168.110.71","192.168.110.183","TCP","66","8000  >  59380 [ACK] Seq=96 Ack=1167 Win=31872 Len=0 TSval=4161946619 TSecr=559243544"
"239","21.907874204","192.168.110.183","192.168.110.71","TCP","74","59388  >  8000 [SYN] Seq=0 Win=32120 Len=0 MSS=1460 SACK_PERM TSval=559244556 TSecr=0 WS=128"
"240","21.920210138","192.168.110.71","192.168.110.183","TCP","74","8000  >  59388 [SYN, ACK] Seq=0 Ack=1 Win=31856 Len=0 MSS=1460 SACK_PERM TSval=4161947638 TSecr=559244556 WS=128"
"241","21.920336319","192.168.110.183","192.168.110.71","TCP","66","59388  >  8000 [ACK] Seq=1 Ack=1 Win=32128 Len=0 TSval=559244568 TSecr=4161947638"
"242","21.920478018","192.168.110.183","192.168.110.71","TCP","264","59388  >  8000 [PSH, ACK] Seq=1 Ack=1 Win=32128 Len=198 TSval=559244568 TSecr=4161947638 [TCP segment of a reassembled PDU]"
"243","21.920599980","192.168.110.183","192.168.110.71","HTTP","1033","POST / HTTP/1.1  (text/plain)"
"244","21.930496619","192.168.110.71","192.168.110.183","TCP","66","8000  >  59388 [ACK] Seq=1 Ack=1166 Win=31872 Len=0 TSval=4161947645 TSecr=559244568"
"245","21.931592091","192.168.110.71","192.168.110.183","TCP","158","8000  >  59388 [PSH, ACK] Seq=1 Ack=1166 Win=31872 Len=92 TSval=4161947648 TSecr=559244568 [TCP segment of a reassembled PDU]"
"246","21.931666456","192.168.110.183","192.168.110.71","TCP","66","59388  >  8000 [ACK] Seq=1166 Ack=93 Win=32128 Len=0 TSval=559244580 TSecr=4161947648"
"247","21.931796906","192.168.110.71","192.168.110.183","HTTP","68","HTTP/1.0 200 OK "
"248","21.934441277","192.168.110.183","192.168.110.71","TCP","66","59388  >  8000 [FIN, ACK] Seq=1166 Ack=96 Win=32128 Len=0 TSval=559244582 TSecr=4161947648"
"249","21.938685424","192.168.110.71","192.168.110.183","TCP","66","8000  >  59388 [ACK] Seq=96 Ack=1167 Win=31872 Len=0 TSval=4161947657 TSecr=559244582"
"250","22.945928680","192.168.110.183","192.168.110.71","TCP","74","40248  >  8000 [SYN] Seq=0 Win=32120 Len=0 MSS=1460 SACK_PERM TSval=559245594 TSecr=0 WS=128"
"251","22.957207102","192.168.110.71","192.168.110.183","TCP","74","8000  >  40248 [SYN, ACK] Seq=0 Ack=1 Win=31856 Len=0 MSS=1460 SACK_PERM TSval=4161948675 TSecr=559245594 WS=128"
"252","22.957325315","192.168.110.183","192.168.110.71","TCP","66","40248  >  8000 [ACK] Seq=1 Ack=1 Win=32128 Len=0 TSval=559245605 TSecr=4161948675"
"253","22.957459567","192.168.110.183","192.168.110.71","TCP","264","40248  >  8000 [PSH, ACK] Seq=1 Ack=1 Win=32128 Len=198 TSval=559245605 TSecr=4161948675 [TCP segment of a reassembled PDU]"
"254","22.957551533","192.168.110.183","192.168.110.71","HTTP","1033","POST / HTTP/1.1  (text/plain)"
"255","22.962821317","192.168.110.71","192.168.110.183","TCP","66","8000  >  40248 [ACK] Seq=1 Ack=1166 Win=31872 Len=0 TSval=4161948681 TSecr=559245605"
"256","22.968015174","192.168.110.71","192.168.110.183","TCP","158","8000  >  40248 [PSH, ACK] Seq=1 Ack=1166 Win=31872 Len=92 TSval=4161948684 TSecr=559245605 [TCP segment of a reassembled PDU]"
"257","22.968085008","192.168.110.183","192.168.110.71","TCP","66","40248  >  8000 [ACK] Seq=1166 Ack=93 Win=32128 Len=0 TSval=559245616 TSecr=4161948684"
"258","22.968781004","192.168.110.71","192.168.110.183","HTTP","68","HTTP/1.0 200 OK "
